type,priority,summary
Bug,Major,Improper ordering of MINA filters
Improvement,Major,Ridiculously long release time due to the javadoc plugin
Bug,Major,Routing slip does not stop when Exchange is failed
Bug,Major,camel-example-etl throw error when running it.
Bug,Minor,doCatch() - Without any exception given should report that as a problem
Improvement,Trivial,seda component - Support no timeout for task to complete using timeout 0 or negative
Bug,Major,RejectedExecutionException after restarting camel context
Improvement,Minor,ExceptionHandler - Let it be able to log additional information such as a custom message or current exchange
Bug,Major,GroupedExchange in Aggregator is not working correctly
Improvement,Major,StrictHostKeyChecking Url Option
Improvement,Minor,UnitOfWork - Must be done in finally to ensure even when java.lang.Error is thrown fore reliable shutdown
Bug,Minor,camel-bindy dataformat KeyValue DSL can't work
Bug,Minor,camel-cache - Missing some classes in .jar
Bug,Minor,JDBC component doesn't preserve headers
Bug,Minor,The NP check of the remote service is wrong in CamelServiceExporter
Improvement,Minor,The  in Spring XML should support using serviceRef to lookup a reference for an endpoint
Improvement,Trivial,package will log WARN that you should use packageScan instead. We should keep both options so remove the WARN
Improvement,Trivial,MailConsumer should log exception in processRollback
Improvement,Minor,EventNotifier - Make it easy to ignore unwanted event categories
Improvement,Minor,camel-jdbc - Add option to select between JDBC 4 or 3 column label / name semantics
Improvement,Minor,Keep the lastModified timestamp when writing a file
Bug,Major,Remove sample caches from Camel Cache component
Improvement,Minor,Bean Expression for Non Registry beans can't reference an instance
Improvement,Major,Let ExpressionClause be reusable by other builders which are not route based
Improvement,Major,camel-bean - CGLIB proxied classed having trouble using annotated bean bindings
Improvement,Major,Remove some dependencies
Improvement,Minor,DefaultTypeConverterRegistry - Let it load upfront
Bug,Major,file component - Using fileName option should better detect constant vs dynamic name
Improvement,Major,DefaultCamelContext starts route services out of order
Improvement,Trivial,Mock component - expected header and property should output the name that fails
Bug,Major,BeanProcessor - Should differentiate between void and method returning null values
Bug,Major,cxfbean should  propagate CONTENT_TYPE for other camel component to use
Bug,Major,HttpHeaderFilterStrategy dosn't filters out 'Cache-Control'  'Connection'  'Pragma'  'Trailer'  'Transfer-Encoding'  'Upgrade'  'Via' and 'Warning' in method applyFilterToCamelHeaders
Bug,Minor,WARNING log of JmsTemporaryTopicEndpoint   JmsTemporaryQueueEndpoint don't have the ManagedResource annotation
Bug,Minor,HttpHeaderFilterStrategy should filter the HTTP 'Date' header when applyFilterToCamelHeaders is called
Improvement,Minor,seda endpoint - Let it be easily to configure size option to use an unbounded queue
Bug,Minor,Camel Velocity: change the case of all fields properties Header
Bug,Minor,Camel Freemarker: change the case of all fields properties Header
Improvement,Minor,NotifyBuilder - add reset method
Bug,Minor,DefaultCamelContext throws NPE in start() for route with no destination
Improvement,Minor,PollingConsumerPollStrategy - Should support boolean on begin to support skipping polling
Bug,Major,karaf features.xml  should use servicemix commons-pool bundle
Improvement,Trivial,SedaConsumer - Add check to limit the concurrentConsumer to < 1000 to prevent mistypes
Bug,Major,should use servicemix jaxws 2.1 spec bundle but not the geronimo one
Bug,Major,ConsumerTemplate don't support the jms uri with selector
Improvement,Major,Batch Resequencer issues with JMSPriority
Bug,Major,async route not working with Mina
Bug,Major,IndexOutOfBoundsException occur in UnsafeUriCharactersEncoder.class
Bug,Major,camel-http component should set Transfer-Encoding as chunked header for response message when checkChunked is true
Improvement,Minor,Allow recipientList to be used inside a CBR using Java DSL
Bug,Major,CXFRS Routing in 2.2.0 does not behave like in 2.0.0
Improvement,Major,Graceful shutdown - Add option to shutdown routes in reverse order as they were started
Improvement,Major,support get operation for cache
Improvement,Minor,Make use of testing mocks of the the GAE SDK
Bug,Minor,Invocation of hasNext() on org.apache.camel.util.ObjectHelper.createIterator(...).new Iterator() {...} return different results
Bug,Minor,Aggregator - Completion by batch consumer should trigger completion for the batch group if multiple correlation keys was used
Bug,Major,IOException: Bad file descriptor and FileNotFoundException
Bug,Minor,Inconsistency between IntrospectionSupport.getProperties() and IntrospectionSupport.getProperty()
Improvement,Minor,Aggregator - Add option to specify if completionInterval to have interval based completion
Bug,Major,DefaultPackageScanClassResolver can't read entries in an eclipse rcp app because it can't handle bundleresource - protocol
Improvement,Minor,XPath - Add type converters from the pesky XPath types to String  InputStream etc.
Improvement,Major,Smpp component schedule delivery time should default to null
Bug,Major,HttpEntityConverter should not create a InputStreamEntity by using the GZIPHelper.toGZIPInputStream()
Improvement,Major,camel-spring - Spring 3.0.x - Add depends-on in the namespace handler to make it easy for end users to use Spring and Camel without considering ordering of their beans
Bug,Major,cxfbean component should ignore the wsdlLocation in the POJO
Improvement,Major,RoutingSlip - Let it be expression based
Bug,Major,File name lost when it starts with the same characters as the relative directory on the endpoint
Bug,Major,Incomplete cleanup of jmx mbeans after context stop
Improvement,Major,Camel-bindy should be able to process fix length records
Improvement,Major,SendProcessor - When a route is started it should be able to warmup the Producer
Bug,Major,HttpProducer should not sending the Http headers with low case
Bug,Minor,AggregationStrategy returning null causes NPE
Bug,Major,camel-cxf feature doesn't include all cxf needs bundles
Bug,Major,VM endpoints with same name do not communicate if args don't match
Bug,Major,MailBinding can't handle the subject header with NO_ASCII code rightly.
Improvement,Minor,OnCompletion - Let it be executed last so the internal on completions can be executed beforehand
Bug,Minor,Bindy - No @Section causes a null key being generated which causes a NumberFormatException
Bug,Major,Escaped characters in http4 URLs do not work
Improvement,Minor,ManagementAgent should expose getter/setters for the JMX settings so you can set it easily from Java
Bug,Critical,Aggregation raises NullPointerException if last file in batch is not to be aggregated.
Improvement,Major,Graceful shutdown - Add option to shutdown manually added/started routes
Bug,Major,It is impossible to put # sign in SQL statement in camel-sql
Bug,Major,camel-castor relies on specific  out of date version of Castor
Bug,Minor,camel-ftp - SFTP in fileExists should handle exception being thrown with id code stating no such file
Bug,Major,Deadlock in org.apache.camel.util.DefaultTimeoutMap
Improvement,Major,Support for Binary Files in HttpProducer
Improvement,Major,CsvDataFromat delimiter should also be configurable in the XML/Spring DSL
Improvement,Minor,Thread Name Syntax - Do not output endpoint parameters to be less verbose
Bug,Critical,No consumers available on 'direct://xyz' endpoint
Bug,Major,convertBodyTo should handle null bodies
Improvement,Minor,Redelivery policy's retryUntil option should be renamed as retryWhile
Improvement,Major,URIs for viewing a route as a language clashes with any other possible sub resource for routes (such as status)
Improvement,Major,remove ugly warnings running tests since upgrading to jetty 7
Improvement,Major,update camel-http and camel-cxf features to use Commons Codec 1.4
Bug,Major,Oracle AQ does not support the JMSReplyTo property and therefore throws a 'JMS-102: Feature not supported' exception when the JMS provider tries to get it.
Improvement,Major,more eager validation of routes
Improvement,Major,Use  forkMode=once for the surefire plugin to significantly speed up tests
Improvement,Minor,Injecting Properties into the PropertiesComponent with Spring
Bug,Major,Broken failure reporting via DefaultProucerTemplate.asyncCallback and Synchronization.onFailure
Bug,Major,StreamProducer does not close stream in camel-stream
Bug,Major,org.apache.camel.component.test package is imported in camel-spring component - generates error on OSGI platform
Bug,Major,java.util.ConcurrentModificationException in Method org.apache.camel.util.CaseInsensitiveMap.putAll()
Improvement,Minor,Upgrade to JCR 2.x
Improvement,Minor,Upgrade to HawtDB 1.2
Improvement,Minor,When polling consumers is shutdown  do less verbose logging for rollback strategies
Improvement,Major,JmsProducer should support non blocking routing engine
Bug,Major,onException not working correctly when using routeContext
Bug,Major,java.net.SocketException: Too many open files with Apache Camel(Netty TCP) 2.4.0.
Bug,Minor,FtpComponent: If login fails and disconnect=true another connection is opened.
Bug,Major,camel-jpa doesn't use EntityManager.merge(entity) in the right way
Improvement,Minor,DefaultHttpBinding's populateRequestParameters should be more flexible when checking the content type on POST
Bug,Major,IllegalStateException in CamelContinuationServlet under heavy load
Improvement,Minor,Add removeEndpoints to CamelContext
Improvement,Major,Enable the deletion of routes via REST in camel-web
Improvement,Major,Adding routes straight from XML should have Camel prepare the RouteDefintion as its done like in camel-spring
Improvement,Minor,Velocity - Let it be able to load resources from both classpath and file system out of the box
Improvement,Major,provide an optional interface Endpoints can provide to generate a simple String ID which can be used within the class loader to make JMX / REST APIs simpler to avoid having to encode large URIs
Bug,Major,Flatpack component : unable to set the delimiter parameter in spring config file
Bug,Major,JettyHttpComponent.doStop() shuts down all servers in the VM  not just those associated with the component
Improvement,Minor,Archetype for creating component should have better sample component
Bug,Major,RouteBuilderRef should work out of the box with Spring 3 and dependency injection
Bug,Minor,Out of Heap memory issues with Camel-File processing large files
Improvement,Major,Simple language - Allow unlimited usage of and or operators in expression
Bug,Major,Cache Component needs to check for null values during GET operations
Bug,Major,netty timeout exception
Bug,Major,BeanConveter didn't try to covert the bean invocation argument rightly
Bug,Major,QuartzEndpoint does not set the job name properly
Bug,Major,@QueryParam doesn't work for CxfBeans
Bug,Minor,hawtdb - Should work in OSGi
Bug,Minor,Splitter EIP - The sub exchanges should not contains on completions from original Exchange
Improvement,Major,Performance/scalability issue for converter lookup
Bug,Minor,polling of feeds in FeedEntryPollingConsumer is broken.
Bug,Minor,Using $ in endpoint uri causes thread name parser to fail
Improvement,Major,Support user-defined shutdown timeout for CamelTestSupport
Bug,Major,cxfbean creates another instance of the class instead of directly using the referenced bean
Improvement,Minor,Use ActiveMQUuidGenerator as the default uuid generator as its faster than the JDK UUID generator
Improvement,Minor,Context-sensitive setting of default UuidGenerator
Bug,Minor,Route autoStartup configurable through Property
Bug,Major,OsgiDefaultCamelContext.getTypeConverterRegistry() returns null
Bug,Major,camel-ftp: fileExist=Fail not honored when producer works in FTP root path
Improvement,Minor,Aggregator EIP - Add option to ignore timeout completed
Improvement,Minor,Add alternative start token for simple language to avoid clash with Spring PropertyPlaceholder
Bug,Minor,camel-ftp - Setting password and username using UserInfo on uri does not work
Bug,Major,Confusing IllegalArgumentException when address attribute isn't specified on CXF endpoint.
Bug,Major,Concurrent consumers on seda endpoint can cause content routing to mismatch
Bug,Major,request/reply over JMS using temporary queues - if connection lost the temporary queue is not re-created which causes the producer to not work anymore
Bug,Major,The CxfConsumer's getContinuation method might throw NPE
Improvement,Minor,Add Exchange creation time to the exchange as property
Bug,Minor,Threads - Should allow using 0 in core pool size
Improvement,Minor,Route definitions should use boxed types and lazy evaluate defaults in the getter
Bug,Minor,GenericFileProducer.writeFile method creates instance of un-used InputStream
Bug,Major,JMX MBeans not registered for initiators
Bug,Minor,XmppEndPoint - setting login to false when creating an account results in no action
Improvement,Minor,RetryWhile is missing on the errorHandler DSL
Improvement,Minor,Let LazyLoadingTypeConverter load the converters from camel-core on startup
Improvement,Minor,support the Ordered Interceptor Strategy configured in spring
Improvement,Minor,CaseInsensitiveMap concurrency issue
Bug,Minor,Multicast with pipeline may cause wrong aggregated exchange
Improvement,Minor,Let custom Processor be managed in JMX when implementing ManagementAware
Improvement,Major,Multiple Endpoints with the Same Port in Restlet Component
Improvement,Minor,Add exception.stacktrace to Simple language
Improvement,Major,Stepwise change of directory unfit for production (ftp/ftps/sftp)
Bug,Major,cxfEndpoint of camel-cxf doesn't support  the shcemaLocation element
Bug,Major,NPE occurs without @Entity annotation
Improvement,Minor,Quartz component has minor issues with old versions of Quartz
Bug,Major,CxfRsInvoker produces NullpointerException when no ContinuationProvider is set in the InMessage
Bug,Minor,camel-irc component silently fails on nick collision
Bug,Minor,Hard coded locale in Bindy DatePatternFormat
Improvement,Major,Add option on FTP component so you can set which path separator char to use (eg windows vs unix)
Bug,Minor,spring-integration - Should have better configuration validation
Bug,Minor,PackageHelper - issue with version numbers which contains non decimal
Improvement,Minor,Tidying up strategy for managing resources in JMX
Improvement,Major,Use ServiceMix guice bundle
Bug,Minor,InterceptSendToEndpoint should check for if stop DSL has been used
Improvement,Minor,DefaultTimeoutMap should force scheduler in contructor
Bug,Critical,CamelContext is started twice when using camel-blueprint
Bug,Major,InterceptSendToEndpoint has issues with interception http endpoints which has multiple parameters
Improvement,Major,DataFormat - Support for CamelContextAware injection and start/stop callbacks with Service
Bug,Minor,Bindy should support clipping fields if they exceed maximum length allowed when using fixed length
Improvement,Major,Camel-XMPP Consumer doesn't pass XMPP headers
Improvement,Trivial,NotifyBuilder - Should throw exception if it hasn't been created and matches is invoked
Improvement,Minor,Some of JpaTraceEventMessage's attributes require @Lob annotation
Bug,Major,BindyCsvDataFormat broken for pipe delimited files
Bug,Major,ConcurrentModificationException in DefaultCamelContext.removeRouteDefinitions()
Improvement,Major,Additional TypeConverters
Bug,Major,scala - xpath not working together with choice/when
Improvement,Major,classpath problem with camel:dot and provided dependencies
Bug,Major,Aggregation fails to call onComplete for exchanges if the aggregation is after a bean or process.
Improvement,Minor,PollingConsumerPollStrategy - Add information to commit how many messages was polled
Bug,Minor,Jt400DataQueueConsumer incorrectly implements timeout semantics (jt400 component)
Improvement,Minor,camel-jms - Improve logic waiting for ReplyTo destination to be computed when doing request/reply
Bug,Major,Aggregator - The completionFromBatchConsumer option dont aggregate the last incoming exchange
Bug,Major,Detect uncaught exceptions in UoWProcessor to ensure UoW is done even for those uncaught exceptions
Improvement,Major,BindyFixedLengthDataFormat does a trim on Fixed Length record
Improvement,Minor,When Camel loads properties Camel should remove spaces (trim) from the end of the line.
Improvement,Major,Update archetypes to use new descriptor format
Improvement,Trivial,camel-snmp - Should mask password in the endpoint class
Improvement,Major,In some places we use ObjectHelper.loadClass() instead of ClassResolver.resolveClass()
Bug,Major,Concurrent writes to the same file has race condition
Improvement,Minor,JMS spec and JPA spec JARs should not be compile scoped by provided
Bug,Major,FTP rename fails
Improvement,Major,ServiceHelper - Avoid started/stopping service if already started/stopped
Improvement,Minor,Include test directories in the archetypes
Bug,Major,camel-josql doesnot export org.apache.camel.language.sql.*
Bug,Major,Inconsistent filename value when move attribute is used with File component
Improvement,Major,camel-smpp should unbind from SMSC before disconnecting
Improvement,Major,Force disable Quartz UpdateChecker
Bug,Major,Mistake in camel-eventAdmin feature
Improvement,Minor,Upgrade maven-bundle-plugin to version 1.3.4
Improvement,Minor,camel-core-xml - Add getter/sett for endpoints
Improvement,Major,Fix the Sonar Blocker: Performance - Maps and sets of URLs can be performance hogs
Bug,Critical,SMSC initiated unbind spawns exponential amounts of reconnect threads
Improvement,Minor,BinaryPredicate - Dont store state to ensure thread safety
Bug,Major,Make Content-Type HTTP Header Optional
Improvement,Major,Make it easier to derive from the Camel model
Improvement,Major,Java DSL - Allow load balancer to be used inside CBR
Bug,Minor,Endpoints may be shutdown twice as they are tracked in two lists in CamelContext
Improvement,Major,Tidy up AST model to proper support output or not
Bug,Minor,interceptFrom and from(Endpoint) don't work together
Bug,Major,OnException - The order they are defined in the RouteBuilder / XML should be preserved when you have multiple of the same exception type
Improvement,Minor,camel-jms: testConnectionOnStartup does not test connection for producers
Bug,Major,Sending to http endpoint may double encoding parameters
Improvement,Minor,Camel properties component - Add support for using jvm system/env in location
Improvement,Minor,ThreadPoolProfile - Use string types so its much easier to use property placeholders
Bug,Major,JAXB marshaling broken in 2.6.0
Improvement,Trivial,IgnoreInvalidEndpoint should log invalid endpoints at DEBUG level
Improvement,Minor,Add comments on the CamelContextTestSupport class to tell user to start the camel context manually when the test doesn't use the RouteBuilder
Improvement,Minor,Let log  log eip and mock producer be async processor
Bug,Major,sftp producer runs in exception fileName does not contain any path information
Improvement,Major,Add an example which use CXF bean binding and the OSGI HTTP Service (e.g. PAX Web with jetty)
Improvement,Major,After switching to slf4j  we can get rid of the 'isTraceEnabled'  'isDebugEnabled' and 'isInfoEnabled' statements
Bug,Major,Mail component issue with starttls option
Bug,Major,HttpProducer drops authentification parameters.
Improvement,Major,option to force sending original JMS message
Bug,Major,HTTP Producer seems to send an empty body request on redelivery when the original request fails due to a connection timeout
Bug,Major,org.apache.camel.component.file.strategy.MarkerFileExclusiveReadLockStrategy is not thread-safe
Improvement,Major,Try to copy file when rename fails
Improvement,Major,Polish the aws component
Bug,Major,Web Console: NPE when browsing routes with no description
Bug,Minor,maven eclipse goal failure
Improvement,Minor,The camel-cometd component does not support a custom SecurityPolicy or Extension as described on http://cometd.org/documentation/howtos/authentication
Bug,Major,BeanInfo not reset when new bean looked up
Improvement,Minor,Allow cometd component to send message headers with the message
Bug,Major,camel-jms default cache level should be CACHE_NONE when transaction is enabled
Bug,Major,SmppProducer sends incorrect data_coding parameter
Bug,Major,OSGi - No possibility to enable ehcache clustering as: ehcache.xml is ignored and there is no possibility to set cacheManagerFactory described camel-cache docs
Improvement,Minor,camel-cache - Should use Camel style constant keys
Bug,Minor,camel-web - Cannot browse endpoints if messages was consumed from jms queue
Bug,Minor,camel-xmpp - Should stop and clean session  so hot-deploy works
Improvement,Minor,Avoiding to process the bean which value is null in CamelBeanPostProcessor
Improvement,Trivial,camel-cache exception message: CamelCacheOperation not specified in the message header [CamelCacheKey]
Improvement,Major,Prevent 'FolderNotOpen' exception when closing out an email exchange
Bug,Major,Consumer URI parameters ignored after Route Restart
Bug,Major,CxfPayloadConverter may start failing to convert a CxfPayload to a Node
Bug,Major,JdbcAggregationRepository count (*) is not working with MySQL 5.0
Bug,Minor,AnnotationTypeConverterLoader fails for folders containing spaces
Improvement,Minor,Sending a message to log endpoint should not convert payload to StreamCache
Bug,Minor,Route cannot be started within web-console  if autoStartup='false' is set in camel.xml
Improvement,Minor,Script arguments
Improvement,Major,camel-soap - Add support for multiple parameters
Bug,Major,Dumping route to XML created by Java DSL using an expression may not output the actual used expression
Improvement,Major,Add send body operations to managed CamelContext so you can pass in headers as well
Bug,Major,Spring-WS producer doesn't propagate headers
Improvement,Major,Updated Hazelcast to version 1.9.3
Improvement,Major,Java DSL - New means to explicitly end try/catch blocks
Bug,Major,Camel FTP component fails to process multiple files at once from a specified folder
Improvement,Major,cxf:rsServer requires class instead of interface in the serviceClass attribute
Improvement,Minor,Replace the NoCacheStorage Class
Bug,Minor,ConcurrentModificationException at DefaultCamelContext.getRouteDefinition()
Bug,Critical,Issue using errorBuilderRef with the xml dsl
Improvement,Minor,Loop EIP - Add copy option to let it start next loop with a copy of the original exchange
Bug,Major,ChoiceProcessor : unable to find the mBeans processor
Bug,Major,javax.script dependency in camel-core
Bug,Major,continued(true) doesn't work when is invoked for the second time in the Camel flow
Bug,Major,Test failures in camel-hdfs on windows as Streams are not closed correctly
Improvement,Major,Create camel-quartz2 component to support Quartz 2.1.x
Bug,Major,FileIdempotentRepository fileStore does not get loaded on bootrapping  therefore files are processed again
Improvement,Minor,XML DSL having attributes that is a Class type should be a String type instead and use ClassResolver to lookup the class
Improvement,Minor,In doTry .. doCatch .. doFinally the FAILURE_ENDPOINT details should be available as well in case an exception was thrown
Bug,Major,Error using multiple error handlers and onException (java.lang.IllegalStateException: SendProcessor has not been started)
Improvement,Major,Refactorings in camel-cxf
Improvement,Major,SpringWebserviceConsumer should check if there is an Exception connected to the exchange and throw that one if it exists so that the default Errorhandling in spring-ws can take place
Improvement,Major,camel-sql - JDBC aggregation repository - Should use ClassResolver from Camel to load classes
Improvement,Minor,JMX API to create/delete endpoint
Improvement,Minor,Improve pom.xml for camel-jibx - use maven-jibx-plugin
Bug,Minor,ThrottlingInflightRoutePolicy can deadlock
Improvement,Minor,MockEndpoint.expectedHeaderReceived checks only one header
Bug,Major,LoanBroker example have some issues when it is deployed into osgi container like ServiceMix
Bug,Minor,Label of marshal and unmarshal processors do not appear in trace output
Improvement,Minor,Add getRouteId() to TraceEventMessage
Bug,Minor,Groovy language - classNotFoundException in OSGi environment
Bug,Major,Nullpointer in camel-mail when body is null
Bug,Minor,Using adviceWith 2 times or more in Java DSL with a context scoped onException causing the 1st advised route to not work as expected
Improvement,Trivial,A name should be specified in the karaf features-file
Improvement,Major,Add Lazy Connection to XMPP
Improvement,Major,Added wrap method for template  consumer and context in org.apache.camel.test.junit4.CamelContextSupport
Improvement,Major,avoid runtime package scanning to discover TypeConverters
Improvement,Minor,When performing lookup in registry and having expected type as parameter  then report better failure if ClassCastException
Bug,Major,Archetypes fail to build in offline mode
Bug,Minor,TraceInterceptor does not work correctly for AsyncProcessing
Bug,Minor,camel-ftp - Using tempFileName option should use the separator option to allow control of path separators in the generated file name
Bug,Major,Missing setter or constructor-argument for elementNameStrategyRef in SoapJaxbDataFormat
Improvement,Minor,Expose setDeliveryMode property in org.apache.camel.component.jms.JmsComponent
Bug,Major,Properties component - Cached locations may add duplicates
Bug,Major,The routeContext stack of DefaultUnitOfWork should be thread safe
