type,priority,summary
Bug,Major,vm component - Stopping a route when using multipleConsumers should not stop MP if there is other routes using it
Bug,Major,Headers are not set correctly in some situation
Bug,Critical,New restlet endpoints don't work if route is created after restlet server is started.
Bug,Major,Route with suspended SedaConsumer can't be stopped correctly
Improvement,Trivial,cxf endpoint's should log the parsing exception when failing to extract the root element name
Bug,Minor,File consumer - Race condition for markerFile read lock strategy
Bug,Major,baseResource of Jetty ServletContextHandler does not work when project deployed as a bundle
Bug,Major,endChoice() has no effect in nested choice definition
Bug,Major,camel-quartz - Stateful job - Redeploying bundle/war and having changed endpoint uri issue
Bug,Major,connectionTimeout property is ignored by JavaMail
Bug,Major,NULL values are not supported in named parameters
Improvement,Minor,Can't access to length of Array (java) from simple language
Bug,Minor,org.apache.camel.main.Main#doStop() throws java.lang.IndexOutOfBoundsException
Bug,Minor,SFTP: NPE if no private key file is supplied
Bug,Minor,Routing slip EIP - Does not send ExchangeSentEvent notifications
Improvement,Minor,FtpConsumer fills up log file with 'Cannot connect/login' WARN level messages
Bug,Minor,camel-netty - unable to consume on UDP multicast addresses
Bug,Minor,Wrong InputStream reference is used in method storeFile of class ScpOperations
Bug,Major,camel-cxf should shutdown the bus when the endpoint is stopped.
Bug,Minor,JMX - browsable endpoints such as seda has some attributes listed as unavaiable
Improvement,Major,SFTP endpoint fails if the server disconnected the socket
Bug,Minor,Predicates from java dsl are not dumped to xml correctly
Bug,Trivial,camel-cmis component: test packages have the wrong name
Bug,Major,camel-cxf ClassCastException when use cxf FailoverFeature
Improvement,Minor,Add ability to connect to SQS queue of different owner
Improvement,Minor,Support attaching to SQS queues where the user doesn't have permission to list the queues (manually build URL)
Improvement,Major,Add requestBufferSize and requestHeaderSize options for jetty
Improvement,Minor,SimpleLanguage.simple should detect if its a predicate and use that instead
Bug,Minor,SJMS component throws class cast error when used with IBM Webshpere MQ
Improvement,Major,FTP consumer - Add option to not use LIST command
Improvement,Major,Add allowNull option to @Converter to allow type converters to return null as valid response for special use-cases
Improvement,Major,Throttler does not honor time slots after period expires
Improvement,Major,Simple language - Have singleton language for better performance
Bug,Major,camel-dozer - Does not work well in OSGi Blueprint
Bug,Major,Using simple language OGNL expressions doesn't work for Bean Binding when a field is null
Bug,Major,Memory leak SoapOutInterceptor.writeSoapEnvelopeStart with security headers
Bug,Major,seda - queue size compare should use equals
Bug,Minor,mbeansRegistered in DefaultManagementAgent isn't ThreadSafe
Improvement,Major,camel-test-blueprint - Allow to register custom services in OSGi registry before Camel starts
Bug,Major,camel-blueprint - Using  and referrring to SSLContextParameters with property placeholders can lead to CircularDependencyException
Improvement,Minor,DefaultStreamCachingStrategy - Check for enabled in shouldSpoolCache method
Bug,Major,camel-yammer - Endpoint yammer:current throwns JsonMappingException exception
Bug,Major,Installation of camel-stomp feature fails
Improvement,Minor,binding component - Should start/stop its child services
Improvement,Major,Add cache option to beanRef and  in the DSL
Bug,Minor,Camel-Redis: Serializer passed through URI is used only on consumer
Bug,Major,XML Signature Component: Stream not closed in XmlSignerHelper.getXslTransform(String path)
Improvement,Minor,camel-jt400 - no longer able to configure a pollStrategy on Jt400DataQueueEndpoint
Improvement,Major,mustache component - Should use app class loader to load templates
Bug,Minor,Bean binding to covariant methods throws AmbiguousMethodCallException
Improvement,Minor,UnitUtilsTest cant manage a locale different from US
Bug,Minor,scp task does not respect StrictHostKeyChecking option
Bug,Minor,Null Pointer exception when removing SjmsComponent
Bug,Major,HttpConnectionManagerParams doesn't take effect when it is set to HttpComponent
Improvement,Major,InterceptFrom - Add support for using property placeholders
Bug,Major,rabbitmq component sends basic ack after channel closed when endpoint is set to autoAck
