type,priority,summary
Improvement,Minor,Camel-AWS: Add support for adding CacheControl and ContentDisposition metadata support when uploading file
Bug,Major,Connection to sftp server occasionally don't want to come back
Improvement,Major,camel-jdbc should provide a option not set the autoCommit flag
Bug,Minor,MDCUnitOfWork behaviour incorrect with nested routes
Improvement,Minor,Camel archetypes and examples should enable JMX for ActiveMQ
Bug,Minor,dump as xml fails if message body is already xml
Bug,Major,camel-aws won't build offline
Bug,Major,@Bean method name is ignored
Bug,Major,Camel CXF Endpoint creates incomplete WSDL
Improvement,Major,Add errorHandler option for DMLC to camel-jms
Bug,Minor,xslt component - Cannot load xslt file from file system
Bug,Minor,Camel Bindy Parser One to Many KvP Unmarshall Issue
Bug,Trivial,Example feature: wrong spring version
Bug,Major,Wrong exception uri when an HTTP error code is returned
Improvement,Minor,Validator component - Should be able to validate from a File payload
Improvement,Minor,Add String->TimeZone converter so that time zone can be specified for camel-quartz
Improvement,Major,Impossible to use placeholders in endpointName and serviceName attributes of cxf:cxfEndpoint
Bug,Minor,Ftp consumer using done file should cater for if stepwise has been enabled  and thus the done file path is to be calculated differently
Improvement,Minor,Using transacted in Java DSL without Spring XML setting up TX manager should report better error when not able to find a TX manager in the registry
Improvement,Minor,faster way of testing for file existence
Improvement,Major,Move org.apache.camel.Main to org.apache.camel.main.Main
Improvement,Major,Refactoring of management code to remove cycles and clearly separate between API and impl
Improvement,Minor,Camel test - Debugger should be explicit enabled if end user want to leverage it
Bug,Major,Bug in parsing of JPA uri
Bug,Minor,Freemarker - Loading template from file system fails
Bug,Minor,Camel-netty option 'encoder' and 'decoder' does not work
Bug,Major,It's hardly possible to use all expression of the Simple language to create file names in the file component
Improvement,Major,The debugger doesn't work in the CamelSpringTestSupport with route defined in XML
Improvement,Major,add support to set the cipher used for SFTP
Bug,Major,Exeptions cannot be propagated to the parent route when using LogEIP
Improvement,Major,Fix OSGi-exports of camel-soap
Improvement,Minor,The URI of the ServletEndpoint exposed to the JMX is not accurate
Improvement,Major,CamelLogger should not be a Processor and a log class at the same time and it should not have ServiceSupport
Improvement,Major,camel-hazelcast should allow the user to provide an existing instance to the component
Bug,Minor,Error in camel-restlet feature definition
Improvement,Minor,camel-csv - Make it consistent what unmarshal returns as object  so its the same for 1 or more rows
Bug,Major,Wrong slash in FTP component for doneFile
Bug,Minor,camel-bindy - Marshaling using CSV will insert wrong char separator if using an escaped separator char such as a pipe
Bug,Major,NullPointerException when unmarshalling using serialization data format
Improvement,Major,Resolve cycle between language.simple and language.simple.ast
Bug,Major,Unable to use cxf:binding configuration for the endpoint
Bug,Major,file: consumer does not create directory
Bug,Major,Because local PrintService objects on Windows have a name which is not their UNC path  the PrinterProducer can never find them.
Bug,Major,Exceptions are not propagated to the parent route when endpoint cannot be resolved in the RoutingSlip EIP
Improvement,Major,Be able to check classtype through simple language
Improvement,Major,Add a Tracer that uses JMX Notifications and provides full details of Camel Messages
Bug,Major,Recipient List cannot vary destination by changing property in an expression
Improvement,Minor,The SFTP component: the keyboard-interactive auth method support
Improvement,Minor,Spring-WS should populate Camel Header with the SOAP Header
Bug,Major,Unable to convert jms textmessage to bytemessage
Bug,Major,Can't find splitter bean in registry using multiple camel contexts with 'vm' endpoint
Improvement,Major,NotifyBuilder wereSentTo condition fires too eagerly
Improvement,Major,Support nested directories with multiple segment files in the HDFS endpoint consumer
Bug,Minor,NettyProducer creating new connection on every message
Bug,Major,Need to specify the sl4j-api version in the camel maven archetypes
Bug,Major,camel-file component does not close a file when it's used with camel-xslt
Bug,Major,SLF4JLog does not work with JdbcDriver for Quickfix/J
Bug,Major,Add option on XSLT to allow StAX
Bug,Minor,XQuery component does not work with StAXSource out of the box
Bug,Major,XPath will lock File input in case of an exception during xpath evaluation
Improvement,Major,Add default for transactionName in camel-jms
Improvement,Major,Improve URISupport.sanitizeUri and apply it in additional places
Improvement,Major,Add support for PGP data format in Java and XML DSLs
Bug,Minor,Stop or shutdown a route with a custom timeout value  will still log using the default timeout in the logs
Improvement,Minor,Do not print javax.jms.Message in toString in camel-jms
Bug,Major,Simple expression does not find method toString()
Bug,Major,NPE from DefaultCxfBinding when  is null
Bug,Major,NPE when using SEDA route and attaching an extra consumer
Bug,Major,Bindy does not support quoted value with separator char in CSV datasource
Bug,Minor,Bindy - CSV format - Should be able to marshal with quotes
Improvement,Major,Add option to override XSLT stylesheet used via header
Improvement,Minor,Text improvements to camel-example-cxf-proxy.
Bug,Minor,When a route is removed from camel  LifecycleStrategy is called twice
Bug,Minor,Scala DSL does not support defining route-scoped error handlers
Improvement,Major,file endpoint to raise a warning msgs if unable to auto-create the starting directory
Improvement,Major,Change cometd SslSocketConnetor to use SslSelectChannelConnector
Bug,Minor,Tokenize pair - evaluated as predicate should close input stream
Improvement,Minor,Unable to set logName on DefaultErrorHandler as well as executorService on LoggingErrorHandler
Improvement,Minor,Avoid explicit cast while using the CamelContext.getEndpoint() or ApplicationContext.getBean() API and better rely on the overloaded counterpart of them taking a class type as the second argument (implicit cast)
Bug,Minor,Extra request parameters sent by the camel-http4 component
Bug,Minor,camel-quartz - Using underscore in group name does not work
Improvement,Minor,Make Ant path matching in file / FTP component easier to use
Bug,Major,camel-aws can allow SNAPSHOT transitive dependencies
Improvement,Major,Improve Camel aws-sdb component
Bug,Major,After restarting route a camel-quartz component fires right away (and it shouldn't)
Improvement,Major,camel-jms - Include details about correlation id in exchange timeout exception if a reply message did not come back
Improvement,Major,Add replyTo option to camel mail component
Improvement,Major,interceptSendToEndpoint with predicate and skip
Bug,Major,camel-eventadmin do not work
Improvement,Minor,Log EIP - Check if it should log first before evaluating exchange
Improvement,Trivial,Tech edits of JavaDoc and other code comments -- lets -> (let's  allow  {})
Improvement,Major,Ability to specify the cache level on JMS reply to queue
Bug,Major,Remove ProducerCache from CamelContext service list when shutting down a route
Improvement,Major,camel-mina - Make it easier to use a custom thread pool for the consumer
Bug,Major,BAM - database constraint violation when restaring application
Bug,Major,xpath expression with $header with saxon may throw exception if header did not exist
Improvement,Minor,add feature for camel-context component
Bug,Major,Timed out Exchanges should be removed from seda queues
Bug,Minor,CamelContext autoStartup=false and starting context programmatically doesnt work
Bug,Major,Parameter binding not working with BeanExpression
Improvement,Minor,SedaConsumer - Should not poll if CamelContext is starting
Bug,Major,camel-blueprint - Using namespaces with xpath does not work as the namesapces is not parsed and injected into the camel model
Improvement,Minor,Testing headers in multiple messages
Bug,Major,ManagedBrowsableEndpoint are broken
Bug,Major,exchange.getIn().getBody(.class) throws an exception for Jaxb model objects
Bug,Critical,Camel 2.9.0 incapable of working with % in endpoint URIs
Improvement,Minor,antInclude support for case insensitive patterns
Bug,Major,Cannot use xquery predicate in filter after an xpath splitter.
Bug,Major,Problem Removing Endpoints
Bug,Major,Spring security example does not work
Bug,Minor,ManagedPerformanceCounterMBean should extend ManagedCounterMBean
Bug,Major,BindyDataFormat should not use the default encoding
Improvement,Minor,Add session information from cometd to camel message headers
Improvement,Minor,UnsupportedOperationException thrown if @Consume method is not public
Bug,Major,DigitalSignatureEndpoint not clearing headers after verify
Bug,Major,Error handler not called when recipient list has non existing endpoint
Bug,Major,Camel simple language wrong working with real number
Bug,Minor,simple without embedded text results in an NPE
Improvement,Major,Support unmarshall of CSV files that does not contain all fields described in the annotated POJO.
Bug,Major,Streaming splitter ignores exception handling
Bug,Major,CxfProducer should release the CXF when the Producer is stopped.
Bug,Major,Camel route with bean element sends on startup invalid message to target route that is represented by a proxy who exposes route
Bug,Minor,Memory leak in SedaComponent if adding and removing a lot of seda endpoints with different queue names
Bug,Minor,Memory leak in TimerListener if JMX enabled
Improvement,Major,DefaultUnitOfWork should copy headers from the original message if it's a JmsMessage
Improvement,Major,Offer a way to not set a transaction manager in camel-jms
Bug,Major,Bug: Unique Endpoints Leaking in DefaultInflightRepository
Bug,Minor,npe in camel 2.9.1 validator
Bug,Minor,camel-jt400 - Parameter length when doing Program Call issue
Improvement,Major,org.apache.camel.component.mybatis.MyBatisBatchConsumerTest.testBatchConsumer() fails unpredictable
Bug,Minor,Incorrect feature definition for camel-fop
Improvement,Minor,Timer component - Should use thread name pattern so the thread name is aligned with the Camel threads
Improvement,Minor,Add option autogenColumns to csv data format in XML DSL
Bug,Trivial,Timer endpoint getState does not work in JMX
Improvement,Minor,Add the options configRef and strategyRef to csv data format in XML DSL
Improvement,Minor,Set Restlet Server Options and Return HTTP Headers Set in Exchange
Bug,Major,CxfBeanDestination should copy the in message header to the out message
Bug,Major,RMI endpoint doesn't handle nested exception and raise CamelRuntimeException instead of RemoteException
Bug,Minor,bean component - @Handler should take precedence in a bean that implements Predicate
Bug,Minor,OnException - Handler or Continued predicate is invoked twice per exception
Improvement,Major,onException policy within global context lost when error handler redefined within route context.
Improvement,Major,Avoid parsing URI each time when getting uri from endpoint
Improvement,Major,'IOException: No space left on device' exception swallowed by camel
Bug,Minor,Backmerge CAMEL-5018 to the Bindy component for non-required fields
Bug,Minor,JMX issues on WebSphere
Improvement,Major,Bean component - Should preserver properties from exchange to allow to transfer state
Bug,Major,spring.schema is not up to date
Bug,Major,Strange warning appears: WARN  org.apache.camel.processor.DeadLetterChannel - Cannot determine current route from Exchange with id
Bug,Major,SftpChangedExclusiveReadLockStrategy does not check the correct field to determine if a file is changing
Improvement,Major,Implement connection pooling in jt400 component
Bug,Major,initialDelay and idempotentRepository Endpoint URI parameters fail to be read from Camel context when Turkish language is set in host operating system.
Bug,Minor,Potential dead-lock when shutting down Camel with NotifyBuilder doing notication
Bug,Major,Loop causes NullPointerException on error
Bug,Major,HazelcastComponent.doStop bombing out
Bug,Major,camel-netty can't distinguish between Sharable and Unsharable codecs
Bug,Critical,Camel 2.9.2 jetty component no longer works with Jetty 7
Improvement,Major,jt400: program call should support binary format
Bug,Major,LDAP Component lose headers
Improvement,Minor,Relax simple language checking for function start/end tokens  to only validate start tokens has appropriate end token
Bug,Major,Incorrect Content-Length returned for converted result objects with Unicode characters
Improvement,Minor,Make it possible to change the remote file name without changing the local file name
Improvement,Major,Add community and peer address of SNMP TRAP PDUs to camel-snmp header
Bug,Major,Jetty client can corrupt streams if used in a bridge mode (proxy)
Improvement,Minor,Dependencies with inconsitant paths in repository
Bug,Major,camel-stream overwrites files instead of appending
Bug,Major,camel-stream should not close stream after each write
Bug,Major,EventNotifiers don't work under Blueprint
Improvement,Trivial,Main is bound to DefaultCamelContext
Improvement,Major,camel-ftp - Add option to check files without downloading
Improvement,Major,camel-bindy - Do not use locale if not explicit configured
Improvement,Major,Add a Camel Component to support MQTT
Bug,Minor,camel-sql - Should support % sign in query
Bug,Major,Camel features file doesn't validate
Bug,Major,camel-jms - Exception thrown from destination resolver should trigger Camel exception handling
Improvement,Minor,SOAPMessage to InputStream conversion needed for some CXF SOAPMessage Provider scenarios
Bug,Minor,Shutting down one of the contexts breaks async redeliveries in others: RedeliveryErrorHandler has static reference to a thread pool
Bug,Minor,Mail component does not work as expected (Email Deletion is partially broken et Disconnect does not work well)
Improvement,Major,Improve performance of DefaultJmsKeyFormatStrategy
Bug,Major,CXF Transport loses HTTP Matrix parameters
Bug,Minor,Threads EIP hangs Junit4 tests using adviceWith
Improvement,Minor,Better error message when trying to write a null body as file
Bug,Major,MQTT Endpoint does not correctly return the MQTT-Payload
Bug,Major,ObjectAlreadyExistsException when 'redeploying' routes that uses CronScheduledRoutePolicy
Bug,Major,Simple does not handle empty values in predicates properly
Improvement,Minor,camel-jms - Log at INFO level if shared replyTo queues are in use  as they are not as fast as temporary or exclusive queues
Bug,Minor,Folder closed too early when working asynchronously
Bug,Major,IOConverter.toInputStream opens a BufferReader which will never be closed
Bug,Major,camel-jms consumer doesn't send back a reply in all cases
Improvement,Major,Support to build the camel-soap offline
Bug,Minor,camel-mybatis should do a proper transaction demarcation while reading/writing from/to database.
Improvement,Major,Add option to restrict HTTP method in camel-jetty and camel-servlet
Bug,Minor,file endpoints on windows without volume name in the path url not working in some cases
Bug,Minor,camel-testng - The spring base test class should use @AfterMethod on teardown as its parent does
Improvement,Minor,Add option to changed readLock to denote whether a zero file size is accepted or not
Bug,Minor,'ThreadID is already used' exception under heavy load
Bug,Minor,Maven archetype - Generates wrong plugin for surefire plugin
Improvement,Minor,Improve how the AWS-SQS component create a new queue with additional attributes
Bug,Major,Multiple restlet routes of the same restlet URI but different VERBs does not work in Apache Camel 2.10.0   both routes work in Apache Camel 2.9.1.
Bug,Minor,Possible issue in camel-apns - Reported on user forum
Bug,Major,Mina2 Consumer doesn't reliably work with SSL
Bug,Minor,File consumer - NPE if configured to consume from root directory
Improvement,Major,Support key password for private key access in XMLSecurity
Bug,Major,In ScheduledRoutePolicy a suspended route cannot be started
Bug,Minor,camel-beanio using beanio 2.0 should be using the 2012/03 beanio namespace
Improvement,Major,Make Spring Optional Bundle Import for CXF Transport
Bug,Major,camel-sftp's stepwise behavior to walk up and down relatively to avoid potential traversal issues
Bug,Minor,Logger Level is always at default level('ERROR') when error handler is LoggingErrorHandler
Improvement,Minor,camel-jackson - Make it easier to support List as output out of the box
Bug,Major,camel-hl7 bundle should specify the mina version
Improvement,Trivial,An exception when constructing JT400 endpoints should not leak the password
Bug,Minor,JmsToJmsTransactedSecurityTest in camel-jms fails every now and then
Bug,Minor,EventHelper.notifyRouteStarted skips all remaining notifiers if one if the notifiers ignores route events
Bug,Major,ObjectHelper.resolveUriPath is broken  can not handle:  '../../' correctly
Bug,Major,Enricher with async routing not handling exceptions thrown from AggregationStrategy
Bug,Major,EIPs using custom aggregation strategy should fail if not possible to find in registry
Bug,Major,Camel Endpoint ignores camelContextId property in Spring configuration
Bug,Minor,Recipient list EIP - Should shutdown thread pool if parallel mode enabled
Bug,Minor,camel-mqtt - Nullpointer Exception when disconnected from broker
Bug,Major,Using recipient list in a doTry ... doCatch situation dont work properly
Improvement,Major,Netty - Should use ordered thread pool
Bug,Minor,camel-jms - Should also allow multiple consumers from multiple routes from the same queue
Improvement,Minor,camel-netty - The ordered thread pool should be shared
Bug,Minor,NotifyBuilder should be thread safe
Bug,Major,Rest route returns response with http Status code 500 Internal Server Error when response has Last-Modified or Header-expires in header as string.
Bug,Critical,BlueprintCamelContext should not get started in the init() method but later when the blueprint container is fully initialized
Bug,Critical,Classloader mixup when consumers across bundles share the same camel-jetty port
Improvement,Major,Spring-WS consumer and producer do not propagate some custome headers and attachements to a response message
Bug,Major,HTTP 1.1 Host header not set correctly with camel-http4
Bug,Major,Update SqsConsumer to extend Visibility Timeout correctly
Bug,Major,Configuring jetty component with a different name dont work with jetty consumer
Improvement,Major,Camel Splitter eat up exceptions recorded by the underlying Scanner
Bug,Critical,Camel JMS producer can block a thread under specific circumstances
Improvement,Minor,RoutePolicySupport should provide some easy to use utility methods to suspend/resume routes as we have it already to start/stop routes
Bug,Minor,ActiveMQ target endpoint with transferExchange=true does not work together with source File endpoint with preMove option set
Improvement,Major,limitaions on s3 component. no means to specify acl on created object. objects do not inherit acl from the bucket they belong to.
Bug,Minor,regression : invalid SetQueueAttributesRequest created  works on 2.10.1
Improvement,Minor,option to add bundle directives in the generated test bundles by camel-test-blueprint
Improvement,Major,Adding blueprint based camel-cxf tests using camel-test-blueprint
Improvement,Major,camel-mongodb - Add converters for files or inputstreams
Bug,Major,Regression in validator component in 2.10.3
Bug,Major,Pre-XSLT and Validator Type Conversions from byte[] may easily fail
Bug,Minor,camel-quickfix: QuickfixjEndpoint should adhere the InOut exchange pattern if you would ask for this MEP
Improvement,Minor,FTP endpoints should support charset property like File endpoint does
Bug,Minor,File consumer - When using done file name then delete the file when batch is complete
Bug,Minor,When call removeRouteDefinition the route doesn't removed from collection of route Definitions.
Improvement,Major,Scala DSL: no tokenize('...') method
Bug,Major,NPE when jaxb fallback converter is used with RequestEntityConverter
Bug,Major,camel-netty - Producer should avoid blocking while waiting for connection
Bug,Minor,camel-jms - JmsPollingConsumer use the constant fields from JmsTemplate for receiveNoWait etc
Improvement,Major,SpringIntegrationConsumer should honor the 'inOut' instance variable by setting the MEP and sending back message headers
Bug,Trivial,SJMS component's pom.xml missing taskmanager package in camel.osgi.private.pkg
Bug,Major,Cache producer is not thread safe
Improvement,Minor,Dead Letter Channel - Store failed route id on Exchange
Bug,Major,ClassNotFoundException: weblogic.jndi.WLInitialContextFactory when starting the route via Karaf start-route(camel:route-start) command.
Improvement,Major,OsgiServiceRegistry to lookup services with filter on name=blah
Bug,Minor,Using annotations DSL in beans may cause async callback to be called twice
Bug,Critical,CamelJob implementation rely on some inconsistent endpoints LRU cache - Camel endpoints may not be called on quartz fire after some days of uptime
Bug,Major,RestletComponent component is not removing added route from routers list although route is removed from Context.
Improvement,Minor,Add PGP signature and signature verification support to PGPDataFormat
Bug,Minor,NoRedeliveryOnShutdown doesn't work for DeadLetterChannel
Improvement,Major,camel-bindy fixed length record improvements
Improvement,Major,Improve the BeanInfo performance
Bug,Major,Camel Email Component Missing Attachments
Improvement,Minor,Camel Spring registry does not look into parent contexts
Bug,Minor,camel-rss and camel-atom - Not installable in Karaf
Improvement,Minor,Check if body is a MimeMessage and send it directly without create a MimeMessage from body and headers
Bug,Major,CamelBlueprintContext may be wrongly started and this may lead to a deadlock
Bug,Major,SOAP over JMS does not work with camel-cxf endpoint
Bug,Major,CXFEndpoint blueprint config having binding element may lead to NPE
Improvement,Minor,Improvement to SqlProducer class
Bug,Major,Race condition in AggregatorProcessor recovery sometimes causes duplicates
Bug,Major,step in a  block runs when the  tag is closed in the wrong place
Bug,Critical,camel-jms: InOut exchange can time out even if response was received
Bug,Major,Simple language - bean function - issue when parameter value has comma
Bug,Major,NPE when using the imap mail component with quartz or the timer and pollEnrich
Bug,Major,Camel stream producer never close the stream of file
Bug,Minor,SQL component will not look for parameters in header when no body in message
Bug,Minor,Aggregate EIP - Completion from batch consumer should trigger first
Bug,Major,camel-http - When bridging endpoints then there may be double parameter values if client sends uri parameters
Improvement,Major,Camel 2.10.1 incapable of working with + in endpoint URIs
Improvement,Minor,Camel-AWS should support any implementation of AmazonXXX (not only AmazonXXXClient)
Bug,Minor,http4 component should default to charset based on content type
Bug,Major,TransferExchage InOut ActiveMQ Exception
Improvement,Major,json data format - Add support for configuring gson options
Bug,Major,camel-bindy - Multiple models in the same package lead to unpredictable results
Improvement,Minor,Http4 component does not support PATCH
Bug,Major,camel:run in blueprint is broken
Bug,Minor,camel-aws - Possible concurrent modification exception
Improvement,Minor,Sql component - Add noop option to execute the query but dont change the message body afterwards
Bug,Major,Scheduled thread pools is not removed from JMX when shutting down
Bug,Minor,Simple ognl expression - Possible NPE when using String replaceFirst and replacing with an empty string
Bug,Trivial,org.apache.camel.support.ServiceSupport: InputStream not being explicitly closed
Bug,Major,camel-cxfrs blueprint configure could not be installed if there are some subelement settings
Improvement,Minor,camel-stream - Shutdown thread pool on consumer should happen faster
Bug,Minor,StringQuoteHelper - Should ignore whitespace between quoted parameters
Improvement,Minor,Bean - Improve choose method logic for no parameter methods
Bug,Major,camel-example-reportincident failed
Bug,Major,camel-example-cxf-tomcat failed
Bug,Major,Restarting routes using sql aggregation repository may lead to Class loading issues
Improvement,Minor,Make SqsConsumer support async processors
Improvement,Minor,Camel archetype component - Use bundle packaging so component is ready to install in OSGi
Bug,Major,AdviceWith doesn't work with doTry
Bug,Major,Mina UDP default codec should keep the data as byte[]
Bug,Major,debugBefore() and debugAfter() not called if unit test extends CamelBlueprintTestSupport
Bug,Minor,Property placeholder optimization broke placeholders in Spring camelContext configuration
Bug,Major,Camel-validator not able to resolve schema when using useSharedSchema=false
Improvement,Minor,Moving logic out of getTypeConverter
Improvement,Minor,Control Bus - Add suspend and resume actions
Improvement,Minor,camel-netty - Loading key store and trust stores should support classpath as well
Bug,Minor,DefaultShutdownStrategy shutdown timeout of 0 will never timeout and go in negative time
Improvement,Major,link to camel registry in camel-stax is missing
Improvement,Trivial,Validations exception should include line/column
Improvement,Major,camel-sjms - Consumers should always use dedicated Sessions
