type,priority,summary
Bug,Critical,Embedded Derby fails under JBoss because of JMX-related conflicts
Bug,Major,LOBStreamControl.truncate() doesn't delete temporary files
Bug,Major,SQLSessionContext not correctly initialized in some non-method call nested contexts
Bug,Minor,Blob.setBytes differs between embedded and client driver when the specified length is invalid
Bug,Major,some messages are referenced but never used - MessageBundleTest output
Improvement,Minor,Failed tests should save the database off to the fail directory
Bug,Trivial,mismatch between error XCL30 and 22003.S.4 and parameters in usage
Bug,Major,testMetaDataQueryRunInSYScompilationSchema(.....upgradeTests.Changes10_4) fails on CVM/phoneME
Bug,Major,Incorrect ORDER BY caused by index
Bug,Major,GeneratedColumnsTest fails with ''F_MINUS' is not recognized as a function or procedure.' on cvm/phoneME
Improvement,Major,Add tests of generated columns when sql authorization is turned on
Improvement,Major,Improve performance of reading modified Clobs
Bug,Major,Generation clauses which mention user-coded functions may produce different resuls depending on who performs the triggering INSERT/UPDATE
Bug,Major,Cannot insert 994 character long string into indexed column
Bug,Major,Don't allow references to generated columns in the NEW transition variables of triggered actions of BEFORE triggers
Bug,Minor,PositionedStoreStream doesn't initialize itself properly
Bug,Major,Clob.truncate(long) in the client driver doesn't update the cached Clob length
Improvement,Minor,Add a facility to override the default set of old versions to be tested in the upgrade tests.
Bug,Minor,ResultSetStreamTest fails on case sensitive file systems  and isn't run as part of any suite
Bug,Minor,With IBM 1.6 T_RawStoreFactory fails with There should be 0 observers  but we still have 1 observers on Win 2K
Bug,Major,ORDER BY causes column to be returned
Bug,Major,ALTER COLUMN ... WITH DEFAULT NULL does not change the default
Bug,Major,ArrayIndexOutOfBoundsException in TopService.inService under heavy multithreaded use of EmbeddedDriver
Improvement,Major,Remove dependency of junit targets on deprecated jdk16 variable
Improvement,Minor,Improve length caching in TemporaryClob
Improvement,Major,Replace felix.jar file with the felix sources
Bug,Blocker,An attempt was made to access an out of range slot on a page
Bug,Minor,On Z/OS store/access.sql fails with encryptionAES and encryptionDES
Bug,Major,org.apache.derby.impl.load.Import needs to escape single quotes
Improvement,Trivial,Use helper methods from IdUtil to quote SQL identifiers in EmbedResultSet
Bug,Major,Multithreaded clob update causes growth in table that does not get reclaimed
Bug,Major,InputStream returned from Blob.getBinaryStream(long  long) terminates the stream by returning 0  should return -1
Bug,Major,ClientConnectionPoolDataSource.getPooledConnection and ClientXADataSource.getXAConnection ignore connection attributes
Bug,Minor,shutdown with incorrect permission on log files shows java.lang.NullPointerException  at org.apache.derby.impl.store.raw.log.LogToFile.flush(LogToFile.java:3964).  Should give bettter message.
Bug,Major,BTreeController.comparePreviousRecord() may fail to release latch on left-most leaf
Bug,Minor,BTreeScan.delete() throws AM_RECORD_NOT_FOUND if record is found
Improvement,Major,It should be possible to run unit tests right after 'ant all'
Bug,Major,Trigger  fails with ERROR 38000: The exception 'java.sql.SQLException: ResultSet not open  during VTIResultSet.getNextRowCore()
Bug,Minor,'testMixedInsertDelete(org.apache.derbyTesting.functionTests.tests.lang.NullableUniqueConstraintTest)org.apache.derby.client.am.BatchUpdateException'
Improvement,Major,Provide a way to drop statistics information
Bug,Major,SYSCS_UTIL.SYSCS_UPDATE_STATISTICS should update the store estimated row count for the table
Bug,Major,derbyclient.jar is not a complete OSGi bundle
Bug,Critical,The in-memory storage back end doesn't work on Windows
Bug,Minor,'testTableFunctionInJar' fails w/ 'The class 'DummyVTI' does not exist or is inaccessible...' on jvm1.4
Bug,Major,java.lang.VerifyError causing java.sql.SQLException: Cannot create an instance of generated class ... in lang.GeneratedColumnsTest and GeneratedColumnsPermsTest  on IBM iseries
Bug,Minor,NullPointerException in system.sttest run with 10.5.1.0
Improvement,Major,Create a test to verify that virgin metadata is identical to hard-upgraded metadata
Improvement,Minor,improvements to the mailjdbc test
Bug,Minor,'No method was found that matched the method call ....' in testPayment and testSubmitter (org.apache.derbyTesting.system.oe.test.OperationsTester) on 10.5.1.1 (RC2)
Bug,Major,Connections to on-disk db go to in-memory db if in-memory db with same name is booted
Improvement,Minor,Javadoc for BTreeLockingPolicy should not mention 'scan lock' anymore
Bug,Major,bootLock.java fails with missing exception on z/OS with  pmz3160sr2ifix-20081021_01(SR2+IZ32776+IZ33456)  and Windows Vista
Improvement,Minor,Convert altertable.sql to JUnit
Bug,Major,When using the FOR UPDATE OF clause with SUR (Scroll-insensive updatable result sets)  the updateRow() method crashes
Bug,Minor,SecureServerTest AssertionFailedError: Timed out waiting for network server to start
Bug,Major,'Table/View 'MAX_SCAN' does not exist' in org.apache.derbyTesting.functionTests.tests.store.IndexSplitDeadlockTest
Improvement,Minor,Remove unused pre-i18n constructors in BatchUpdateException
Bug,Major,XAResource.setTransactionTimeout() makes XAResource.start() fail with the client driver
Improvement,Minor,Improve transition from read-only to writable Clob representation
Improvement,Minor,convert checkConstraint.sql to JUnit
Bug,Minor,PropertySetter isn't able to recognize JDK without version number in path
Bug,Major,A lock could not be obtained within the time requested error in testBTreeForwardScan_fetchRows_resumeAfterWait_nonUnique_split
Bug,Major,SYSCS_UPDATE_STATISTICS takes unnecessary table lock
Bug,Minor,Update demo's to remove references to com.ibm.db2.jcc.DB2Driver
Bug,Minor,10.6 Upgrade test fails: SYSCS_UTIL.SYSCS_SET_XPLAIN_SCHEMA is not recognized as a function
Bug,Major,All Columns become Nullable when Using left join
Bug,Major,creation of FileInputStream in org.apache.derby.impl.tools.ij.Main not wrapped in privilege  block which can cause problems running under SecurityManager
Improvement,Major,Mutable public static variables
Bug,Minor,'compilation time did not compute (0 0 0 0) expected: but was:' in testGroupBySortProps(....tests.lang.XplainStatisticsTest)
Bug,Major,SQLException XJ215 on insert  with setCharacterStream() and autocommit off in mailjdbc test
Improvement,Minor,With derby client setTransactionIsolation executes and commits even if isolation has not changed
Bug,Major,Attempt to reuse streams in client on insert gives protocol exception and inserts wrong data
Bug,Major,hang in suites.all with ibm 1.5 on AIX after ttestDefaultProperties
Improvement,Minor,test nstest generates errors XBM06 re reencryption and 22003 re value outside range for decimal/numeric
Bug,Major,hang on winvista with IBM 1.6 SR5 in NSSecurityMechanismTest
Bug,Major,SQLSTATE 38000 (NullPointerException) at inner self join and value(x1  x2...)
Bug,Minor,ASSERT FAILED calling setTransactionIsolation checking isolation_ == level   on  pooled connection
Bug,Critical,Copy table content with 'INSERT INTO table SELECT FROM (...)' statement leads to corrupt data
Improvement,Major,Implement CROSS JOIN
Improvement,Major,TableFunctions provide no information to limit underlying query
Bug,Major,NullPointerException when preparing LEFT OUTER JOIN between VALUES statements
Improvement,Trivial,Replace Utils.min and Utils.max in the client driver with standard methods in java.lang.Math
Bug,Critical,Wrong result for simple join when index is created
Bug,Trivial,JavaDoc warnings in several classes in impl/sql/execute/rts
Bug,Major,Infinite loop in PredicateList.joinClauseTransitiveClosure()
Bug,Major,NullPointerException in RIGHT JOIN with NOT BETWEEN
Bug,Major,NullPointerException when comparing indexed column with result from a set operation
Improvement,Minor,Transformation to inner join not performed for certain three-way joins
Bug,Major,NullPointerException when USING clause contains all columns in both join tables
Bug,Major,Scalar subquery erroneously rejected for not returning exactly one row
Improvement,Trivial,Make getNegation() abstract in BinaryComparisonOperatorNode and UnaryComparisonOperatorNode
Bug,Major,NullPointerException with JOIN...USING and invalid table name in select list
Improvement,Major,Add proper delete mechanism for in-memory databases
Bug,Major,Memory leak when attempting to boot non-existing database with the in-memory back end
Bug,Minor,'Table/View 'T1' already exists in Schema 'APP'' in lang.DropTableTest on phoneME/cvm
Bug,Major,Evaluation of default value and identity in an INSERT result set evaluated too early.
Bug,Major,Wrap rollback in exception handlers in try-catch
Bug,Major,Prepared statement failure with CLOB: Stream has already been read and end-of-file reached and cannot be re-used.
Bug,Major,Forbid ordering operations on UDTs
Improvement,Trivial,Use helper methods from IdUtil instead of TupleDescriptor.quoteProtectName()
Bug,Major,Selecting / projecting a column whose value is represented by a stream more than once fails
Improvement,Minor,Use AtomicLong for XactFactory.tranId
Improvement,Major,Add import/export support for UDTs.
Bug,Major,Nullpointer when performing INSERT INTO
Bug,Major,Column list size mismatch with ORDER BY in INSERT statement
Bug,Major,j2ME test failures relating to runtimeStatisticsParser
Improvement,Minor,Document and clarify the use of DataValueDescriptor.setValue(InputStream int)
Improvement,Major,Refactor and extend data type cloning facilities
Improvement,Minor,If the CREATE TRIGGER does not have the REFERENCING clause  then there is no need to keep before and after values for the triggering table
Bug,Minor,Make it possible to put the optional clauses of a CREATE SEQUENCE statement in the arbitrary order allowed by the SQL Standard
Improvement,Minor,Avoid materialization where possible when cloning CollatorSQLClob
Bug,Major,test_11_tableFunctionColumns fails with weme (J2ME) with 'java.lang.NoClassDefFoundError: java.sql.DriverManager'
Improvement,Major,would like an alternative location for ant.properties
Bug,Major,NPE in JBitSet
Improvement,Major,Allow database user to execute stored procedures with same permissions as database owner and/or routine definer
Improvement,Minor,Remove lang/scrollCursors1.sql
Bug,Blocker,Complation of prepared statement results in Syntax Error
Bug,Major,failures in ij2 test with cdc/foundation (ibm's weme 6.2)
Bug,Major,Cannot use dblook on soft-upgraded database: Table/View 'SYS.SYSSEQUENCES' does not exist.
Improvement,Major,Corrupted database prevents startup and should be automatically repaired perhaps
Bug,Major,10 failures and 11 errors with IBM weme6.2/j9/cdc-foundation after revision 922304 for DERBY-4483
Bug,Major,test testBuiltinAuthenticationWithConfigurableHash fails from upgradeTests.Changes10_6 with ibm's j9
Bug,Minor,PropertySetter fails due to an empty jre/lib directory
Bug,Major,Invalid conversion from Timestamp to String when calling setTimestamp() with Calendar
Bug,Minor,Broken logic for avoiding testing across midnight in TimestampArithTest
Improvement,Minor,Expose names of top-level test suites for easier scripting
Bug,Minor,BaseTestCase.execJavaCmd() does not work with weme 6.2
Bug,Minor,Hidden assumptions in FromVTI.makeRestriction()
Improvement,Minor,Reduce size of encoding buffer for short character values
Improvement,Major,Write a regression test to verify the behavior of ResultSet.getBoolean()
Bug,Major,Unidiomatic error handling in TimestampArithTest
Improvement,Minor,Dead/unreachable code in OpenConglomerate.lockPositionForWrite()
Bug,Minor,Too few arguments when generating AM_RECORD_NOT_FOUND error
Bug,Major,Unions between BOOLEAN and non-BOOLEAN datatypes should be rejected
Bug,Minor,column rename looses 'identity' attribute.
Improvement,Minor,Internal assignment of tablenumer  columnnumber looks wrong in query tree  although no ill effects are seen.
Improvement,Minor,Add method to obtain a bogus port in TestConfiguration
Bug,Minor,Complex nested joins problems
Improvement,Major,Enable BOOLEAN typed columns
Improvement,Trivial,add more information to the XACT_PROTOCOL_VIOLATION returned from store.
Bug,Major,StringIndexOutOfBoundsException on syntax error (invalid COMMIT)
Bug,Minor,CheapDateFormatter returns incorrect and invalid date strings
Bug,Major,DERBY-4601 added a new message to derby.log during engine shutdown and it changed the database shutdown message. Need to update docs with that information
Bug,Major,test failure in derbynet/testProtocol.java with ibm jvms
Bug,Major,Files with missing ASF license headers
Bug,Major,NPE while inserting into a table which has a generated column and an insert trigger
Bug,Major,Missing escape for apostrophes in many messages
Bug,Major,Sequences do not work in INSERT/SELECT
Bug,Minor,setTimestamp() methods don't agree on trailing zeros
Bug,Major,ReplicationMessageTransmit run does not unwrap PrivilegedActionException which can lead to failure of replicationTests.ReplicationRun_Local_StateTest_part1_1
Bug,Major,Override mechanism for modules.properties works backwards
Bug,Minor,Errors should be displayed if using wrong CLASSPATH to make documentation target for release
Bug,Minor,Re-compilation may cause duplicate entries in the XPLAIN table
Bug,Minor,Missing doPrivileged in DatabaseClasses.WriteClassFile()
Improvement,Trivial,Simplify SYSCS_BULK_INSERT with IdUtil.mkQualifiedName()
Bug,Major,NullPointerException in testBoundaries with ibm jvm 1.6
Improvement,Minor,Unchecked warnings in JMXManagementService and VTI demos
Bug,Major,ClassCastException when calling boolean meta-data functions with 10.7 client against 10.6 server
Bug,Minor,Thread local TableDescriptor#referencedColumnMap is not removed from app threads when Derby is shut down
Improvement,Minor,Refactor access to primary structures in AlterTableConstantAction
Bug,Minor,EmbeddedXADataSource with ;create=true attribute set in setDatabaseName fails with java.sql.SQLException: Database not available
Bug,Major,Four replication tests fail on z/OS with junit.framework.AssertionFailedError: startMaster did not succeed.
Bug,Major,restoreIntrFlagIfSeen may throw ShutdownException causing confusing console stack trace at server shutdown
Bug,Major,Instability in Derby2017LayerBTest
Bug,Major,test failure in OSReadOnlyTest in assertDirectoryDeleted
Bug,Major,suites.All stuck in RAFContainer4.awaitRestoreChannel()
Bug,Minor,Embedded Derby does not start when derby.jar is dynamically uploaded / added to the classpath
Bug,Major,Backward  confusing error message when you use the wrong ResultSet.getXXX() method in the client driver
Bug,Major,AccessControlException when running AssertFailureTest from Ant
Bug,Major,Race condition in FileContainer#allocCache when reopening RAFContainer after interrupt
Bug,Major,Replication tests lose derby.log for slave
Bug,Major,Retrying after interrupts in store pops a bug in derbyall/storeall/storeunit/T_RawStoreFactory in some cases
Bug,Major,failure in jdbcapi.StatementJdbc20Test:testCompletionClosure_jdbc4_1 with j9 (j2ME/CDC)
Bug,Major,ALTER TABLE DROP COLUMN may leave triggers invalid even if they are not using the column getting dropped.
Bug,Major,BootLockTest can fail with ERROR XCY03: Required property 'derby.serviceProtocol' has not been set  with slow configurations
Improvement,Major,Release notes should specify which Java version is needed to run Derby
Bug,Minor,Intermittent bug in InterruptResilienceTest
Bug,Trivial,[patch] fix npe in error condition
Bug,Trivial,[patch] Client driver lexer to determine statement type: fix bad attempt at incrementing a variable
Improvement,Trivial,[patch] remove erroneous throws clauses on non derivable methods that don't throw
Bug,Minor,[patch] override equals correctly
Bug,Minor,Cannot find Ant libraries when building from NetBeans
Bug,Major,UpdateStatisticsTest fails after we enabled the automatic calculation of index statistics.
Bug,Trivial,[patch] derived InternalXact attempts (and fails) to override a method from base
Improvement,Trivial,[patch] System.arraycopy  being native  is more performant
Bug,Minor,[patch] bad field masking makes non functional rowsInput evaluation
Bug,Major,ResultSet.updateBoolean() on new BOOLEAN type throws exception
Bug,Major,Assert failures in UpdateStatisticsTest
Bug,Minor,Intermittent assert failure in AutomaticIndexStatisticsTest.testStatisticsCorrectness
Bug,Trivial,[patch] Bad name collision causes non functional method
Improvement,Trivial,[patch] reduce superfluous boxing histrionics
Bug,Major,Embedded driver allows updateBytes() on BOOLEAN column
Improvement,Trivial,[patch] remove unused fetching of data dictionary
Improvement,Trivial,[patch] use string buffers when building strings in loops
Bug,Minor,test failure(s) with IBM 1.4.2 in store.InterruptResilienceTest.testRAFWriteInterrupted: java.sql.SQLException: The exception 'junit.framework.AssertionFailedError: interrupt flag lost' was thrown while evaluating an expression.
Improvement,Trivial,[patch] move instanceof check up above where casts occur
Improvement,Trivial,[patch] remove non productive instanceof checks
Bug,Minor,Incorrect list of compatible JRE versions in client trace
Bug,Blocker,DERBY-4984 caused a regression which will not allow users to drop a table if the table was involved in a trigger action rebind during ALTER TABLE DROP COLUMN
Bug,Major,ShutdownException in ContextManager.checkInterrupt() during shutdown
Bug,Major,After specifying deregister=false on the engine shutdown URL  Derby forgets that the default behavior is deregister=true
Improvement,Major,Disable istat logging by default
Bug,Minor,NPE in istat daemon when encountering critical exception during shutdown
Improvement,Trivial,[patch] avoid Boolean allocations for rowset data in client cursor
Improvement,Trivial,[patch] avoid Integer allocations fetching client meta data info
Bug,Major,GetCurrentPropertiesTest depends on implicit ordering of test cases
Bug,Major,ProcedureInTriggerTest depends on implicit ordering of test cases
Bug,Major,Lacking cleanup in CheckConstraintTest.testJira4282()
Bug,Major,Assert failure in SavepointJdbc30Test.testReleaseSqlSavepointAndRollback
Bug,Major,ParameterMetaDataJdbc30Test fails with ''DUMMYINT' is not recognized as a function or procedure'
Bug,Major,testQualifiers(org.apache.derbyTesting.functionTests.tests.store.AccessTest)java.sql.SQLException: Table/View 'FOO' already exists in Schema 'APP'.
Bug,Major,nightly test failure in derbyall/storeall/storemore/SpaceTable
Bug,Major,Incomplete quoting of SQL identifiers in AlterTableConstantAction
Bug,Major,ParameterMetaDataJdbc30Test fails with ''PMDD' is not recognized as a function or procedure'
Bug,Major,Cannot rollback after syntax error in internal statement
Bug,Major,CLOB INOUT arg set to NULL by procedure does not preserve NULL value when re-invoked
Bug,Trivial,[patch] fix up sql cleanup handling
Improvement,Major,PropertySetter should ignore GCJ installations
Bug,Major,Setting up network server for management tests hangs intermittently
Bug,Major,Interrupt of create table or index (i.e. a container) will throw XSDF1 under NIO - connection survives
Bug,Major,Client driver silently truncates strings that exceed 32KB
Improvement,Major,Remove usages of DriverManager to obtain an Embedded Connection in Derby Server
Bug,Minor,assert failure in test testRAFReadWriteMultipleThreads: interrupted flag cleared
Improvement,Minor,DatabaseMetaData.getColumns(null  null  tableName  null) does not return the columns meta for a SYNONYM
Improvement,Minor,Simplify bytecode generation for concatenation operator
Bug,Minor,Warnings regarding XPath displayed when generating JavaDoc
Bug,Major,A table created with 10.0.2.1 with constraints cannot be dropped with 10.5 due to NullPointerException with insane build or ASSERT FAILED Failed to find sharable conglomerate descriptor for index conglomerate  with sane build
Bug,Minor,Engine code references org.apache.derby.shared.common.sanity.SanityManager
Bug,Major,Intermittent OutOfMemoryErrors in BasicSetup.testTriggersWithLOBcolumns()
Bug,Major,Large batch of DDL in a database procedure dies on a transaction severity error.
Improvement,Minor,Update tools/ide/netbeans directory
Bug,Major,Unable to boot 10.5.1.1 database - fails during soft/hard upgrade process for a new version number while trying to drop jdbc metadata
Bug,Major,test failure: NullPointerException with J2ME (weme 6.2) in testDerby4137_TransactionTimeoutSpecifiedNotExceeded(org.apache.derbyTesting.functionTests.tests.memory.XAMemTest)
Bug,Major,SQLAuthorisation and views
Improvement,Trivial,Change derby.tests.trace to print the class as well as fixture name
Improvement,Trivial,Remove dead methods (June 2011)
Bug,Major,Assert failure with CASE expression in GROUP BY clause
Bug,Major,Incorrect use of CharsetEncoder in DDMWriter
Bug,Major,Repeated database creation causes OutOfMemoryError
Bug,Major,Starting 7/13/2011 weme 6.2 upgrade tests started failing with 213 failures 127 errors with java.lang.IllegalAccessException
Bug,Major,URLCheck fails on phoneME
Bug,Major,ij3Test fails on phoneME
Improvement,Major,Restricted Table Function support should pass NOT EQUAL restrictions to initScan
Bug,Major,AssertionFailedError in testCaseCS4595B_NonUniqueIndex in AccessTest
Bug,Minor,NPE in BasicDatabase.stop in replication slave mode (dd.clearSequenceCaches)
Bug,Major,By default  only the DBO should be allowed to run several of the diagnostic VTIs.
Bug,Major,Intermittent failures in CompressTableTest and TruncateTableTest
Bug,Major,MemoryLeakFixesTest.testRepeatedDatabaseCreationWithAutoStats() fails on phoneME: java.lang.InternalError: Number of class names exceeds vm limit.
Bug,Major,SysDiagVTIMappingTest.test_5391() failed: java.text.ParseException: Unparseable date: 'Thu Sep 15 14:00:16 CEST 2011'
Improvement,Major,Make Derby run on Oracle Java ME Embedded Client
Bug,Minor,On z/OS testConnectWrongSubprotocolWithSystemProperty(org.apache.derbyTesting.functionTests.tests.tools.ConnectWrongSubprotocolTest)junit.framework.Asserti ailedError
Bug,Major,Unauthorized shutdown should not generate thread dump and javacore. AuthenticationTest dumps over 20 javacores with IBM JVM for normal user errors
Bug,Major,Empty MAPS table in toursdb
Bug,Major,SpawnedProcess.complete may fail to destroy the process when a timeout is specified
Bug,Major,ERROR 40001 deadlock in nstest on select max(serialkey)
Bug,Major,Problems running SecureServerTest and replication tests on Open JDK 7 for Mac OS X
Improvement,Minor,ant release should not modify drdamaint version
Improvement,Minor,Speed up message splitting in build
Improvement,Minor,Speed up creation of bin scripts
Improvement,Minor,Don't run MessageVetter unless messages have changed
Improvement,Minor,Reduce number of jar invocations in the buildjars target
Bug,Major,Restrictive file permissions: permissions removed also for owner on NTFS if Acl does not contain explicit entry for owner
Bug,Major,Same value returned by successive calls to a sequence generator.
Bug,Major,ClosedByInterruptException in AuthenticationTest
Improvement,Major,Subquery is only allowed to return a single column - When using derby with hibernate (or JPA) queries are created per JPA spec. For tables with multi-column PK  subqueries are created with two columns in select clause.
Bug,Major,SecureServerTest  Driver40UnbootedTest and replication tests not prepared for space in java.home
Bug,Major,XATransactionTest: Table/View 'DERBY1016' already exists
Bug,Major,SQLChar.getCollationKey NPE in index-stat-thread
Improvement,Major,Harden password hashing in the builtin authentication service
Improvement,Trivial,Call initCause() and getCause() without reflection in BaseJDBCTestCase
Improvement,Minor,Remove unnecessary field rwsOK in DirStorageFactory4
Bug,Major,NSSecurityMechanismTest fixture testNetworkServerSecurityMechanism fails intermittentlyt
Bug,Blocker,Derby threads hanging when using ClientXADataSource and a deadlock or lock timeout occurs
Bug,Major,NullPointerException in generated VTI code
Bug,Major,AssertFailures (7  or 8) with ibm 1.6 and 1.5 on Windows XP in lang.NativeAuthProcs fixture testAll
Bug,Major,Java deadlock between LogicalConnection40 and ClientXAConnection40 (patch attached)
Bug,Major,Race conditions in LogicalConnection checking for a null physical connection
Improvement,Major,Network Server should reject client connections that are not Derby Network Client
Bug,Major,AlterTableTest#testDropColumn fails: drop view cannot be performed due to dependency
Bug,Major,AssertionFailedError: Should not hold locks after commit in ResultSetMiscTest
Bug,Major,NativeAuthenticationServiceTest getting multiple errors trying to delete files/directories during teardown
Bug,Major,Access denied (java.lang.RuntimePermission modifyThreadGroup) in IndexStatisticsDaemonImpl.schedule()
Bug,Major,Select statement with subqueries with group by and count distinct statements returns wrong number of results
Improvement,Trivial,[patch] access static constants with static references
Improvement,Major,Prepare old test harness for running tests on Java 8
Bug,Minor,ServerPropertiesTest prints .java.net.SocketException: Connection reset to console but test passes
Bug,Major,NPE in Store  when running SELECT in a read-only database accessed via the classpath subprotocol when authentication  authorization  and Java security are turned on
Bug,Major,System can run out of stack space while processing DropOnCommit requests.
Bug,Major,OutOfMemoryError in OCRecoveryTest on phoneME
