type,priority,summary
Bug,Major,Network Server Protocol error when select fails and 'order by' is specified
Bug,Minor,NPE when trying to create a database at a directory that is not allowed
Bug,Major,Make LOCKS as non-reserved keyword in Derby since it is not a reserved keyword in the SQL standards
Improvement,Major,When using encryption  do not store the length information about the external key in service.properties
Improvement,Major,Support for like ? Escape ?
Improvement,Major,Request support for CAST() in Like clause
Bug,Major,NPE when creating a trigger on a table and default schema doesn't exist.
Bug,Minor,RunSuite summary rounds incorrectly
Bug,Major,dblook displays message keys instead of their associated text
Bug,Major,Lock not being released properly  possibly related to occurence of lock escalation
Improvement,Major,Add support for insert functionality using JDBC 2.0 updatable resultset apis
Improvement,Minor,[PATCH] Improvements on the NetServlet
Bug,Critical,Suite jdk14 is skipped incorrectly with J2SE 5.0
Bug,Major,Derby incorrectly rounds double values down during insert into NUMERIC
Bug,Major,Aliased Columns not recognized after 'group by... order by' combination
Bug,Minor,Network Server Gives NPE if SQLException has null arguments   (e.g. for ERROR XBM0H)
Bug,Major,Derby should throw a truncation error or warning when CASTing a parameter/constant to char or char for bit datatypes and the data is too large for the datatype.
Improvement,Major,in place table/index compress which returns space to OS
Bug,Major,Bad Eclipse plugin version specification
Improvement,Major,Inserting values in an identity column
Bug,Major,For the concurrency of ResultSet  Network Server should not send the concurrency of Statement.
Bug,Major,setNull does not work with java.sql.Types.TIMESTAMP
Bug,Minor,Parameter names required in CREATE FUNCTION
Bug,Minor,List of jar files in tools/java incorrect in BUILDING.txt
Bug,Major,isFirst() returns true when relative(x) goes beyond result set
Improvement,Minor,Add Support for network Server USRIDONL security
Bug,Major,setNull(x JDBCType.DATE) does not work when batching is turned on
Improvement,Minor,Optimize some specific methods in Network Server to improve performance
Improvement,Minor,Javadoc build should include a timestamp and/or the svn revision number in a visible location.
Bug,Major,Column names on ResultSet.updateXXX and getXXX methods are handled incorrectly
Bug,Minor,'Schema already exists' when creating a table
Improvement,Minor,'FOR UPDATE' required for updatable result set to work
Improvement,Minor,Fix copyright notices and other IBM/Cloudscape references in java/demo/*
Bug,Minor,Testharness: testEncryptionAlgorithm property is not being picked up correctly for some encryption suites
Improvement,Major,Need a online backup feature  that does not block update operations   when online backup is in progress.
Improvement,Trivial,connection toString should uniquely identify the connection
Improvement,Minor,Network Server demo program should support Derby network client driver
Bug,Trivial,Builds fail during splitmessages step if path contains spaces
Bug,Minor,test tools/dblook_test.java fails if run in a directory having '*derby/*' in its path
Improvement,Major,Provide some way to update index cardinality statistics (e.g. reimplement update statistics)
Bug,Minor,testing/README.htm property descriptions: testSpecialProps wrongly named; useprocess omitted
Bug,Major,SYS.SYSCOLUMN problem with 'GENERATED BY DEFAULT' column w/ Network Server
Bug,Major,Remove resultSetHoldability property from ClientDataSource
Bug,Minor,AES encryption test fails on Solaris 10
Bug,Trivial,Many files do not have correct svn-properties
Bug,Major,Network client XA should only keep XA state for transaction branch association  to track whether to send commit in autocommit mode.  All other state and state related decisions should be deferred to the server.
Bug,Minor,example.html file for the SimpleApp does not describe the arguments accepted by the program
Bug,Minor,setByte() with executeBatch causes hang with client if mapping is invalid  e.g. setByte to DATE
Bug,Major,It is desirable to have IDENTITY_VAL_LOCAL() function return last recent user specified value or system generated value for BY DEFAULT identity columns.
Bug,Major,Unknown page format  error  while doing recovery after a  a crash while doing  in place compress.
Bug,Major,Specification of incomplete server properties on command line causes NPE with NetworkServerControl when starting the server.
Bug,Trivial,servlet Back to Main Page link points to csnet instead of derbynet
Bug,Minor,SimpleNetworkClientSample.java network server example has an error which causes it to fail
Bug,Critical,With Network Server Database hangs after some time with many connections executing prepareStatement()
Bug,Minor,Disable creating indexes on long varchar for bit data. Long varchar column doesn't allow creating indexes already.
Improvement,Minor,Network client message strings not internationalized
Bug,Major,Client DataSource should not require user property to be set
Bug,Minor,sysinfo with -cp client option should not print error saying DB2 jar file and driver class are missing
Improvement,Major,Create a new sample database for use in examples in the manuals
Bug,Minor,Queryplan for a query using SESSION schema view is incorrectly put in statement cache. This could cause incorrect plan getting executed later if a temp. table is created with that name.
Bug,Major,Passing the return of  a RETURN NULL ON NULL INPUT function to another function call throws linkage error.
Bug,Trivial,Error message  X0X07  has incorrect property name  db2j.database.classpath instead of derby.database.classpath
Bug,Minor,SecurityException or LinkageException thrown during loading a class from a database jar incorrectly shuts the engine down.
Bug,Major,DatabaseMetaData.getColumns() fails on iSeries JDK 1.4 with verfier error on generated class.
Bug,Major,Result set holdability defined inside stored procedures is ignored by server/client
Improvement,Major,Expose BOOLEAN datatype to end users
Bug,Minor,SELECT DISTINCT returns duplicates when selecting from subselects
Improvement,Major,Integrate upgrade tests into test suite
Bug,Major,getAsciiStreamshould replace non-ASCII characters with 0x3f  '?'  to match embedded
Bug,Major,Incorrect insane build on windows platform
Bug,Major,ClientDriver ignores Properties object in connect(String url  Properties connectionProperties) method
Bug,Minor,The current build.properties for the Derby Help Plug-in for Eclipse does not work for creating a deployable plug-in
Bug,Major,Loading databases from jars in the classpath is broken  databases cannot be found.
Bug,Minor,Read-only databases fail to boot after soft upgrade. Raises error message:  40XD1: Container was opened in read-only mode.
Bug,Major,Dynamic parameter should be allowed to be the operand of unary operator '-'. Derby throws exception 42X36: The '-' operator is not allowed to take a ? parameter as an operand.'
Bug,Major,Using derby.language.logStatementText=true can mask certain exceptions and lead to incorrect behavior in some cases
Bug,Major,SYSCS_UTIL.SYSCS_INPLACE_COMPRESS_TABLE fails on (very) large tables
Bug,Major,Make the client driver connection URL work when spaces are in the URL.
Bug,Minor,sysinfo incorrectly requires permission on Derby jar files
Bug,Minor,Derby monitor accesses two system properties without using a privileged block when built sane=true
Bug,Major,create trigger fails with null pointer exception
Bug,Major,Subquery materialization can cause stack overflow
Bug,Major,Network driver setTransactionIsolation() causes a commit  but does not complete it locally
Improvement,Minor,SELECT MAX doesn't use indices optimally
Bug,Major,getImportedKeys returns duplicate rows in some cases
Bug,Major,SecurityException with accessDeclaredMembers on DatabaseMetaData.getTables.
Bug,Blocker,during crash recovery of a drop table  on case insensitive files systems derby may delete wrong file
Improvement,Minor,Remove backup(File ...) methods
Bug,Minor,Build-time processing of 'metadata.properties' file handles slashes incorrectly.
Bug,Major,In ij  executing a prepared statement with numeric/decimal parameter fails with NullPointerException in J2ME/CDC/FP
Bug,Minor,Add tests for error codes for severe exceptions
Bug,Trivial,NullPointerException or ClassCastException if UPDATE or DELETE is performed on a diagnostic VTI
Bug,Major,Network client: deleteRow() makes getter methods return nulls for the following rows.
Bug,Major,Unable to create databases whose name containg Chinese characters through the client driver
Improvement,Major,Starvation in RAFContainer.readPage()
Improvement,Minor,SYSCS_UTIL.SYSCS_COMPRESS_TABLE should create statistics if they do not exist
Bug,Minor,Problem setting sanity state to false by using 'ant -Dsane=false'
Improvement,Major,Materialize subqueries in select list where possible to avoid creating invariant resultsets many times.
Improvement,Major,Enhance ALTER TABLE syntax to allow users to change the next value to be generated for an identity column
Bug,Major,cursor closed as a sideeffect of closing another cursor with the same name on another connection
Improvement,Major,Allow parallel access to data files.
Improvement,Minor,One each deleted or updated from a heap row a new RowPosition object is created.
Bug,Minor,Incorrect documentation for 'NetworkServerControl.logConnections(boolean)'
Improvement,Minor,Client driver: Pre-fetch data on executeQuery()
Improvement,Minor,modify setCharacterStreamInternal to take a long for the length  and perform the > max int check in the method
Bug,Major,LDAP user authentication fails under a security manager
Bug,Minor,Intermittent failure of store/readlocks.sql
Bug,Minor,add mechanism for specifying policy file for individual function tests
Bug,Major,Remove use of String(byte[]) and String(byte[]  int  int) constructors in testing leading to non-portable behaviour
Bug,Critical,big decimal error diff in derbyall lang/procedure test run in the DerbyNetClient - jdk1.3 specific
Improvement,Major,introduce a new test type to run junit tests from the current harness
Improvement,Major,new JDBC4 metadata API getFunctions() needs to be implemented
Bug,Minor,NullPointerException at ResultSet.close() time for simple query using UNION and INTERSECT
Bug,Minor,Error 22001 can include 'XX-RESOLVE-XX' which should be removed
Bug,Minor,DatabaseMetadata method supportsResultSetConcurrency returns wrong result on network client
Bug,Critical,creating a preparedStatement outside of a Global tran using a ClientXADatasource  will result in an 'SqlException: Cannot set holdability'  if the statement  is used in a Global transaction
Bug,Minor,tests derbynet/csPrepStmt and prepStmt use mechanisms that are not portable over encodings
Bug,Minor,unit/daemonService.unit fails intermittently: 'ran out of time'
Bug,Minor,store/access.sql fails - incorrect index?
Bug,Trivial,tests jdbcapi/SURTest.junit and jdbcapi/SURQueryMixTest.junit run twice in derbynetclientmats
Bug,Minor,Optimizer can return incorrect 'best cost' estimates with nested subqueries  which leads to generation of sub-optimal plans.
Bug,Major,Embedded ResultSet.getStatement() does not return the Statement object that created it  for a connection returned from EmbeddedXADataSource
Bug,Minor,new test lang/ShutdownDatabase.java fails with j2ME
Bug,Major,forupdate.sql   holdCursorIJ.sql ..etc are failing when run with 10.1 client againest trunk
Bug,Minor,JVMInfo is duplicated in derbyclient.jar
Bug,Major,test jdbcapi/checkDataSource30 and savepointJdbc30_XA fail with remote server with security exceptions
Bug,Minor,Security.AccessControlException in client under SecurityManager when trying to connect using EUSRIDPWD security mechanism
Improvement,Minor,Change the internal implemetation of SYSCS_INPLACE_COMPRESS_TABLE to share existing alter table
Bug,Major,Delete cascade causes NULL values inserted into table when after delete Trigger fires
Bug,Minor,Misleading/wrong error message while dropping a view
Bug,Major,Derby fails inserting a join into a table with a generated column
Bug,Minor,Test harness does not pass jvm flags properly if there are more than 1 property in jvm flags
Bug,Minor,ResultSet.getHoldabilty will return incorrect value when the ResultSet is obtained from a procedure call
Bug,Major,For existing databases JDBC metadata queries do not get updated properly  between maintenance versions.
Bug,Critical,transaction logs files requried for recovery are getting deleted when backup and checkpointas are running in parallel.
Bug,Major,client gives SqlException for test callable.java and parameterMapping.java on zOS
Bug,Minor,jdbc4/TestDbMetaData.java fails because of changes in SQLException text
Bug,Major,compatibility tests fail with security related errors.
Bug,Major,Truncation Error with Concat
Bug,Major,With client PooledConnection.getConnection() does not reset holdability and isolation state properly
Bug,Major,Failures in sysinfo and sysinfo_withproperties induced by classpath wiring
Bug,Minor,derbynet/testSecMec.java fails with Sun JDK 1.3
Improvement,Major,Separate XAResource from EmbedXAConnection
Improvement,Minor,allow the encrypting of an existing unencrypted db and allow the re-encrypting of an existing encrypted db
Improvement,Minor,Helper methods in BaseJDBCTestCase for creating data sources
Bug,Minor,PreparedStatement.executeUpdate throws a XJ05C exception in a global transaction if the statement is HOLD_CURSORS_OVER_COMMIT
Bug,Minor,NullPointerException in network server with LDAP authentication
Bug,Minor,defragment of inplace compress pass for described dataset is not freeing up empty pages.
Bug,Minor,Network Server reports wrong product name when logging connections to derby.log
Bug,Minor,Derby Server and Administration Guide - Servlet interface - Running page
Improvement,Minor,ij should have a --help option to print command line syntax
Bug,Minor,jdbcapi/checkDataSource.java and jdbcapi/checkDataSource30.java hang intermittently with client
Improvement,Trivial,Remove the huge log files (TesterN.out) left from running 'stress/stress.multi'
Bug,Major,LIKE does not match empty strings when used with a prepared statement
Improvement,Major,Move isPoolable() and setPoolable() from PreparedStatement to Statement
Improvement,Major,Verify that applications can't manipulate the transaction state while inside a distributed transaction.
Bug,Major,Assert failure in BasePage.shiftUp() when running store/onlineBackupTest4.sql
Bug,Minor,Old clients with new server return wrong database metadata values for some methods
Bug,Major,XAConnection uses NetConnection as underlying physical connection for JDBC4/Java 1.6
Improvement,Major,Implement new JDBC4 methods for creating empty LOBs in the embedded client
Bug,Minor,Client: Attempted deleteRow or updateRow while on insert row gives wrong error message
Bug,Major,Network Server does not shutdown the databases it has booted when started and shutdown from the command line
Improvement,Minor,Calling ResultSet.isLast() on a scrollable insensitive resultset  causes the entire ResultSet to be populated
Bug,Minor,Resolve test failures with JCC2.8
Bug,Minor,Tests jdbcapi/HoldabilityTest.junit  jdbcapi/UpdateXXXTest.junit jdbcapi/SURTest.junit fail on wctme5.7_foundation
Improvement,Major,SUR: Use DRDA's extended diagnostic to send ROW_UPDATED and ROW_DELETED warnings.
Bug,Major,Differences between client and embedded when invoking stored procedures using Statement.executeUpdate()
Bug,Minor,Test lang/procedure.java fails with ibm1.5 jvm
Bug,Minor,Missing resets of isOnInsertRow state in net client when navigating away via other than ResultSet#next
Bug,Major,Need to remove old copyright notice
Bug,Major,Isolation level of local connection does not get reset after exiting a global transaction if the isolation level was changed using SQL
Bug,Major,Identity column can be  created with wrong and very large start with value with  'J2RE 1.5.0 IBM Windows 32 build pwi32dev-20060412 (SR2)' with JIT on
Improvement,Minor,messages_pt_BR.properties file  should not translate Network Server 'start' and 'shutdown' commands
Bug,Minor,lang/forupdate.sql fails with derbyclient in the 10.1 branch
Bug,Major,ClientDriver ResultSetMetaData.isAutoIncrement(column) always returns false
Bug,Critical,Class-Path manifest entry for derby.jar is missing from the 10.2.0.2 snapshot
Improvement,Minor,add  lang/grantrevoke.java to derbynetclientmats
Improvement,Minor,File java/engine/org/apache/derby/loc/messages_en.properties - Message XSLAT.D
Bug,Critical,Interface changes introduced in Mustang build 86
Bug,Critical,Wrong results with query using LIKE and ESCAPE clause that includes '%'  '/'  and '_'
Bug,Minor,Message id J029 (CONN_RESTORE_FROM) does not have a matching message text
Bug,Trivial,Typo in link to Simple Example from frameworks/readme.html
Bug,Major,setEmbeddedCP.ksh and setNetworkCleitn.ksh does not work or gives wrong error message
Bug,Minor,Using -Djvmflags option causes NoClassDefFoundError
Improvement,Major,Add MessageBundleTest to build script to verify that there are no orphaned message ids
Improvement,Major,Network Server should flush the PrintWriter after console output
Bug,Minor,Correct instructions in demo html file demo/simple/example.html
Improvement,Major,Provide ALTER TABLE DROP COLUMN functionality
Bug,Major,EmbeddedDriver does not implement PreparedStatement.setNull(int  int  String)
Improvement,Minor,testSecMec needs many masters - should convert to junit
Bug,Major,test run exits for _foundation run because unloadEmbeddedDriver uses driverManager  which isn't available.
Bug,Minor,'SQLBinary.readFromStream' can enter endless loop
Improvement,Major,Upgrade test needs to be enhanced to test grant revoke
Improvement,Minor,Factor out type checks in EmbedResultSet and EmbedPreparedStatement
Bug,Major,The Eclipse plug-in distributions (UI and Core zip files) do not contain the Apache license  copyright or notice files
Bug,Major,Unexpected behavior on self privilege revocation
Improvement,Major,A  trigger should be dropped when a privilege required by the trigger is revoked.
Bug,Minor,Make test jdbc4/TestPreparedStatement run under the security manager
Bug,Major,derbynet/testProtocol.java fails with security manager enabled
Bug,Minor,Derby JDBC 4.0 driver returns 3 for JDBC driver major version
Improvement,Minor,enable more testcases in ConcurrencyTest
Bug,Minor,NullPointerException in UPDATE with COALESCE and subquery
Bug,Minor,Link 'Getting Started....' and 'Apache Derby Server ....' in demo.html needs to be linked to actual documents instead of manuals page
Bug,Minor,Network server fails with DRDAProtocolException if a BLOB with size 2147483647 is streamed from client
Bug,Major,Scripts in frameworks direcotry needs to be revisted to set up CLASSPATH properly
Bug,Trivial,test harness evaluates j9 2.2 jvm (a.k.a wctme5.7) as isJDBC4; does enthousiastic sed-ing
Bug,Minor,derbyrunjartest hangs with wctme5.7 & always uses j9_13; hangs with _foundation
Bug,Trivial,new j9 canons required/canons need to be removed to catch up to changes to 7/27/06.
Bug,Major,Test harness overrides heap size settings when starting Network Server
Bug,Major,Lots of jdk1.6 regression test failures with diffs because of  SQL Exception instead of java.sql.SQLException
Bug,Major,Sysinfo in 10.2  shows multiple entries if the derby jars reside in a directory with spaces in its name
Bug,Critical,Trigger action statement is not recompile when there is a change that would affect it.
Bug,Critical,NetConnection40 references an engine class  org.apache.derby.impl.jdbc.Util
Improvement,Major,A  'revoke execute ... restrict' should fail if there are dependent objects on the execute privilege
Bug,Minor,NPE when inserting values to a table that has a column declared as generated by default as identity
Bug,Major,Create index on large tables fails with too many open files   FileNotFoundException.
Improvement,Minor,Network Server should not send to client that it supports EUSRIDPWD when running against Sun JVM
Bug,Major,Regression (wrong results): Join predicate can be ignored for left-most child in a chain of nested unions.
Bug,Minor,ConsistencyToken.hashCode() is not thread safe
Bug,Major,jdbcapi/blobclob4BLOB.java fails under DerbyNet framework with JCC 2.6
Bug,Major,Client driver does not use the query timeout value set using Statement.setQueryTimeout() for subsequent executions using the same statement object
Bug,Major,derbynet/testProperties.java hangs
Bug,Minor,testSecMec.java fails with JCC 2.6 and JCC 2.8
Improvement,Minor,Add more tests for Statement.setQueryTimeout method
Improvement,Major,Deprecate scripts in frameworks directory
Bug,Minor,huge single insert statements fail with JVM error due to size of generated method
Bug,Major,Invoking Java stored procedure that contains GRANT or REVOKE statement with CONTAINS SQL should fail.
Bug,Major,Manifest file doesn't contain OSGi attributes
Bug,Major,The language and store systems treat a JVM error such as OutOfMemoryError differently leading to the raw store protocol violation errors
Bug,Major,derbynet/testSecMec.java fails with NullPointerException (intermittent failure)
Improvement,Major,Implement Bracketed SQL comments (/*...*/ comments)
Bug,Minor,derbynet/testSecMec.java fails with ShutdownException in DerbyNetClient framework
Bug,Major,XMLSERIALIZE operator doesn't follow SQL/XML spec in some areas when serializing a sequence.
Bug,Minor,remote server testing with 10.2 snapshot showed 8 failures
Bug,Minor,ERROR 42Z72: XML syntax error; missing keyword(s): 'AS'. - Misleading text
Improvement,Minor,The database owner is incorrectly referred to as dba in the code comments that were checked in Derby 10.2 for grant revoke work. We should clean this up at some point.
Bug,Major,Embedded ResultSet.getTimestamp on a TIME column returns a java.sql.Timestamp with a date portion that can be incorrect.
Bug,Minor,Client's ResultSet.getTime() on a SQL TIMESTAMP column loses the sub-second resolution and always has a milli-second value of zero.
Bug,Major,Access rule violations should use a SQL state starting with '42' according to the SQL standard.
Bug,Major,lang/procedureInTrigger.sql fails with wctme5.7 foundation with CNFE  java.sql.DriverManager and other exceptions.
Bug,Minor,sysinfo test fails with 'access denied (java.util.PropertyPermission java.class.path read)' when derbyclient.jar is first in classpath
Bug,Minor,Correct message SQL State 01006 to reflect that is being revoked - 'user' and update the Ref Manual
Bug,Major,jdbcapi/blobclob4BLOB.java fails with JCC drivers
Improvement,Major,Create a script that allows users to easily update their Derby jars with the JDBC4 classes.
Bug,Major,Tests lang/grantRevokeDDL.sql and lang/grantRevokeDDL2.sql fails on IBM WCTME 5.7 Foundation (jdkJ2ME Foundation Specification v1.0)
Bug,Major,Assert failure in sane mode for queries that used to work in 10.1.2.1
Bug,Minor,largeDataTests/LobLimits master needs update for new exception names
Bug,Trivial,The source distribution for 10.2.1.4 rc1 includes derby.log files
Bug,Minor,error 58009.C.19  refers to non-existent codepoint secktn - needs correcting
Bug,Major,SQLSTATE 42X10 occurs when qualifying a column with a synonym in ORDER BY clause
Bug,Major,10.2.1.5 source distribution is missing many files and includes some files that it should not.
Bug,Major,The scripts under the /bin of the distribution does not have the executable permission
Bug,Major,ALTER TABLE DROP COLUMN needs to update GRANTed column privileges
Improvement,Major,Bring STATUS file up to date
Bug,Trivial,readme.html under frameworks does not mention about Derby client and some minor typos in example.html
Improvement,Major,Add re-encrytion  of database test cases to the upgrade test..
Improvement,Minor,Make FOR EACH clause and MODE DB2SQL in CREATE TRIGGER statement optional
Improvement,Minor,Remove stale code from the statement classes in the client driver
Improvement,Trivial,improve XSDG3 error to print container  actual i/o operation  and file name.
Bug,Minor,Routine parameter names displayed by dblook are not escaped.
Bug,Major,Junit tests that require SQL authorization mode should use a different database to the default one.
Improvement,Minor,Add Order Entry application/system/performance test/toolkit
Improvement,Minor,Convert jdbc4/TestJDBC40Exception.java to JUnit
Improvement,Minor,Convert jdbc4/TestDbMetaData.java to JUnit
Bug,Minor,Misleading stack traces for exceptions raised by the JDBC 4.0 embedded driver
Improvement,Minor,Use a lower wait timeout in BlobClob4BlobTest
Bug,Minor,NullPointerException with LTRIM  RTRIM and 2-argument SUBSTR() call in GROUP BY clause.
Bug,Major,ArrayIndexOutOfBoundsException for COALESCE with aggregate functions
Bug,Minor,NullPointerException in CREATE VIEW ... VALUES NULL;
Bug,Minor,jdbcapi.LobStreamsTest runs only in client (not embedded) but its suite() method gives no reason why.
Bug,Minor,Setting a login timeout in client driver can lead to query timeout
Bug,Minor,'set schema sys' followed by 'show tables' does not show tables in sys schema
Improvement,Minor,provide checking tool to flag possible errors in message translations
Bug,Major,Setting derby.database.classpath to contain installed jars causes the database to be unbootable when a Securitymanager is installed.
Improvement,Minor,Make class org.apache.derby.iapi.store.raw.PageKey final
Bug,Major,TestDataSourceFactory doesn't work correctly outside the old harness
Bug,Major,LangScripts JUnit test fails in views.sql
Bug,Major,JDBC.assertRowInResultSet compares the wrong value if using trimmed strings and a SMALLINT column exists.
Improvement,Minor,Rewrite 'derbynet/SuicideOfStreaming' to a JUnit test
Bug,Minor,NullPointerException when two threads load sort factory concurrently
