type,priority,summary
Improvement,Major,Get upgrade tests to pass on OJEC 1.1
Bug,Minor,NATIVE warns about password expiry for DBO
Bug,Critical,Rolling back a transaction leads to an inconsistent state
Bug,Major,When a foreign key constraint on a table is dropped  the associated statistics row for the conglomerate is not removed
Bug,Major,Back out the concurrency improvements for identity columns introduced by derby-4437
Bug,Minor,intermittent test failure in storetests/st_derby715.java
Bug,Major,Authorization decorators don't null out connections when done
Improvement,Minor,Clean up statements in CreateTableFromQueryTest
Bug,Major,ResultSetFromPreparedStatementTest keeps references to non-default connections
Bug,Major,BigDataTest.tearDown() doesn't call super.tearDown()
Bug,Major,CheckConstraintTest holds on to resources after completion
Bug,Major,ColumnDefaultsTest holds on to resources after completion
Bug,Major,InbetweenTest holds on to resources after completion
Bug,Major,TimestampArithTest keeps references to statements after completion
Bug,Major,TableFunctionTest keeps reference to connection after completion
Bug,Major,UngroupedAggregatesNegativeTest doesn't call super.tearDown()
Bug,Major,ParameterMappingTest lacks call to super.tearDown()
Bug,Major,InternationalConnectTest forgets to call super.tearDown()
Bug,Major,EncryptionKeyTest sometimes keeps reference to connection
Bug,Major,Replication tests keep references to connections after completion
Bug,Minor,ProtocolTest doesn't clean up its test resources
Bug,Major,NullPointerException in GenericTriggerExecutor.executeSPS() caused by OutOfMemoryError
Improvement,Trivial,Remove unsued code in AlterTableConstantaction.columnDroppedAndTriggerDependencies
Improvement,Major,Native user authentication: improve wording of error message
Bug,Minor,Sending an empty string as table name to compress table procedure or empty string as index name to update statistics procedure makes the parser throw an exception.
Bug,Minor,Missing argument in some XJ022 errors
Improvement,Trivial,Use TestNullOutputStream where possible
Bug,Trivial,Upgrade tests should  print full IOException stack trace when it fails to access old versions
Bug,Major,Table functions should only accept arguments which are constant in their query block.
Improvement,Minor,Remove duplicated code for starting remote processes in replication tests
Improvement,Minor,Replication tests should use BaseTestCase.execJavaCmd() to run local commands
Improvement,Major,Make it possible to turn off encryption on an already encrypted database.
Bug,Minor,Documentation in release doesn't include stylesheets
Improvement,Minor,Remove unused methods in client.am.DateTime
Bug,Major,AssertionFailedError in functionTests.tests.lang.UpdateStatisticsTest.testDisposableStatsEagerness
Improvement,Minor,Disable i18n/JapanCodeConversion.sql on platforms that don't support EUC_JP or SJIS
Improvement,Trivial,Remove unused class ExecProcUtil
Improvement,Trivial,Add replicationTests.ReplicationSuite to junit-core ant target
Bug,Major,testOSReadOnly fails with k.AssertionFailedError: expected an error indicating the db is readonly on HP java 1.6
Bug,Major,Make DoubleProperties.propertyNames() thread-safe
Bug,Major,By using syscs_set_database_property  you can set the database version to a garbage string which prevents you from booting the database.
Improvement,Minor,Clean up IDE warnings in DRDAConnThread
Improvement,Major,Remove unused methods in DDMReader and DDMWriter
Improvement,Trivial,Remove JDBC 3 constants from client.am.Statement
Improvement,Minor,Prune the brokered class tree
Improvement,Major,Add message argument names  as comments  to English message file produced by MessageBuilder.
Improvement,Minor,Simplify JSR-169 implementation class tree
Bug,Major,The order of argument names in messages.xml is sometimes wrong when the arguments occur in the message out of sequence.
Bug,Minor,Broken handling of paths with special characters in compatibility/VersionCombinationConfigurator
Improvement,Trivial,add ibm18 class to functionTests.harness
Bug,Minor,Incorrect list of compatible JRE versions in client trace #2
Improvement,Trivial,Add utility methods to query state of URL attributes in EmbedConnection
Bug,Major,Missing method exception raised when using Clobs with territory based collation
Bug,Major,NPE in SELECT involving subselects and windows functions
Bug,Minor,Timestamp comparison failure in AutomaticIndexStatisticsTest.testStatisticsCorrectness
Bug,Major,Encryption  re-encryption  and un-encryption silently fail if the database is already booted.
Bug,Major,Grammar doesn't accept OR operator without parentheses
Improvement,Minor,Stop producing byte code for non-existent qualifiers
Improvement,Minor,Use BaseTestCase.execJavaCmd() to start process from NetworkServerTestSetup
Bug,Minor,Replication tests fail on CDC platforms without optional JSSE package
Bug,Major,ErrorMessageTest assert failure: Only one of the waiters should be aborted
Bug,Major,NullPointerException in INSERT INTO ... SELECT FROM ... ORDER BY
Bug,Major,IN lists with mixed types may return wrong results
Improvement,Major,Lift the arbitrary limit on the number of routine parameters.
Bug,Major,in list multi-probe by primary key not chosen on tables with >256 rows
Bug,Major,Failures in upgradeTests.Changes10_9 related to index cardinality statistics
Bug,Major,100's of errors in nightly test run on weme after jacoco property/priviledges checkin
Bug,Major,Package javadoc publishedapi/jdbc4/index.html out of date
Bug,Major,testPositionAgressive(org.apache.derbyTesting.functionTests.tests.jdbcapi.BlobClob4BlobTest)j fails with : 'The handle is invalid.: java.io.IOException'.
Bug,Major,Upgrade tests fail on compact2
Bug,Major,Investigate why setting a login timeout causes NativeAuthenticationServiceTest to fail when run in a suite
Bug,Major,SSL Test (and network server )  can hang if serverSocket.accept() fails for something other than an IOException
Bug,Major,Marshalling error in JDBCDriverTest as part of CompatibilityTest
Bug,Major,select from view with 'upper' and 'in' list throws a ClassCastException
Bug,Major,nightly regression test failure  intermittent error : testStatisticsCorrectness(org.apache.derbyTesting.functionTests.tests.store.AutomaticIndexStatisticsTest)junit.framework.AssertionFailedError
Bug,Major,nightly regression test failure: testMultipleLastKeyWaitsInMaxScan(org.apache.derbyTesting.functionTests.tests.store.IndexSplitDeadlockTest)junit.framework.AssertionFailedError: Column value mismatch @ column '1'
Improvement,Major,Add automatic cleanup of connections opened with openDefaultConnection()
Bug,Major,Derby does not report warnings raised by table functions
Improvement,Minor,Simplify code that handles LOB files
Bug,Minor,Interrupt restarts clock for login timeout
Improvement,Minor,Clean up registered format ids
Bug,Critical,AutoloadTest does not proprogate original jvm -D flags to spawned JVM  leading to LAB regression test failures
Bug,Minor,Cleanup suspect coding practices in org.apache.derby.iapi.error package
Bug,Major,Query against view  with 'where name LIKE 'Col1' ESCAPE '/' ' failed
Bug,Minor,Cleanup suspect coding practices in org.apache.derby.iapi.services.io package
Bug,Minor,Cleanup suspect coding practices in the org.apache.derby.impl.tools.planexporter package
Bug,Minor,Cleanup suspect coding practices in the org.apache.derby.iapi.types package
Bug,Minor,Cleanup suspect coding practices in the org.apache.derby.iapi.sql.dictionary package
Bug,Minor,Cleanup suspect coding practices in misc Derby packages
Improvement,Major,Make Optimizer trace logic pluggable.
Bug,Minor,NullPointerException when calling a procedure with sub-query as argument
Bug,Major,Issues with latest JDK 8 EA build because of missing SQLPermission
Bug,Minor,SecureServerTest assertion error on contents of stdout from subprocess
Improvement,Major,Use the JVM's cache of Number instances in ReuseFactory
Improvement,Minor,Remove unnecessary checks for UnsupportedEncodingException in the client
Bug,Major,XMLBindingTest fails on latest JDK 8 EA
Bug,Major,updatelocksJDBC30 test failing in nightly regression tests
Improvement,Major,Add ability to print a Derby execution ResultSet as xml.
Improvement,Major,Add ability to compactly specify a complete query plan in an optimizer override.
Bug,Major,NullPointerException when using more than one parameter in COALESCE
Improvement,Trivial,Use Arrays.copyOf() in FormatableArrayHolder.getArray()
Improvement,Minor,Allow tests to show detailed error when spawning new process fails
Improvement,Trivial,Simplify PropertyUtil using Properties.stringPropertyNames()
Bug,Major,Intermittent failures in XplainStatisticsTest.testSimpleXplainOnly
Bug,Major,XplainStatisticsTest.testSimpleQuery: BEGIN_COMP_TIME unexpectedly NULL
Improvement,Major,Log a page dump to derby.log if ERROR nospc: nospc.U  is returned to the user
Bug,Minor,Fix incorrect @throws and @exception tags in javadoc
Bug,Major,DatabaseMetaData.getJDBCMinorVersion() should return 2 now that we've implemented JDBC 4.2
Improvement,Trivial,Simplify StringBuffer use  as they are mutable
Improvement,Minor,Remove Profile attribute from jar file manifests
Bug,Major,failure in testConstraintDrops(org.apache.derbyTesting.functionTests.lang.ConglomerateSharingTest)junit.framework.AssertionFailedError: Error 23505 should have been caused by index/constraint...
Bug,Major,java.security.AccessControlException in i18n.LocalizedDisplayScriptTest
Bug,Major,CREATE TRIGGER doesn't detect all illegal references to SESSION schema
Bug,Major,Errors in jdbc4.LobStreamTest if derbyclient.jar is first in the classpath
Bug,Major,NullPointerException in DirFile
Bug,Minor,ClassCastException when launching derby from windows subst drive
Bug,Major,Minimal select privilege should be checked in subqueries
Bug,Major,Incorrect handling when using an UPDATE to SET an identity column to DEFAULT
Bug,Major,Incorrect privileges may be required for INSERT and DELETE statements.
Bug,Major,Connections opened by ForeignTableVTI never get released
Bug,Major,ArrayIndexOutOfBoundsException when calling function from trigger
Bug,Critical,Infinite loop in NetworkServerControlImpl.ensureDataInBuffer
Bug,Major,NetworkServerControl API breaks when username or password contains non-ascii characters
Improvement,Major,Create a regression test which will fail if classes from one Derby jar file leak into another jar file
Improvement,Minor,Revamp the vti demo to look and behave more like the other demos.
Improvement,Minor,Include SQLState in client exception messages
Bug,Major,Optional tool registration may fail because the CompilerContext is not always available at execution time.
Bug,Major,intermittent error in nightly regression tests: AutoIncrementTest
Bug,Major,Starting network server on a network drive fails with JDK 7 on Windows
Bug,Major,java.lang.NoSuchMethodError chaining a function and procedure
Improvement,Trivial,Remove StorageFile.getURL() and its implementations
Improvement,Trivial,Remove storageFactory field from subclasses of InputStreamFile
Bug,Major,Syntax error when reference to transition variable has whitespace around it
Bug,Major,Non-english locale flunks LuceneSupportTest
Bug,Major,testDERBY5120NumRowsInSydependsForTrigger fails when the starting version of the upgrade trajectory is 10.10.2.0
Bug,Major,Sequence generator makes CREATE TRIGGER fail with internal error
Bug,Major,NOT elimination for CASE expressions is broken
Bug,Minor,ROW_NUMBER function throws NullPointerException in UPDATE statement
Improvement,Minor,Simplify handling of untyped nulls in CASE and NULLIF expressions
Bug,Major,Incorrect nullability for CASE expression with parameter
Improvement,Major,add HoldForConnection ij command to match NoHoldForConnection
Bug,Major,CheckToursDBTest failed while updating sequence value on disk
Bug,Major,Broken link in API docs to derby.drda.keepAlive documentation
Bug,Major,User procedures can call system procedures  circumventing SQL authorization.
Improvement,Minor,Use javax.xml.xpath interfaces for XPath support
Improvement,Major,Check type of user-supplied modules before creating instances
Improvement,Minor,Support standard syntax for altering column nullability
Bug,Major,Compilation error using a view as the source data set for a MERGE statement
Bug,Major,Rollback to savepoint allows violation of deferrable constraints
Improvement,Major,Allow Derby to rename tables referenced by foreign keys
Bug,Major,Permission problems when running JUnit tests with Ant 1.9.4
Bug,Major,ROW_NUMBER should not be allowed as argument in a procedure call
Bug,Minor,Assert failure/ArrayIndexOutOfBoundsException when using COUNT in MERGE matching clause
Bug,Major,OOME when running ConstraintCharacteristicsTest with smaller heap
Bug,Major,Add derbyoptionaltools.jar to the class paths of the scripts in the bin directory
Bug,Major,Add derbyoptionaltools.jar to the maven artifacts we publish
Bug,Major,Cannot create a Lucene index if a key column's name is case-sensitive
Bug,Major,The jacoco-junit target fails to store coverage data for some sub-suites
Improvement,Major,For update statement  collect generated keys if Statement.RETURN_GENERATED_KEYS flag is supplied to the JDBC call.
Improvement,Major,Remove need for db2jcc.jar for executing ij or upload it on ibiblio
Bug,Major,Fix hard-coded JDBC 4.0 type constants
Bug,Major,In suites.All  certain test orders cause AccessControlException
Improvement,Minor,Utilize JQL to fetch JIRA issue list for release notes generation
Improvement,Minor,Remove unused parameter in splitmessages
