type,priority,summary
1,2,METHOD does not work when is invoked for the second time in the COMPONENT flow
1,2,Test failures in COMPONENT on windows as Streams are not closed correctly
0,2,Create COMPONENT component to support Quartz VERSION NUMBER
1,2,CLASS METHOD does not get loaded on bootrapping therefore files are processed again
0,1,XML DSL having attributes that is a Class type should be a String type instead and use CLASS to lookup the class
0,1,In METHOD METHOD METHOD the VARIABLE details should be available as well in case an exception was thrown
1,2,Error using multiple error handlers and EXCEPTION EXCEPTION CLASS has not been started
0,2,Refactorings in COMPONENT
0,2,CLASS should check if there is an EXCEPTION connected to the exchange and throw that one if it exists so that the default Errorhandling in springws can take place
0,2,COMPONENT JDBC aggregation repository Should use CLASS from COMPONENT to load classes
0,1,JMX API to createdelete endpoint
0,1,Improve CONFIGURATION FILE for COMPONENT use mavenjibxplugin
1,1,CLASS can deadlock
0,1,CLASS checks only one header
1,2,CLASS example have some issues when it is deployed into osgi container like CLASS
1,1,Label of SOURCE FILE and SOURCE FILE processors do not appear in trace output
0,1,Add METHOD to CLASS
1,1,Groovy language EXCEPTION in OSGi environment
1,2,Nullpointer in COMPONENT when body is null
1,1,Using METHOD NUMBER times or more in Java DSL with a context scoped EXCEPTION causing the NUMBER advised route to not work as expected
0,1,A name should be specified in the karaf featuresfile
0,2,Add Lazy Connection to XMPP
0,2,Added wrap method for template consumer and context in COMPONENT
0,2,avoid runtime package scanning to discover CLASS
0,1,When performing lookup in registry and having expected type as parameter then report better failure if EXCEPTION
1,2,Archetypes fail to build in offline mode
1,1,CLASS does not work correctly for CLASS
1,1,COMPONENT Using METHOD option should use the separator option to allow control of path separators in the generated file name
1,2,Missing setter or constructorargument for METHOD in CLASS
0,1,Expose METHOD property in COMPONENT
1,2,Properties component Cached locations may add duplicates
1,2,The METHOD stack of CLASS should be thread safe
0,1,COMPONENT Add support for adding CLASS and CLASS metadata support when uploading file
1,2,Connection to sftp server occasionally do not want to come back
0,2,COMPONENT should provide a option not set the METHOD flag
1,1,CLASS behaviour incorrect with nested routes
0,1,COMPONENT archetypes and examples should enable JMX for ActiveMQ
1,1,dump as xml fails if message body is already xml
1,2,COMPONENT will not build offline
1,2,Bean method name is ignored
1,2,COMPONENT CXF Endpoint creates incomplete WSDL
0,2,Add METHOD option for DMLC to COMPONENT
1,1,xslt component Cannot load xslt file from file system
1,1,COMPONENT Bindy Parser One to Many KvP SOURCE FILE Issue
1,1,Example feature wrong spring version
1,2,Wrong exception uri when an HTTP error code is returned
0,1,Validator component Should be able to validate from a File payload
0,1,Add CLASS converter so that time zone can be specified for COMPONENT
0,2,Impossible to use placeholders in METHOD and METHOD attributes of METHOD
1,1,Ftp consumer using done file should cater for if stepwise has been enabled and thus the done file path is to be calculated differently
0,1,Using transacted in Java DSL without Spring XML setting up TX manager should report better error when not able to find a TX manager in the registry
0,1,faster way of testing for file existence
0,2,Move COMPONENT to COMPONENT
0,2,Refactoring of management code to remove cycles and clearly separate between API and impl
0,1,COMPONENT test Debugger should be explicit enabled if end user want to leverage it
1,2,Bug in parsing of JPA uri
1,1,Freemarker Loading template from file system fails
1,1,COMPONENT option encoder and decoder does not work
1,2,It is hardly possible to use all expression of the Simple language to create file names in the file component
0,2,The debugger does not work in the COMPONENT with route defined in XML
0,2,add support to set the cipher used for SFTP
1,2,Exeptions cannot be propagated to the parent route when using LogEIP
0,2,Fix CLASS of COMPONENT
0,1,The URI of the CLASS exposed to the JMX is not accurate
0,2,COMPONENT should not be a Processor and a log class at the same time and it should not have CLASS
0,2,COMPONENT should allow the user to provide an existing instance to the component
1,1,Error in COMPONENT feature CONFIGURATION FILE
0,1,COMPONENT Make it consistent what SOURCE FILE returns as object so its the same for NUMBER or more rows
1,2,Wrong SOURCE FILE in FTP component for METHOD
1,1,COMPONENT SOURCE FILE using CSV will insert wrong char separator if using an escaped separator char such as a pipe
1,2,EXCEPTION when SOURCE FILE using serialization data format
0,2,Resolve cycle between VARIABLE and VARIABLE
1,2,Unable to use cxfbinding configuration for the endpoint
1,2,file consumer does not create directory
1,2,Because local CLASS objects on Windows have a name which is not their UNC path the CLASS can never find them
1,2,EXCEPTION are not propagated to the parent route when endpoint cannot be resolved in the CLASS EIP
0,2,Be able to check classtype through simple language
0,2,Add a Tracer that uses JMX Notifications and provides full details of COMPONENT Messages
1,2,Recipient List cannot vary destination by changing property in an expression
0,1,The SFTP component the keyboardinteractive auth method support
0,1,SpringWS should populate COMPONENT Header with the SOAP Header
1,2,Unable to convert jms textmessage to bytemessage
1,2,Cannot find splitter bean in registry using multiple COMPONENT contexts with vm endpoint
0,2,CLASS METHOD condition fires too eagerly
0,2,Support nested directories with multiple segment files in the HDFS endpoint consumer
1,1,CLASS creating new connection on every message
1,2,Need to specify the NUMBER version in the COMPONENT maven archetypes
1,2,COMPONENT component does not close a file when it is used with COMPONENT
1,2,NUMBER does not work with CLASS for QuickfixJ
1,2,Add option on XSLT to allow StAX
1,1,CLASS component does not work with StAXSource out of the box
1,2,CLASS will lock File input in case of an exception during xpath evaluation
0,2,Add default for METHOD in COMPONENT
0,2,Improve CLASS and apply it in additional places
0,2,Add support for PGP data format in Java and XML DSLs
1,1,Stop or shutdown a route with a custom timeout value will still log using the default timeout in the logs
0,1,Do not print VARIABLE in METHOD in COMPONENT
1,2,Simple expression does not find method METHOD
1,2,EXCEPTION from CLASS when is null
1,2,EXCEPTION when using SEDA route and attaching an extra consumer
1,2,Bindy does not support quoted value with separator char in CSV datasource
1,1,Bindy CSV format Should be able to SOURCE FILE with quotes
0,2,Add option to override XSLT SOURCE FILE used via header
0,1,Text improvements to COMPONENT
1,1,When a route is removed from COMPONENT CLASS is called twice
1,1,Scala DSL does not support CONFIGURATION FILE routescoped error handlers
0,2,file endpoint to raise a warning msgs if unable to autocreate the starting directory
0,2,Change cometd CLASS to use CLASS
1,1,Tokenize pair evaluated as predicate should close input stream
0,1,Unable to set METHOD on CLASS as well as METHOD on CLASS
0,1,Avoid explicit cast while using the COMPONENT or CLASS API and better rely on the overloaded counterpart of them taking a class type as the second argument implicit cast
1,1,Extra request parameters sent by the COMPONENT component
1,1,COMPONENT Using underscore in group name does not work
0,1,Make Ant path matching in file FTP component easier to use
1,2,COMPONENT can allow SNAPSHOT transitive dependencies
0,2,Improve COMPONENT awssdb component
1,2,After restarting route a COMPONENT component fires right away and it should not
0,2,COMPONENT Include details about correlation id in exchange timeout exception if a reply message did not come back
0,2,Add METHOD option to COMPONENT mail component
0,2,METHOD with predicate and skip
1,2,COMPONENT do not work
0,1,Log EIP Check if it should log first before evaluating exchange
0,1,Tech edits of CLASS and other code comments let us let us allow
0,2,Ability to specify the cache level on JMS reply to queue
1,2,Remove CLASS from COMPONENT service list when shutting down a route
0,2,COMPONENT Make it easier to use a custom thread pool for the consumer
1,2,BAM database constraint violation when restaring application
1,2,xpath expression with header with saxon may throw exception if header did not exist
0,1,add feature for COMPONENT component
1,2,Timed out Exchanges should be removed from seda queues
1,1,COMPONENT METHOD and starting context programmatically does not work
1,2,Parameter binding not working with CLASS
0,1,CLASS Should not poll if COMPONENT is starting
1,2,COMPONENT Using namespaces with xpath does not work as the namesapces is not parsed and injected into the COMPONENT model
0,1,Testing headers in multiple messages
1,2,CLASS are broken
1,2,METHOD throws an exception for Jaxb model objects
1,2,COMPONENT VERSION NUMBER incapable of working with in endpoint URIs
0,1,METHOD support for case insensitive patterns
1,2,Cannot use xquery predicate in filter after an xpath splitter
1,2,Problem Removing Endpoints
1,2,Spring security example does not work
1,1,CLASS should extend CLASS
1,2,CLASS should not use the default encoding
0,1,Add session information from cometd to COMPONENT message headers
0,1,EXCEPTION thrown if Consume method is not public
1,2,CLASS not clearing headers after verify
1,2,Error handler not called when recipient list has non existing endpoint
1,2,COMPONENT simple language wrong working with real number
1,1,simple without embedded text results in an EXCEPTION
0,2,Support SOURCE FILE of CSV files that does not contain all fields described in the annotated POJO
1,2,Streaming splitter ignores exception handling
1,2,CLASS should release the CXF when the Producer is stopped
1,2,COMPONENT route with bean element sends on startup invalid message to target route that is represented by a proxy who exposes route
1,1,Memory leak in CLASS if adding and removing a lot of seda endpoints with different queue names
1,1,Memory leak in CLASS if JMX enabled
0,2,CLASS should SOURCE FILE headers from the original message if it is a CLASS
0,2,Offer a way to not set a transaction manager in COMPONENT
1,2,Bug Unique Endpoints Leaking in CLASS
1,1,npe in COMPONENT VERSION NUMBER validator
1,1,COMPONENT Parameter length when doing Program Call issue
0,2,COMPONENT fails unpredictable
1,1,Incorrect feature CONFIGURATION FILE for COMPONENT
0,1,Timer component Should use thread name pattern so the thread name is aligned with the COMPONENT threads
0,1,Add option METHOD to csv data format in XML DSL
1,1,Timer endpoint METHOD does not work in JMX
0,1,Add the options METHOD and METHOD to csv data format in XML DSL
0,1,Set Restlet Server Options and Return HTTP Headers Set in Exchange
1,2,CLASS should SOURCE FILE the in message header to the out message
1,2,RMI endpoint does not handle nested exception and raise COMPONENT instead of EXCEPTION
1,1,bean component Handler should take precedence in a bean that implements Predicate
1,1,EXCEPTION Handler or Continued predicate is invoked twice per exception
0,2,EXCEPTION policy within global context lost when error handler redefined within route context
0,2,Avoid parsing URI each time when getting uri from endpoint
0,2,EXCEPTION No space left on device exception swallowed by COMPONENT
1,1,Backmerge COMPONENT to the Bindy component for nonrequired fields
1,1,JMX issues on CLASS
0,2,Bean component Should preserver properties from exchange to allow to transfer state
1,2,VARIABLE is not up to date
1,2,Strange warning appears WARN COMPONENT Cannot determine current route from Exchange with id
1,2,CLASS does not check the correct field to determine if a file is changing
0,2,Implement connection pooling in NUMBER component
1,2,METHOD and METHOD Endpoint URI parameters fail to be read from COMPONENT context when SOURCE FILE language is set in host operating system
1,1,Potential deadlock when shutting down COMPONENT with CLASS doing notication
1,2,Loop causes EXCEPTION on error
1,2,CLASS bombing out
1,2,COMPONENT cannot SOURCE FILE between Sharable and SOURCE FILE codecs
1,2,COMPONENT VERSION NUMBER jetty component no longer works with Jetty NUMBER
0,2,NUMBER program call should support binary format
1,2,LDAP Component lose headers
0,1,Relax simple language checking for function startend tokens to only validate start tokens has appropriate end token
1,2,Incorrect CLASS returned for converted result objects with Unicode characters
0,1,Make it possible to change the remote file name without changing the local file name
0,2,Add community and peer address of SNMP TRAP PDUs to COMPONENT header
1,2,Jetty client can corrupt streams if used in a bridge mode proxy
0,1,Dependencies with inconsitant paths in repository
1,2,COMPONENT overwrites files instead of appending
1,2,COMPONENT should not close stream after each write
1,2,CLASS do not work under Blueprint
0,1,Main is bound to COMPONENT
0,2,COMPONENT Add option to check files without downloading
0,2,COMPONENT Do not use locale if not explicit configured
0,2,Add a COMPONENT Component to support MQTT
1,1,COMPONENT Should support sign in query
1,2,COMPONENT features file does not validate
1,2,COMPONENT EXCEPTION thrown from destination resolver should trigger COMPONENT exception handling
0,1,CLASS to CLASS conversion needed for some CXF CLASS Provider scenarios
1,1,Shutting down one of the contexts breaks async redeliveries in others CLASS has static reference to a thread pool
1,1,Mail component does not work as expected Email Deletion is partially broken et Disconnect does not work well
0,2,Improve performance of CLASS
1,2,CXF Transport loses HTTP Matrix parameters
1,1,Threads EIP hangs NUMBER tests using METHOD
0,1,Better error message when trying to write a null body as file
1,2,MQTT Endpoint does not correctly return the CLASS
1,2,EXCEPTION when redeploying routes that uses CLASS
1,2,Simple does not handle empty values in predicates properly
0,1,COMPONENT Log at INFO level if shared METHOD queues are in use as they are not as fast as temporary or exclusive queues
1,1,Folder closed too early when working asynchronously
1,2,CLASS opens a CLASS which will never be closed
1,2,COMPONENT consumer does not send back a reply in all cases
0,2,Support to build the COMPONENT offline
1,1,COMPONENT should do a proper transaction demarcation while readingwriting fromto database
0,2,Add option to restrict HTTP method in COMPONENT and COMPONENT
1,1,file endpoints on windows without volume name in the path url not working in some cases
1,1,COMPONENT The spring base test class should use CLASS on teardown as its parent does
0,1,Add option to changed METHOD to denote whether a zero file size is accepted or not
1,1,ThreadID is already used exception under heavy load
1,1,Maven archetype Generates wrong plugin for surefire plugin
0,1,Improve how the AWSSQS component create a new queue with additional attributes
1,2,Multiple restlet routes of the same restlet URI but different VERBs does not work in Apache COMPONENT VERSION NUMBER both routes work in Apache COMPONENT VERSION NUMBER
1,1,Possible issue in COMPONENT Reported on user forum
1,2,NUMBER Consumer does not reliably work with SSL
1,1,File consumer EXCEPTION if configured to consume from root directory
0,2,Support key password for private key access in CLASS
1,2,In CLASS a suspended route cannot be started
1,1,COMPONENT using beanio VERSION NUMBER should be using the NUMBER beanio namespace
0,2,Make Spring Optional Bundle Import for CXF Transport
1,2,COMPONENT stepwise behavior to walk up and down relatively to avoid potential traversal issues
1,1,Logger Level is always at default METHOD when error handler is CLASS
0,1,COMPONENT Make it easier to support List as output out of the box
1,2,COMPONENT bundle should specify the mina version
0,1,An exception when constructing NUMBER endpoints should not leak the password
1,1,CLASS in COMPONENT fails every now and then
1,1,CLASS skips all CONFIGURATION FILE notifiers if one if the notifiers ignores route events
1,2,CLASS is broken can not handle correctly
1,2,Enricher with async routing not handling exceptions thrown from CLASS
1,2,EIPs using custom aggregation strategy should fail if not possible to find in registry
1,2,COMPONENT Endpoint ignores COMPONENT property in Spring configuration
1,1,Recipient list EIP Should shutdown thread pool if parallel mode enabled
1,1,COMPONENT Nullpointer EXCEPTION when disconnected from broker
1,2,Using recipient list in a METHOD METHOD situation do not work properly
0,2,Netty Should use ordered thread pool
1,1,COMPONENT Should also allow multiple consumers from multiple routes from the same queue
0,1,COMPONENT The ordered thread pool should be shared
1,1,CLASS should be thread safe
1,2,Rest route returns response with http Status code NUMBER Internal Server Error when response has CLASS or Headerexpires in header as string
1,2,COMPONENT should not get started in the METHOD method but later when the blueprint container is fully initialized
1,2,Classloader mixup when consumers across bundles share the same COMPONENT port
0,2,SpringWS consumer and producer do not propagate some custome headers and attachements to a response message
1,2,HTTP VERSION NUMBER Host header not set correctly with COMPONENT
1,2,Update CLASS to extend Visibility Timeout correctly
1,2,Configuring jetty component with a different name do not work with jetty consumer
0,2,COMPONENT Splitter eat up exceptions recorded by the underlying Scanner
1,2,COMPONENT JMS producer can block a thread under specific circumstances
0,1,CLASS should provide some easy to use utility methods to suspendresume routes as we have it already to startstop routes
1,1,ActiveMQ target endpoint with METHOD does not work together with source File endpoint with METHOD option set
0,2,limitaions on NUMBER component no means to specify acl on created object objects do not inherit acl from the bucket they belong to
1,1,regression invalid CLASS created works on VERSION NUMBER
0,1,option to add bundle directives in the generated test bundles by COMPONENT
0,2,Adding blueprint based COMPONENT tests using COMPONENT
0,2,COMPONENT Add converters for files or inputstreams
1,2,Regression in validator component in VERSION NUMBER
1,2,PreXSLT and Validator Type Conversions from byte may easily fail
1,1,COMPONENT CLASS should adhere the CLASS exchange pattern if you would ask for this MEP
0,1,FTP endpoints should support charset property like File endpoint does
1,1,File consumer When using done file name then delete the file when batch is complete
1,1,When call CONFIGURATION FILE the route does not removed from collection of route CONFIGURATION FILE
0,2,Scala DSL no METHOD method
1,2,EXCEPTION when jaxb fallback converter is used with CLASS
1,2,COMPONENT Producer should avoid blocking while waiting for connection
1,1,COMPONENT CLASS use the constant fields from CLASS for METHOD etc
0,2,CLASS should honor the METHOD instance variable by setting the MEP and sending back message headers
1,1,SJMS components CONFIGURATION FILE missing taskmanager package in COMPONENT
1,2,Cache producer is not thread safe
0,1,Dead Letter Channel Store failed route id on Exchange
1,2,EXCEPTION VARIABLE when starting the route via Karaf COMPONENT command
0,2,CLASS to lookup services with filter on nameblah
1,1,Using annotations DSL in beans may cause async callback to be called twice
1,2,COMPONENT implementation rely on some inconsistent endpoints LRU cache COMPONENT endpoints may not be called on quartz fire after some days of uptime
1,2,CLASS component is not removing added route from routers list although route is removed from Context
0,1,Add PGP signature and signature verification support to CLASS
1,1,CLASS does not work for CLASS
0,2,COMPONENT fixed length record improvements
0,2,Improve the CLASS performance
1,2,COMPONENT Email Component Missing Attachments
0,1,COMPONENT Spring registry does not look into parent contexts
1,1,COMPONENT and COMPONENT Not installable in Karaf
0,1,Check if body is a CLASS and send it directly without create a CLASS from body and headers
1,2,COMPONENT may be wrongly started and this may lead to a deadlock
1,2,SOAP over JMS does not work with COMPONENT endpoint
1,2,CLASS blueprint config having binding element may lead to EXCEPTION
0,1,Improvement to CLASS class
1,2,Race condition in CLASS recovery sometimes causes duplicates
1,2,step in a block runs when the tag is closed in the wrong place
1,2,COMPONENT CLASS exchange can time out even if response was received
1,2,Simple language bean function issue when parameter value has comma
1,2,EXCEPTION when using the imap mail component with quartz or the timer and METHOD
1,2,COMPONENT stream producer never close the stream of file
1,1,SQL component will not look for parameters in header when no body in message
1,1,Aggregate EIP Completion from batch consumer should trigger first
1,2,COMPONENT When bridging endpoints then there may be double parameter values if client sends uri parameters
0,2,COMPONENT VERSION NUMBER incapable of working with in endpoint URIs
0,1,COMPONENT should support any implementation of AmazonXXX not only AmazonXXXClient
1,1,NUMBER component should default to charset based on content type
1,2,CLASS CLASS ActiveMQ EXCEPTION
0,2,json data format Add support for configuring gson options
1,2,COMPONENT Multiple models in the same package lead to unpredictable results
0,1,NUMBER component does not support PATCH
1,2,COMPONENT in blueprint is broken
1,1,COMPONENT Possible concurrent modification exception
0,1,Sql component Add noop option to execute the query but do not change the message body afterwards
1,2,Scheduled thread pools is not removed from JMX when shutting down
1,1,Simple ognl expression Possible EXCEPTION when using String METHOD and replacing with an empty string
1,1,COMPONENT CLASS not being explicitly closed
1,2,COMPONENT blueprint configure could not be installed if there are some subelement settings
0,1,COMPONENT Shutdown thread pool on consumer should happen faster
1,1,CLASS Should ignore whitespace between quoted parameters
0,1,Bean Improve choose method logic for no parameter methods
1,2,COMPONENT failed
1,2,COMPONENT failed
1,2,Restarting routes using sql aggregation repository may lead to Class loading issues
0,1,Make CLASS support async processors
0,1,COMPONENT archetype component Use bundle packaging so component is ready to install in OSGi
1,2,CLASS does not work with METHOD
1,2,Mina UDP default codec should keep the data as byte
1,2,METHOD and METHOD not called if unit test extends COMPONENT
1,1,Property placeholder optimization broke placeholders in Spring COMPONENT configuration
1,2,COMPONENT not able to resolve schema when using METHOD
0,1,Moving logic out of METHOD
0,1,Control Bus Add suspend and resume actions
0,1,COMPONENT Loading key store and trust stores should support classpath as well
1,1,CLASS shutdown timeout of NUMBER will never timeout and go in negative time
0,2,link to COMPONENT registry in COMPONENT is missing
0,1,Validations exception should include linecolumn
0,2,COMPONENT Consumers should always use dedicated Sessions
1,2,vm component Stopping a route when using METHOD should not stop MP if there is other routes using it
1,2,Headers are not set correctly in some situation
1,2,New restlet endpoints do not work if route is created after restlet server is started
1,2,Route with suspended CLASS cannot be stopped correctly
0,1,cxf endpoints should log the parsing exception when failing to extract the root element name
1,1,File consumer Race condition for METHOD read lock strategy
1,2,METHOD of Jetty CLASS does not work when project deployed as a bundle
1,2,METHOD has no effect in nested choice CONFIGURATION FILE
1,2,COMPONENT Stateful job Redeploying bundlewar and having changed endpoint uri issue
1,2,METHOD property is ignored by CLASS
1,2,NULL values are not supported in named parameters
0,1,Cannot access to length of Array SOURCE FILE from simple language
1,1,COMPONENT throws EXCEPTION
1,1,SFTP EXCEPTION if no private key file is supplied
1,1,Routing slip EIP Does not send CLASS notifications
0,1,CLASS fills up log file with Cannot connectlogin WARN level messages
1,1,COMPONENT unable to consume on UDP multicast addresses
1,1,Wrong CLASS reference is used in method METHOD of class CLASS
1,2,COMPONENT should shutdown the bus when the endpoint is stopped
1,1,JMX browsable endpoints such as seda has some attributes listed as unavaiable
0,2,SFTP endpoint fails if the server disconnected the socket
1,1,Predicates from java dsl are not dumped to xml correctly
1,1,COMPONENT component test packages have the wrong name
1,2,COMPONENT EXCEPTION when use cxf CLASS
0,1,Add ability to connect to SQS queue of different owner
0,1,Support attaching to SQS queues where the user does not have permission to list the queues manually build URL
0,2,Add METHOD and METHOD options for jetty
0,1,CLASS should detect if its a predicate and use that instead
1,1,SJMS component throws class cast error when used with IBM SOURCE FILE MQ
0,2,FTP consumer Add option to not use LIST command
0,2,Add METHOD option to Converter to allow type converters to return null as valid response for special usecases
0,2,Throttler does not honor time slots after period expires
0,2,Simple language Have singleton language for better performance
1,2,COMPONENT Does not work well in OSGi Blueprint
1,2,Using simple language OGNL expressions does not work for Bean Binding when a field is null
1,2,Memory leak METHOD with security headers
