type,priority,summary
1,2,Add component of clients in COMPONENT does not work in a secured cluster
1,2,Wizard NUMBER JS error on load page add service wizard
1,2,Mistake in title of operation Restart VARIABLE on
1,2,Installer Undo button for repo BaseURL does not work
1,2,Ganglia Server goes to installed state after double Ganglia rrdcached base directory config changing
1,2,Supervisor under supervision fails wo ganglia server
1,2,VARIABLE should be removed from COMPONENT Storm Config section
1,2,Table of Confirm Hosts step is collapsed
0,2,Do not do serverclient version match check if VARIABLE have not been set on COMPONENT
1,2,Falcon fails to deploy
1,2,Icon Asterisk on Assign CLASS steps does not display with NUMBER depth
1,2,Print better logs for openssl issues on centosrhel VERSION NUMBER
1,2,Tez DAG Operator hover text not wrapping wide content
1,2,COMPONENT YARN UI Quick Link JMX breaks if RM port is changed
1,2,Error with finding FK constraint
1,2,unittest CLASS fails
1,2,Automatic bootstrap failed on CentOS VERSION NUMBER No module named VARIABLE
1,2,SOURCE FILE SOURCE FILE actions do not work for nonadmin users
1,2,Installer Undo button for repo BaseURL is unnecessarily present
1,2,Schema Upgrade failed when upgrading to VERSION NUMBER
1,2,Deploy stuck during generating tasks on Review page not always reproduced
1,2,Remove classic SOURCE FILE view from COMPONENT
1,2,Pig unit test class named wrong
1,2,Operation Supervisor start failed during installation but all supervisors are alive
1,2,OS type check for centos VERSION NUMBER can fail if the etcissue has CentOS Linux release VERSION NUMBER
1,2,Add Host failed on upgraded cluster on Suse
0,2,When new host components are created thru API some indication should be given that Nagios has to be restarted
1,2,COMPONENT configuration for map join conversion and tez container size seems wrong
1,2,Host Checks alternatives check results are not surfaced in Host Check popup
0,2,Usability Improve Stack CONFIGURATION FILE support for repositories
1,2,Use CLASS in Hive for init metastore DB schema
1,2,Misleading hardcoded command in paragraph NUMBER on step Manual commands of Move Master wizard
1,2,Move wizard and HA wizard gets stuck on any deploy step
1,2,Unit tests for VARIABLE VARIABLE validator and misc files
1,2,Switch SQL standard authorization to be off by default
1,2,Unit tests for steps NUMBER with small refactor
1,2,Call for requests with VARIABLE always return NUMBER most recent
1,2,Checkbox client without upper case letter
1,2,CLASS HA wizard Review page appears blank
1,2,Navigating back from Host page to Heatmaps page is broken
1,2,Fix UI Unit tests
1,2,Restart option is enabled for components in Decommissioned state but it should not
1,2,Turn Off Maintenance Mode for HDFS does not work problems with COMPONENT
1,2,COMPONENT version is unknown during installer via UI
1,2,Usability UX Default key actions for dialog boxes
1,2,Yarn Nodemanager Metrics only update every few minutes
1,2,Unit tests for VARIABLE date VARIABLE updater
1,2,Upgrading schema failed during upgrading to VERSION NUMBER
1,2,Explicitly disabling datanucleus NUMBER cache for hive
1,2,Start Services command gets stuck for about NUMBER mins
1,2,Add Services is disabled after upgrading the stack from VERSION NUMBER to VERSION NUMBER
1,2,Jobs do not show up as links for a moment when page is visited
1,2,Views do not let the user click on the Views icon in the top nav
1,2,VERSION NUMBER No job status and end time is shown for interrupted job
1,2,Alternatives issues has error message missing translation
1,2,Zookeeper smoke test failed after being triggered after deleting a host CONFIGURATION FILE CLASS
1,2,Unit tests for CONFIGURATION FILE part NUMBER
1,2,Views list not loading in COMPONENT Web
1,2,Disable security fails occasionally
1,2,CONFIGURATION FILE should set VARIABLE to false
1,2,All Services Fail To Deploy Due To Agent Parsing EXCEPTION
1,2,Adding Oozie failed at service check
1,2,Space Error in CONFIGURATION FILE
1,2,HDP deployment failed in NUMBER
1,2,File View Cleanup
1,2,COMPONENT upgrade to COMPONENT from COMPONENT logs EXCEPTION
1,2,Storm fails to start after disabling security
1,2,NUMBER cluster testing during install phase of cluster deployment install tasks were stuck in PENDING state
1,2,In some upgrade scenarios COMPONENT Webs persist keyvalue store state causes the UI to act unpredictably
1,2,Recommission a DN fails when https is enabled in COMPONENT server
1,2,View Files UI cleanup and adjustments
1,2,Pig fails to install through blueprint
1,2,Global properties are not being surfaced on service config page
1,2,Populate actions drop down of Slider App details page
1,2,Implement VARIABLE endpoint to provide app CONFIGURATION FILE
1,2,New slider app wizard should show apptypes from apptypes endpoint
1,2,Suppress any debug and info messages from package managers in SOURCE FILE
0,2,View Files UI cleanup and adjustments PART NUMBER
1,2,Predicates do not work on fields with float values
1,2,Some CLASS properties are empty but required to be filled
1,2,Slider apps table does not remove entry when app is removed
1,2,Maintenance state and status commands perf improvements
0,2,COMPONENT should generate config files in sorted order
1,2,DB connection check error if VARIABLE does not exist
1,2,Bootstrap API call says bootstrap is running even though all agents have installed and registered
0,2,Add support for auth proxy
1,2,Storm UI in COMPONENT quick link fails when Storm UI server is not cohosted with nimbus host
1,2,metrics hostname is not correct for storm
1,2,HDFS alert hangs for a long time after enabling Maintenance mode
1,2,Services Configs page for Yarn HIVE CLASS services is not displayed
1,2,Issues with jdbc properties
1,2,Master components are missing
1,2,COMPONENT Agent script should check for running processes before starting
1,2,Add Host wizard get stuck on Confirm Hosts step
1,2,Agent Custom Command Output Coerces Integers to Floats
0,2,Add SOURCE FILE custom command to YARN service
1,2,COMPONENT start command hangs if was executed via SOURCE FILE command
1,2,Hosts Components filter on Service summary page does not work
1,2,Multiple ATS appear on YARN summary page
0,2,Customize the Hadoop metrics sink to write to MySQL store
1,2,Filter by alerts fails on Hosts table
1,2,Nagios install fails on SLES due to CONFIGURATION FILE not available
1,2,issues with dialog keypresses
0,2,COMPONENT Groovy client enhancements
1,2,Bulk operations confirmation popup
1,2,NUMBER Hosts checks requests
1,2,It is not possible to input Enter on Target hosts textarea on NUMBER step of Installer wizard
1,2,COMPONENT SOURCE FILE page click CLASS link returns wrong page
1,2,JS error on POST config group request NUMBER installer
1,2,Behavior change host filtering no longer handles METHOD matches
1,2,Installer wizard COMPONENT webclient issues invalid requests after switching stacks
1,2,Incorrect value for VARIABLE of Datanode component
1,2,Unsuitable height of dropdown menu on metrics page
1,2,Decommissioned running CLASS has delete menu item in action pulldown
1,2,CLASS with hostnames on Select Hosts page of Enable CLASS HA Wizard do not work
1,2,Fix subresource names in stacks API
1,2,Unable to assign host in HA wizard
1,2,BGO popup Incorrect number of tasks in category
1,2,Installer Wizard Step NUMBER VARIABLE property incorrect value
1,2,Nagios Restart all components button does not work
1,2,Default add host sequence triggers many unseen before clusterwide operations
1,2,COMPONENT Server reset show wrong commands for DB manipulation
1,2,host checks Show Report link is missing from dialog
1,2,Security issue private key password show in logs
1,2,Hosts page there is no indication that filteringsortingpaging is happening or not CONFIGURATION FILE
1,2,Restart icon is present after Service CLASS all button click
1,2,Add host stops all services
1,2,Have spinners instead of charts at SOURCE FILE and Service tabs on IE NUMBER
0,2,Get sql metrics logic should be reviewed
1,2,Add Services fails with a server error under some conditions
1,2,step NUMBER pagination is slow
1,2,CONFIGURATION FILE should use family tag rather than type tag
1,2,Manage Config Groups if Ganglia is not installed config group popup does not appear
1,2,Prompt to put Service in Maintenance Mode when doing Rolling Restart Service Stop
1,2,Python client caches curl flags between requests causing problems
1,2,UI freezes for more than NUMBER seconds every NUMBER seconds on NUMBER cluster
1,2,Custom Command execution takes too long
1,2,CLASS makes call to endpoint without checking support for properties
1,2,Bulk Ops only targets a maximum of page size hosts
1,2,Choosing bulk hosts to decommission on NUMBER node cluster on the hosts page just spins
1,2,Rolling Restart only start stale checkbox not worked functionally
1,2,Bulk Decommission Background Operation Popup content looks broken
1,2,Add service wizard removes any new property added to coresite and global after cluster installation
1,2,Hosts page Incorrect total number of hosts after filtering by installed component
1,2,filtering by selected hosts resets pagination
1,2,After changing property and clicking save button in CLASS Config Page no comfirmation popup
1,2,Unable to restart all hostcomponents on NUMBER node cluster
1,2,Hosts page mysterious selected hosts keep coming back
1,2,hostname wrapping with icon asterisks on assign slaves
1,2,Excessive requests are sending on hosts page
1,2,In Host Detailed Page decommissioned NM is labeled as STOPPED
1,2,Many services failed to start when using custom user names and groups
1,2,Move Wizard get stuck if wizard is running second time for the same component without page SOURCE FILE
1,2,Move Wizard assign master step next button is not disabled when host input has error
1,2,Postgres create script generates errors for CONFIGURATION FILE
1,2,Config pages load slowly on NUMBER cluster for some services
1,1,Link to ExtJS license in Choose Services page has moved
1,2,Filter state does not clear in Background Operation popup and causes a lot of confusion
1,2,Unable to move CLASS
1,2,JS error occurs periodically when Job Details page is opened
1,2,Add Services Wizard can corrupt config files unpredictably
1,2,CLASS Wizard error for existing host is not present
1,2,JS errors on Jobs page if ATS is stopped
1,2,Default config group name contains undefined instead of service name in Manage Config Groups popup
1,2,Unable to proceed from step NUMBER of installer if CLASS services are selected but YARN is not HDP VERSION NUMBER
1,2,Incorrect errors count for YARN on step NUMBER of Install Wizard HDP VERSION NUMBER
1,2,Hostname case sensitivity
1,2,Unable to install cluster after coming back to step NUMBER and selecting different stack version
0,2,COMPONENT support on NUMBER NUMBER I
1,2,Create main page with table of jobs
0,2,Add ZKFC component to summary page when NNHA enabled
1,2,FE allows add host on host that is in UNKNOWN state agent was stopped
1,2,Service pluggability New added services in the stack has Add Property link in NUMBER and env categories
1,2,Fast user can skip Customize Services step add service wizard while configs are not loaded
1,2,none links affect already installed services on Select Services step
1,2,Linked Ganglia charts from Host Details page do not show any graphs except on CLASS host
1,2,Deleted hosts come back to life after COMPONENT restart
1,2,Views exception on server restart after creating view instance
1,2,Management Console UI Layout Basic Routing and Create User Management Page with mock data
1,2,Install wizard should have ability to load default final configs and save them
1,2,COMPONENT fix for VARIABLE
1,2,CLASS fails on exception message assertion
1,2,Fix unit tests that are broken after COMPONENT
1,2,VERSION NUMBER stack shows HUE in select services page
1,2,Cannot start COMPONENT due to empty metainfo table
1,2,Add Service wizard Retry installation functionality does not work
1,2,Config categories are not displayed on Configure Services step of Secrity Wizard
1,2,Memory leaks during tabs switching on Customize Services page
1,2,Oozie service can not be started on COMPONENT server with external Postgres
1,2,Unit test failures on jenkins for COMPONENT VERSION NUMBER related to alerts
1,2,Oozie fails for stack VERSION NUMBER and VERSION NUMBER
1,2,SOURCE FILE configs action does not work for Flume
1,2,Capacity Scheduler config cannot be saved
1,2,RM HA wizard is experimental but should not be
1,2,Once RM HA is configd none of the RM summary info or RM SOURCE FILE widgets show data
1,2,On HDFS config page edit boxes with memory size values have incorrect behavior
1,2,Select Host page on Resource Manager HA Enabling wizard does not save selected values after nextback steps
1,2,Flume service should be in STARTED state when no agents configured
0,2,CLASS and Slaves broken in two lines on Assign Slaves step
1,2,Resource Manager HA after enabling RM HA UI does not display standby and active Resource Managers on Summary tab
1,2,Add security configs on Add service wizard
1,2,Wizard Adding Master component does not create and install the master host component
1,2,Cleanup of Cluster Admin tab
1,2,COMPONENT installation webhcat CONFIGURATION FILE set thrift host name to be localhost
1,2,Need CLASS UI Quicklinks for active standby
1,2,CLASS cannot pass in Windows box
0,2,Throw Useful EXCEPTION on No CLASS Available
0,1,Most recent SOURCE FILE requires ActiveMQ
1,2,CLASS is not copied across ActiveMQ endpoints
0,2,enable polling via the http component
0,2,CLASS namespaces configuration not possible through xml
1,1,URL link broken in COMPONENT API doc
1,2,COMPONENT failure
0,1,New converter Node Source
1,2,exception clause does not proceed with pipeline
1,2,the VERSION NUMBER release did not seem to include the javadocs or doc directory or manual
1,2,Headers lost after XSLT processing
1,2,Fix performance counters
0,2,Upgrade geronimospecs version to VERSION NUMBER
0,2,Add getter method for METHOD property in CLASS class
0,2,cxf COMPONENT transport should support to register itself to the cxf bus automatically
1,2,Spring integration CLASS is missing in COMPONENT
1,2,Spring integration Bad urls in VARIABLE
0,1,CLASS logging improvements when exchange handled by dead letter
1,2,EXCEPTION in CXF routes when there is an endpoint between router and service CXF endpoints
0,2,support to set the aggregation stragey of METHOD
0,2,CLASS recipient list that uses multicast processor
0,1,Remove tangle between impl and VARIABLE
1,2,Multithreaded HTTP invocations does not work
1,2,CLASS does not load its defaults
1,1,VERSION NUMBER is twice in the COMPONENT distro
1,2,bad content length header value in http response
0,2,Mail component is missing some configuration possibilities
1,2,Mina TCP does not support CLASS pattern
0,1,Synchronous mode should handle exceptions being thrown from MINA
0,2,COMPONENT allowing the lazy creation of a connection
1,2,COMPONENT component cannot deal with the exception message in MESSAGE METHOD
1,1,CLASS is not connecting and retrieving remote files
0,1,Mina Producer should have configurable timeout
1,2,CLASS does not set the response status code VARIABLE it is always NUMBER
0,1,COMPONENT improvements
1,2,Support for a full customized soapfault incl faultcode and detail
0,2,Parallel processing route
0,1,Improve logging for COMPONENT
0,2,CLASS waits for MINA worker thread to timeout when stopping JVM from standalone client
1,1,Javadoc warnings
1,2,EXCEPTION handling of the CLASS class
0,1,Improve FTP component wiki documentation
0,2,METHOD should have the same parallel processing functionality that METHOD has
0,1,Improve File component wiki
0,1,Upgraded to OpenJPA VERSION NUMBER
1,2,Invalid jar in binary distribution
1,1,COMPONENT should raise an exception if parsing of xslt file fails
1,2,file endpoint with nooptrue does not detect old files moved into a directory
1,2,COMPONENT does not compile on HPUX
0,2,make it easier to create Endpoint instances nicely via Spring XML
1,2,JMX Connector is not closed by METHOD
0,1,Document File component when its using file or directory names
1,1,Javadoc improve summaries etc
1,2,CLASS does properly record processing time
1,2,COMPONENT component not propagating context data
0,2,CLASS synchronizes on process method making performance bad on XSLTs
0,2,The spi package should not depend on the processor package
1,2,EXCEPTION from camerun with below route codes
1,1,File component noop does not lock the file during processing
1,2,COMPONENT is dependent on springaop
1,2,Multicast default excecutor do not create the enough thread for parallel processing
1,1,COMPONENT should clear endpoint cache when stopping
0,1,JMX Instrumentation CLASS total processed
1,1,patch Make sure streams get closed
1,2,Missing compile step in example readmes
0,1,patch postpone creating browsing strategy until and only if its needed
0,2,Change the JMX default connetors URL to avoid the confilict with the ActiveMQ or CLASS JMX default connector
0,2,Headers should be modifiable using velocity templates
1,2,CLASS could throw EXCEPTION as stream config does not get initialized
0,2,File component file rename pattern to support patterns such as date time etc
0,2,JMX Instrumentation CLASS last processed timestamp when failed
1,2,CLASS default redelivery policy eclipsed expected transactional behaviour in a transacted route
1,2,CLASS cannot resolve converter annotations in CLASS VERSION NUMBER
1,2,jms aggregation does not work
1,2,COMPONENT example CONFIGURATION FILE is out of date
1,2,Bean method lost when sending a message from one JMS queue to another
0,2,Component documentation needs overhaul check for missing options add more samples javaspring etc
0,2,create a CLASS so you can easily use a transaction rollback on a route with METHOD to just fail the route if it cannot be processed
0,1,Transactional Client Setting Spring Policy is a bit cumbersome in the XML
0,2,Upgrade Geronimo specs to VERSION NUMBER when available
1,2,CXF Feedback from Eduard on problems with CXF over JMS
1,2,process method of should check ExchnagePAttern before setting out
1,2,CLASS doenst honor exchange pattern when it extracts the result
1,2,METHOD does not propogate headers
1,1,JMX Instrumentation Nodeid can be null
0,2,CXF Easier use for enduser to retreive POJO data
1,2,CLASS consumes file instead of producing
0,2,Change default CLASS strategy in COMPONENT
0,1,Log component should use CLASS for formatting log output
0,2,CXF wrapperunwrapper COMPONENT should be smarter
1,2,EXCEPTION on using CLASS with Apache COMPONENT as Transport
1,2,Propagated CXF headers value should not include quotes
0,1,JMX Instrumentation check for already registered before registering
1,2,When METHOD METHOD is added in a CLASS class then the timer component does not work
1,2,After the downloading process the layout of the remote file system does not match the locals one
0,2,COMPONENT transport should set the content type property into the COMPONENT message header
1,2,COMPONENT should check the CLASS when create its instance
1,2,xpath expression with header and the header does not exist on the in message results in EXCEPTION
1,2,AMQP Tests are disabled
1,2,COMPONENT METHOD is not effect when the jmx agent is disabled
1,2,CLASS should catch Throwable
1,2,Pipeline with METHOD processor also redelivers following the default policy independently from the preset errorhadling
1,2,CLASS failure
1,2,CLASS premature out message creation
1,2,delayer pattern does not work in Spring DSL
0,2,support to set the METHOD before the outputs
1,2,Should preserve the exchange type in the routing slip
0,2,File component write to temp file and rename to real name startegy
1,2,Trailing SOURCE FILE missing in CLASS
0,1,Type Converter if not possible to convert LOG a WARN
0,2,mina should be exchange pattern agnostic
1,2,Current mina component cannot tansfer the exchange fault message body
0,2,METHOD should support batch for processing large files
0,2,Access CLASS Params from VARIABLE
1,1,COMPONENT codec options should fail if not possible to find i registry
1,2,CLASS ignores custom SOURCE FILE port
1,2,element should not require METHOD attribute
1,2,The should throw the exception if there is some thing wrong with type attribute
1,2,CLASS option METHOD is not configured properly
1,2,COMPONENT component is not passing request context through correctly
1,2,file component METHOD does not work as expected matching is applied not only to file but also to directory
1,2,Remove deps on persistenceapi jar non compliant with the spec
0,1,tracer option to disable interceptors
0,2,Manage nonsingleton endpoints in the COMPONENT
1,2,COMPONENT does not build on HPUX
1,2,Inconsistency in recipient list documentation
0,2,JMS CLASS operations should default to non transacted even if the JMS component or endpoint defaults to transacted as typically RPCs over JMS are not transacted
0,2,METHOD should default to ERROR and CLASS should operate as a builder
1,2,COMPONENT documentation is misleading
1,2,METHOD attribute for COMPONENT should default to true
1,2,CLASS EXCEPTION is thrown in the latest build of COMPONENT
0,1,COMPONENT type converter to CLASS
0,2,CLASS to support constant expressions
1,2,CLASS should consider overridden methods when selecting method from operations list
0,1,bean binding annotation to get the exception from exchange
0,2,Maven goal COMPONENT should use overridden when specified
1,2,Component spring event is not auto registered by COMPONENT Add a Event file in the folder COMPONENT of COMPONENT
0,2,Http producer should be smarter to select correct GET or POST method
0,2,Quartz support should allow stateful jobs
0,2,COMPONENT http Uri from the message header
1,2,COMPONENT pipeline is drawn as a multicast
0,2,Add ability to configure log level on exceptions from DLC retry mechanism
0,2,Add support to tracer for logging out messages
0,2,Passive mode
1,2,spring integration xsd change breaks component
1,2,CLASS creates an empty out message that makes it impossible to chain more processors behind it
1,1,SOURCE FILE fails randomly
1,2,COMPONENT METHOD is buggy
1,2,SOURCE FILE METHOD returning CLASS
0,2,Remove specialized Exchange and make CLASS final to pave the road for optimization by reducing exchange copies
1,2,Cannot get the soap header when the COMPONENT endpoint working in the PAYLOAD data fromat
1,2,CLASS incorrectly reports duration NUMBER
1,2,jetty endpoints ignore host specified in URI and expose an endpoint on all interfaces
1,2,COMPONENT Exchange failures should not be returned as NUMBER
1,2,Delayer not working as expected
0,2,Spring DSL METHOD element should have ref attribute
1,2,COMPONENT does not remove METHOD URI options
1,2,CLASS and executor flags are ignored in Multicast processor
1,2,COMPONENT should propagate exception because in CLASS scenarios
1,2,CLASS does not SOURCE FILE unit of work and thus its null and thus EXCEPTION is thrown
1,2,COMPONENT adds two versions of NUMBER on the classpath
1,2,The Mina VM protocol is not recognising codec and other options
1,1,COMPONENT NUMBER is needed at runtime
0,2,File component exclusive read lock strategy using renaming
1,1,CLASS sleep for empty test does not work
1,2,Throttler appears to throttle per thread instead of throttling across multiple threads
1,1,CLASS can not lookup bean if endpoint is defined directly as a consumer from
1,2,EXCEPTION when stop the COMPONENT bundle
0,2,COMPONENT to work with google chat
0,1,COMPONENT security extension
0,2,Improve JMS header name endocingdecoding strategy
1,2,Pipeline could change the MEP unintended
0,1,Tracer allow configuration of fixed size of leading breadcrum or let it be variable sized
0,2,file consumer support expression for setting the folderfile to consume
1,2,SFTP Polling Cannot list directory Error
0,1,COMPONENT URI option for METHOD does not support lookup in registry
1,1,Starting COMPONENT using Main from COMPONENT or VARIABLE countdown latch is hanging
1,2,Can only interact with servicemixhttp if logging is at DEBUG
1,1,Jetty HTTP CLASS is not closed when COMPONENT is stopped
1,2,Apache COMPONENT example reportincident dependency removed from CONFIGURATION FILE
1,2,SQL component does not handle wrong number of parameters
1,2,COMPONENT uri set on endpoint has stripped all parameters that is wrong as they should be there as well
0,2,Seda component should configure its executor
1,2,Two more EXCEPTION when context classloader is null
0,2,The xpath expression evaluations should rest the cached stream
0,2,Add METHOD to builder support
1,2,CLASS should respect CLASS
0,2,Header should have a value default so you do not have to set the name attribute
1,2,CLASS should respect CLASS
1,2,CLASS is not threadsafe
0,2,COMPONENT improve setting of cron expression to be more cron like
1,2,File component better support for absolute path
1,2,COMPONENT Add CLASS to be used when you need to load a class instead of CLASS to work in OSGi environments
1,2,Can not load the CLASS in OSGI environment
1,2,CLASS SOURCE FILE attachments
1,2,CLASS causes to many type converters not possible
0,2,Bean component improve method selection logic for overloaded methods
1,2,SOURCE FILE of data always send the last occurence of the stream
1,2,Unable to resolve scripting languages in OSGi environment
0,1,CLASS should only add to repository after processing so we know the processing was a success
1,2,A request route with a topic node incurs a NUMBER second wait and refers to the wrong MEP
1,2,JMX instrumentation will add CLASS even if you have defined to use CLASS
0,1,Added a Spring configuration in the COMPONENT
1,2,JMS Sending a message with METHOD fails
1,2,Allow parementer append for jms bindings with no endpoint
1,2,CLASS receive does not work
0,2,Bean component should propagate headers
0,2,CONFIGURATION FILE and CLASS wrapped should be easier to route with JMS
