type,priority,summary
0,2,Add additional transition states
0,2,Preserve cluster id blueprint name and blueprint revision in agent local disk
1,2,Agent should retry heartbeat message if controller did not receive the heartbeat
0,2,Remove agent entities beans from public schema xsd
1,2,Check for NN safemode during restarts
1,2,Dependency of templeton on hcat client
1,2,Remove import of mysql puppet module from manifest
1,2,Add check to verify jdk path after install
1,1,PHP Notice Undefined variable manifest in SOURCE FILE
1,2,Support filtering hosts based on discovery status
1,2,Alert table on the right needs to be tied visuallyverbally to the contextcontent it is displaying
1,2,Remove the word alert from all the Nagios alerts descriptions
1,1,Make the daemon names and other field names consistent
1,2,Enable LZO should show checkbox instead of text
1,2,Increase puppet agent timeout
1,2,Refactor puppet kick loop to easily change retries and timeouts
1,2,Support data cleanup if installation fails
1,2,Replace SOURCE FILE with SOURCE FILE
1,2,Uninstall support from UI
1,2,Remove Playground files from HMC
1,2,Support uninstall state in mysql modules
1,1,CLASS files as appropriate
1,2,Update hive config to enable authorization
1,2,Manage services section will have any empty section when no client only components installed
1,2,Init Wizard Advanced Config validation errors can be bypassed
1,2,Nagios Admin Contact should be checked to ensure it is always an email address
1,2,Templeton data on hdfs needs to be readable by all users
1,2,Update HDFS parameter configuration description
1,2,Cleanup of utilities
1,2,Fixup review and deploy rendering
1,2,Add link to uninstall on index page
1,2,Comment in SOURCE FILE
1,2,HTML being spewed in the CLASS page
1,2,Change the status message ERROR location so that it shows below the page summary box rather than above more better visibility
1,2,regionservers config in the hbase only has localhost in it
1,2,Upgrade to VERSION NUMBER
1,2,Externalize message resources for the welcome page Update styles on various pages
1,1,Uninstalls wipe flag should be correctly passed to puppet
1,2,Grid mount points page does not let one pass with only a custom mount point
1,2,Scale puppet master to large number of nodes
1,2,During any process in the cluster initialization wizard if the user goes back to the NUMBER Create Cluster tab the user is stuck
1,2,Dependencies should be added only during install phase
1,2,Provide a way to resume if browser SOURCE FILE closed during the deployinprogress
1,2,Redundant downloads even though the artifacts are already installed
1,2,Cluster status update needs to happen for all stages of installation wizard
1,2,Making METHOD more robust
1,2,Logging in case of error during uninstall needs to be fixed
1,2,Add flow control force redirects to appropriate pages based on cluster configuration status for better usability
1,2,Redesign master service assignment page so that it takes up less vertical space
1,2,Create lock file as part of rpm install
1,2,Package up the fonts subdirectory in the HMC RPM
1,2,Improve Service Management page and general popup styling
1,2,Mysql packages not being sent during install and uninstall
1,2,Uninstall does not handle component dependencies
1,2,On Single Node install when install all the components the recommended num for CLASS Tasks is too high
1,2,CLASS myid files not existent on ZK install
1,2,Add nodes fails to find node in db
1,2,Cannot uninstall the page hangs with the spinning icon
1,2,Manual config changes for nn get reset on stopstart from hmc
1,2,Completing successful add node takes one to initialize cluster page starting from scratch
1,2,Unify the top nav for both Monitoring and Cluster Management
1,2,Add rpm spec for hmc agent
1,1,Reset service back to original state after CONFIGURATION FILE
1,2,Improve style on error log popups
1,2,Reinstall of cluster after failure to install results in failure
1,2,Fix bug with jmx parsing on CLASS
1,2,Using service stop instead of killall for uninstall
1,2,Uninstall needs to update status for failure
1,2,Duplicate CONFIGURATION FILE CLASS
1,2,Post cluster installdeploy the URL CONFIGURATION FILE should be disabled
0,2,CLASS restart HMC message when nagiosganglia is on the hmc host
1,2,nagios shows service status critical if hbase is not installed
1,2,Add nodes page alerts removed in case of adding duplicate nodes
1,2,Fix hive stop to escape
1,2,CLASS Add Nodes update progress title and ERROR messages to reflect what it is actually doinghas done
1,2,Add missing JS file for making post cluster install Add Nodes work
1,2,Show the same welcome page to the user if the user starts configuring a cluster but has not started deploy yet
1,2,Add Node installs MySQL Server for Hive
1,2,Manage service needs a way to recover from terminated browser sessions
1,2,Service CONFIGURATION FILE screens should respect the CONFIGURATION FILE attributes set in CLASS table
1,1,make support for os check a bit more robust
1,1,Add VARIABLE as column in Hosts table
1,2,Fix node assignments not not allow slaves on master
0,2,Speed up page loadreload times
1,2,Support Resume For Add Nodes
1,2,Modify the router to force redirection to Add Nodes Progress popup
1,2,Fix puppet manifests for tarball downloads via rpms
1,2,update to fix the ganglia VARIABLE anchor problem
1,2,Fix oozie smoke test failure
1,1,Fix Advanced Config HDFS reserved space is in bytes Too many bytes to count
1,2,Create a spec file with less dependencies for HMC
1,2,Rpm naming needs to be corrected
1,2,Templeton configs for pig archive not correct in HMC
1,2,Puppet fails to install NUMBER JDK properly on NUMBER
1,2,Change os type check during node bootstrap to allow NUMBER or NUMBER nodes
1,2,Puppet agent install script should use correct epel repo
0,2,Add support to jump to a specified state in the wizard for development purposes
1,2,Update README to point to trunk
1,2,Remove YUI source files from SVN
1,1,Update documentation
1,2,Nagios install fails on NUMBER
1,1,Consolidate head tags for organization and combine CSS files for faster load
1,1,Puppet error Cannot reassign variable VARIABLE at VARIABLE
1,2,In Custom config for Nagios emails with multiple periods before the fails validation
1,2,Custom Config page do not allow form submission if there are clientside validation errors
1,2,special characters in hosts files created on some common windows editors causes issues
1,2,Rat compliance patch
1,2,Externalize the manager service name and point the Help link to a valid URL
1,2,License header for PHP files should use PHP comments not HTML comments
1,2,Add a link to NOTICE file on every page
1,2,Remove SOURCE FILE dependency from the rpms
1,2,Fix lzo installs to work correctly on NUMBER
1,2,Increase puppet timeouts to handle singlenode installs timing out
1,2,The database set up script has a duplicate CONFIGURATION FILE of COMPONENT so install fails
1,2,Eliminate redundant and unused CONFIGURATION FILE for the columns in the table CLASS
1,2,hdpnagios and hdpmonitoring has wrong configuration file location also ownergroup permissions are wrong
1,1,Fix invalid HTML markup on Monitoring SOURCE FILE
0,1,Add Nodes Progress for partial failure that let us the user continue display an orange bar rather than a red bar in the progress popup
1,2,Support for Hadoop Security frontend changes
1,2,Weirdness with Custom Config page when the user goes back to previous stages
1,2,COMPONENT should install yum priorities on all nodes to ensure main repo is picked first
1,1,Make puppet generate more logs on command failures
1,2,Fix COMPONENT agent VARIABLE scripts and the bootstrapping
1,2,COMPONENT does not handle a presetup usersupplied Hive Metastore
0,2,Change text on alerts about XX hours ago
1,2,HDFS disk capacity on SOURCE FILE is seen as negative number
1,2,Remove files from COMPONENT that were not meant to be checked in
1,2,SOURCE FILE Summary capacity pie chart keeps changing colors
0,2,Create heatmap legend entries for missing datainvalid hosts
1,2,Switching services does not update various UI elements
1,2,Error handling when errors are encountered during preparation for deploy
1,2,Need to be able to reliably recover from the case when the browser is closed during deploy Step NUMBER post submission Step NUMBER of the wizard
1,2,Userspecified custom configs such as CONFIGURATION FILE overrides should be persisted to maintain what the user specified
1,2,Install Wizard Confirm host stuck at Preparing stage
1,2,Host component live status is broken
1,2,COMPONENT heatmaps and host information shows CONFIGURATION FILE for disk space used
1,2,Graphs degrade over time
1,2,On Notification Popup clicking go to nagios UI does not load nagios UI
1,2,tmpfs filesystem being added to the list in the dir used by COMPONENT
1,2,Installer Wizard Retry feature in Deploy step Step NUMBER is broken
1,2,CONFIGURATION FILE fails silently it is not firing any API calls due to a JS error
1,2,Host jams in status Preparing if host name is wrong
0,2,The check boxes to checkuncheck one of the members in a multi artifact graphs is not very readable It should be more apparent on which one the user clicked on
0,2,Check the logrun dir locations to make sure its an abs path
1,2,Disk Info Metrics and memory usage sometimes do not show up for an hour or so
0,2,Clean up table header UI for sorting and filter clear x for Hosts table
0,2,Clean up table header UI for sorting and filter clear x for Jobs table
1,2,After adding hosts the host count shown in the SOURCE FILE is incorrect
1,2,Detailed log view dialogs are not centeraligned
0,2,Automatically update hostlevel popup infologs
1,2,Remove hdp as the httpd conf for any of the nagios urls should replace it with COMPONENT or something else
1,2,Allow capacity scheduler to be attached to host role configs for CS configurability in the APIs
0,2,In any starts fails warn the host and the overall install
0,2,Add filters module
0,2,Refactor Job Browser User filter
0,2,Confirm Hosts page It looks like hosts disappear if you are on Fail filter and click on Retry Failed button
0,2,Drop the option from Hosts Component Filter and Jobs Users Filter
0,2,SOURCE FILE make disk usage pie chart in HDFS summary easier to understand
1,2,Replace sudo with su in the COMPONENT setup script since COMPONENT server setup is already run as root
1,2,Directory permissions on httpd varwwwcgibin should not be touched by COMPONENT
0,2,Host health indicator should have a tooltip showing details
0,1,Install Options line up the Target Hosts section with the rest of the page
0,2,Use emberprecompilerbrunch npm plugin
1,2,Fix the host roles live status not go back to INSTALLED if it was in VARIABLE state
0,2,Remove hard coded JMX port mappings
1,2,Service graphs SOURCE FILE with spinners
0,2,Job Browser Filter by Input output and duration
1,2,Agent checks packages as part of host check but does not tell which ones are needed or conflicting
1,2,Store example Hive Queries somewhere in COMPONENT that is easily accessible for demotest purposes
0,2,On Confirm Hosts page add a link to show the Host Checks popup in the success message
1,2,Edit User No error message is shown when the user does not enter the correct old password
0,2,Shrink top nav height
1,2,Incorrect displaying Background operations window after changing state of component
1,2,Failing build due to url moved on Suse
0,2,Make sure that COMPONENT Web renders all elements correctly when the browser width is NUMBER or narrower
1,2,Bootstrap can hang CONFIGURATION FILE
1,2,Service status host component status can get stuck in the green blinking state if stop fails no further operation can be performed
0,2,Make sure that COMPONENT Web renders all elements correctly when the browser width is NUMBER or narrower refactor
0,2,Properly display Apps page aggregate summary and data table when there are no data to be shown
0,2,Remove all text from Apps views controllers templates to SOURCE FILE
0,2,Host health indicator should have a tooltip showing few details refactoring
1,2,Switching out of Jobs page does not launch popup anymore
1,2,Cluster missing hosts after successful install and restart
0,1,Add username validation for COMPONENT local users
0,2,Show validation error when the user specifies target hosts that are already part of the cluster
0,1,Refactor Job Browser filter
0,2,Enhance CLASS progress display
1,2,Service Check fails after secure install due to wrong CONFIGURATION FILE path
0,1,Externalize strings to SOURCE FILE
1,2,Provide consistent ordering of hosts in heatmap
1,2,No alerts badge on the Host Detail page should be green not red
1,1,App Browser rows colours should alternate from dark grey to light grey and back
1,2,Mouse cursor hover behavior is strange on Job Browser
0,2,Since there is the ability to log in to COMPONENT Web as different users the current user should be indicated
1,2,Wrong calculation of duration filter on apps page
1,2,COMPONENT Agent registration hangs due to Acceptor bug in Jetty for not reading through accepted connections
1,2,Validation for username used in service configs is broken
1,2,Failure popup shown for CONFIGURATION FILE HDFS when CLASS is not installed
0,2,Remove hardcoded stack version
1,2,Cannot proceed after bootstrapping in some cases due to a runtime error while running host checks
0,2,Optimize query call for retrieving host information
0,2,Optimize query for getting service and host component status back from the server
1,2,CONFIGURATION FILE Read and Write locks for METHOD
0,2,Optimize ganglia rrd script to be able to respond within reasonable time to queries made by the UI
1,2,Further optimization of querying host information from the server
1,2,Fix CLASS to take care of issues when gethostname and getfqdn do not match
1,2,Fix alerts at host level if CLASS is not selected not to alert for tasktrackers not running
1,2,Nagios script causes unwanted Datanode logs
1,2,Add hadooplzo to be one of the rpms to check for before installation
1,2,Make all service properties CONFIGURATION FILE
1,2,Fix start up option for COMPONENT where there is a missing space
1,2,Add hosts is broken
0,2,Hosts page add filtering by host status
1,2,COMPONENT Web goes back and forth between frozen and usable state peridocially on a large cluster
1,2,Alerts take around NUMBER seconds to show up everytime you SOURCE FILE the SOURCE FILE
0,2,Hosts page layout fixes
0,2,Constrain the width of all wizard popups
1,2,Jobs failed count always returns NUMBER in the jobtracker API metrics
0,2,Stack Upgrade Wizard resume upon page SOURCE FILE login
0,2,Host progress popup generic component for showing progress on async operations
1,2,Cannot start hadoop services after hdfs CONFIGURATION FILE and amabri server restart
1,2,Templeton smoke test fails for secure cluster
1,2,CONFIGURATION FILE UI should not allow certain configs to have hostlevel overrides
0,2,Security Wizard integrate host progress popup
1,2,Some map and reduce task metrics are missing for the tasktrackers in the API
1,2,Undo should not be allowed on component hosts
1,2,Oozie properties for principal and keytab not read from ooziesite
1,2,Starting all services fails on secure cluster excluding CLASS and CLASS
1,2,COMPONENT need to set the value of VARIABLE
1,2,Agent has it hardcoded that HDP repo file can only be downloaded once
1,2,It seems upgrades available at the FE is hardcoded to VERSION NUMBER
1,2,CLASS and Zk failed to start on secure install
0,2,Backend support for MySQL and Oracle for Oozie and Hive
1,2,Add support for Stack VERSION NUMBER to COMPONENT
1,2,Unable to get all tasks from more than one VARIABLE by one request
1,2,Hue installation fails due to manifest errors
1,2,Security wizard Javascript error is thrown when METHOD is included as a secure service
1,2,Stopping and then Starting all services does not start CLASS
1,2,Can not specify request context for smoke test request
1,2,Security wizard Add missing secure configs to Hbase service and make zookeeper as default primary name for zookeeper principal
1,2,CLASS master shuts down immediately after start in a secure cluster
1,2,Few coresite properties SOURCE FILE after seemingly benign CONFIGURATION FILE
1,2,Cluster Management Services CLASS Config throws JS error and the page comes up blank
0,2,For global properties show restart for appropriate services only
0,2,Make single PUT call for multiple host overrides
1,1,Cosmetic problems on CLASS SOURCE FILE
0,2,Capacity Scheduler when adding a new queue populate fields
1,2,Cannot load Nagios Alerts due to NUMBER Bad Request
1,2,Master broken Cannot deploy services
1,2,COMPONENT RPM claims SOURCE FILE of usrsbin
1,2,COMPONENT FE is not setting proper value for VARIABLE
1,2,HUE pid and log dir labels are flip flopped
0,2,Capacity Scheduler implement usergroup and admin usergroup validation rules
0,2,Reassign Master Wizard Step NUMBER prevent proceed next without changing target host
1,2,NUMBER API uses type to refer to config tags and no longer exposes filename as a property
1,2,API to map global properties to services is partially complete
1,2,Impossibility to scroll metric window after browser width changing
1,2,Disable editing Capacity Scheduler on host configs
0,2,Update default stack version to VERSION NUMBER
1,2,CLASS master does not come up after disabling security
1,2,Client install tasks are shown twice in install progress popup
1,2,COMPONENT CONFIGURATION FILE Missing Property for LZO enabled VARIABLE
1,2,CLASS History Server failed to come up on VERSION NUMBER stack and the request for service stall is stalled
0,2,Allow for users to customize Nagios user accounts
1,2,Allow for users to customize Ganglia gmetad gmond user accounts
1,2,Test failure METHOD
1,2,Security vulnerability with Ganglia and Nagios
1,2,All Service Smoke tests fail when run with service start
1,2,Oozie Smoke test fails with errors on the start servicesinstall page
1,2,System logs are not present on tasktracker
1,2,hadoop dependency version for COMPONENT is hardcoded making it regular expression based to pick latest from the repository
1,2,Wrong install status shown in Add Service Wizard
1,2,Hosts table whether the alert filter is in effect or not is not clear
1,2,Client install tasks are shown twice in progress popup during start phase of install wizard update API call to include CONFIGURATION FILE
1,2,Deploying VERSION NUMBER results in several alerts is it related to hardcoded port
1,2,When nagios is unavailable return null instead of throwing an EXCEPTION
1,2,Hostname pattern expression is broken
1,2,Filtered hosts get out of sync with the filter selection
1,2,Action buttons on host details page not formatted properly on Firefox
1,2,Clicking on Cancel on the Service Config page should not reload the entire app
1,2,Filtering on Jobs table does not work under certain situations
0,2,Hosts tab clicking on red badge should not toggle Alerts filter
1,2,Using mixed OS overwrites COMPONENT during install
1,2,Cannot delete cluster with components in UNKNOWN state
1,2,Cannot decommission data node ensure recommission also works
1,2,COMPONENT Server becomes unresponsive after SOURCE FILE on http reads on jersey
0,2,Add validation checks for Add Property on custom site configs
1,2,Error when loading mainservices directly
0,2,Make frontend changes to account for the host component status UNKNOWN
1,2,Add clover code coverage profile
1,2,Disable Add Component button in the Host Details page if the host is in UNKNOWN state or METHOD
1,2,Add local user button is enabled but nothing happens upon clicking it under certain conditions
1,2,Services links on SOURCE FILE connected to incorrect pages
1,2,Add Unit test to verify client reinstall for install failed client
1,2,If Install from Local Repository selected in install wizard Add Host wizard not working
1,2,Host Detail page if the host component is in VARIABLE state we should let the user reinstall it
0,1,CLASS Heatmaps clean up labels and units
1,2,Hadoop group customization does not take affect
1,1,Preparing to install message needs spacing
0,2,Changing service directories should popup a confirmationwarning dialog upon save
1,2,Admin role cannot be assigned to LDAP user
1,2,SOURCE FILE failing during installation
1,2,Tasks are not filtered by parent request id
1,2,Post COMPONENT upgrade Hive and Oozie fail to start after CONFIGURATION FILE
1,2,It is possible to get into a state where install retry is not possible if the agent stops heartbeating
1,2,Hive service check still failing with file permissions
0,2,Support for configuring and running COMPONENT Web Server https
0,2,Enable customization of smoke test user
0,2,COMPONENT modifications to allow for Hadoop Compatible Filesystems HCFS
0,2,Use modified dependencies if a stack contains an HCFS service Hadoop Compatible File System
1,2,Set default value of oozie property VARIABLE to true
1,2,Home paths are not set correctly in CONFIGURATION FILE
1,2,HBASE fails to start on master
1,2,Installation with existing Oracle DB fails
1,2,When hive and oozie users have been changed after upgrade hive metastore and oozie cannot start properly
1,2,Capture user for auditing config changes
1,2,COMPONENT needs to set right path for GC log directory of Hbase process
1,2,Sometimes stale host host component indicators are shown
1,2,After upgrading COMPONENT from VERSION NUMBER to VERSION NUMBER the server throws NUMBER error when startingstopping any service
1,2,Datanode Start fails in secure cluster
1,2,Host status filter not restored on Hosts page when navigating back
1,2,Fix unit tests for COMPONENT Web
1,2,TEST BROKEN FAIL VARIABLE VARIABLE
1,2,Remove VERSION NUMBER stack CONFIGURATION FILE since its never been used and is redundant
1,2,NUMBER Monitoring Jobs page should be hidden when HDP VERSION NUMBER stack is installed
1,2,Update mock json data for Test mode
0,2,Agent heartbeat lost during install
1,2,COMPONENT has a deadlock when reinstalling after reboot of cluster nodes
1,1,COMPONENT start script COMPONENT will never use VARIABLE
1,2,Background operations popup does not automatically SOURCE FILE the task log
0,2,Add unit tests for Utils
1,2,Reassign Master Wizard SOURCE FILE page on step NUMBER NUMBER or NUMBER breaks wizard
0,2,Change config loading mechanism to allow for different stack versions
1,2,Increase COMPONENT test coverage
1,2,Using an external MySQL Oracle database for Oozie does not work
1,2,Fix MySQL and Oracle DDL scripts according to last DB changes
1,2,Ensure version values are used appropriately throughout COMPONENT
1,2,Allow Security related configs to be modified via custom settings
1,2,CLASS button may stay enabled for NUMBER seconds after it has been clicked
1,2,Bad hosts query example in API docs
1,2,On install Options page when selecting Perform manual registration on hosts and do not use SSH is setting Path to NUMBER JDK disabled
0,2,Provide way to optionally enable twoway SSL for CLASS communication
1,2,Configuration mapping metadata on COMPONENT should be computed as per the stack selection
1,2,COMPONENT Upgrade prcoess should preserve the old configs and add the new config options to the old config files
1,2,NUMBER EXCEPTION creating service component during install
1,2,UI allows adding already existing properties to custom CONFIGURATION FILE CONFIGURATION FILE settings and creates confusion
1,2,Security Wizard navigation not locked down causes artifacts and other unwanted side effects
1,2,API call to get metricscpu does not work for CLASS and CLASS host components
1,2,Enhance processing of SOURCE FILE before starting COMPONENT server
0,2,Unit Tests Added tests to install wizard for step NUMBER NUMBER NUMBER
1,2,Intermittent test failure with CLASS port Scanner test
1,2,Security Wizard webhcat Server start fails on enabling security
0,2,Show installed stack and its services
0,2,Unit Tests Added tests to models
0,2,Add Host Wizard show info about manual steps required on a secure cluster
1,2,Add unit tests for COMPONENT python changes
1,2,Bootstrap is broken for COMPONENT web with VERSION NUMBER
1,2,COMPONENT setup borken in trunk
0,2,Add support for classic SOURCE FILE
1,2,COMPONENT setup should allow user to change database password
1,2,Kerberos globals are shown in HDFS config page during install
1,2,Installer Wizard NUMBER CLASS and CLASS should not be cohosted by default on multinode cluster
1,2,HDFS Config page is broken in METHOD on trunk
0,2,Set default widgets to show for the SOURCE FILE
1,2,Bootstrap failed on rhel VERSION NUMBER
1,2,COMPONENT server start fails with CONFIGURATION FILE user
1,2,Security wizard smoke test for services fails with customized service user names
1,2,Upgrade from VERSION NUMBER to VERSION NUMBER fails because the ddl script does not work metainfo version change is broken
1,2,Add unit tests for bootstrap and METHOD python scripts for the server
0,2,Create command line script to manipulate COMPONENT configurations get set add delete
1,2,CLASS database settings should accept custom JDBC URLs
1,2,Remove unnecessary check for hostnames service name which is wrong
1,2,COMPONENT bootstrap actions report success even if a failure happened
1,2,SOURCE FILE page has a lot of footer padding
1,2,she VARIABLE is not working in a reliable way
1,2,Issues with setup ldap
0,2,Security Wizard show which principals and keytabs need to be created on which hosts
0,2,Remove dependence on VARIABLE global for Nagios checks
1,2,Cleanup setup https flow
1,2,Cannot add property VARIABLE
1,2,Decommission data node not working in secure mode
0,2,Add download CSV action for security wizard
1,2,Zookeeper smoke test failing in secure cluster
1,2,Add helpful message when not able to download jdk with setup options for the user to be able to specify the jdk
1,2,Incorrect permission on CONFIGURATION FILE
1,2,Some memory configs are set to NUMBER in COMPONENT
1,2,Custom Repo URL cannot be set when nonroot
