type,priority,summary
1,1,CLASS returns incorrect and invalid date strings
1,2,COMPONENT added a new message to COMPONENT during engine shutdown and it changed the database shutdown message Need to update docs with that information
1,2,test failure in COMPONENT with ibm jvms
1,2,Files with missing ASF license headers
1,2,EXCEPTION while inserting into a table which has a generated column and an insert trigger
1,2,Missing escape for apostrophes in many messages
1,2,Sequences do not work in INSERTSELECT
1,1,METHOD methods do not agree on trailing zeros
1,2,CLASS run does not unwrap EXCEPTION which can lead to failure of METHOD
1,2,Override mechanism for CONFIGURATION FILE works backwards
1,1,Errors should be displayed if using wrong CLASSPATH to make documentation target for release
1,1,Recompilation may cause duplicate entries in the XPLAIN table
1,1,Missing METHOD in CLASS
0,1,Simplify VARIABLE with CLASS
1,2,EXCEPTION in METHOD with ibm jvm VERSION NUMBER
0,1,Unchecked warnings in CLASS and VTI demos
1,2,EXCEPTION when calling boolean metadata functions with VERSION NUMBER client against VERSION NUMBER server
1,1,Thread local METHOD is not removed from app threads when COMPONENT is shut down
0,1,Refactor access to primary structures in CLASS
1,1,EmbeddedXADataSource with createtrue attribute set in METHOD fails with EXCEPTION Database not available
1,2,Four replication tests fail on METHOD with ERROR METHOD did not succeed
1,2,METHOD may throw EXCEPTION causing confusing console stack trace at server shutdown
1,2,Instability in COMPONENT
1,2,test failure in CLASS in METHOD
1,2,VARIABLE stuck in VERSION NUMBER
1,1,Embedded COMPONENT does not start when COMPONENT is dynamically uploaded added to the classpath
1,2,Backward confusing error message when you use the wrong CLASS method in the client driver
1,2,EXCEPTION when running CLASS from Ant
1,2,Race condition in METHOD when reopening CLASS after interrupt
1,2,Replication tests lose COMPONENT for slave
1,2,Retrying after interrupts in store pops a bug in COMPONENT in some cases
1,2,failure in VARIABLE with NUMBER NUMBER
1,2,ALTER TABLE DROP COLUMN may leave triggers invalid even if they are not using the column getting dropped
1,2,CLASS can fail with ERROR NUMBER Required property COMPONENT has not been set with slow configurations
0,2,Release notes should specify which Java version is needed to run COMPONENT
1,1,Intermittent bug in CLASS
1,1,patch fix npe in error condition
1,1,patch Client driver lexer to determine statement type fix bad attempt at incrementing a variable
0,1,patch remove erroneous throws clauses on non derivable methods that do not throw
1,1,patch override equals correctly
1,1,Cannot find Ant libraries when building from CLASS
1,2,CLASS fails after we enabled the automatic calculation of index statistics
1,1,patch derived CLASS attempts and fails to override a method from base
0,1,patch SOURCE FILE being native is more performant
1,1,patch bad field masking makes non functional METHOD evaluation
1,2,CLASS on new BOOLEAN type throws exception
1,2,Assert failures in CLASS
1,1,Intermittent assert failure in METHOD
1,1,patch Bad name collision causes non functional method
0,1,patch reduce superfluous boxing histrionics
1,2,Embedded driver allows METHOD on BOOLEAN column
0,1,patch remove unused fetching of data dictionary
0,1,patch use string buffers when building strings in loops
1,1,test METHOD with IBM VERSION NUMBER in METHOD EXCEPTION The exception ERROR interrupt flag lost was thrown while evaluating an expression
0,1,patch move instanceof check up above where casts occur
0,1,patch remove non productive instanceof checks
1,1,Incorrect list of compatible JRE versions in client trace
1,2,COMPONENT caused a regression which will not allow users to drop a table if the table was involved in a trigger action rebind during ALTER TABLE DROP COLUMN
1,2,EXCEPTION in CLASS during shutdown
1,2,After specifying deregisterfalse on the engine shutdown URL COMPONENT forgets that the default behavior is deregistertrue
0,2,Disable istat logging by default
1,1,EXCEPTION in istat daemon when encountering critical exception during shutdown
0,1,patch avoid Boolean allocations for rowset data in client cursor
0,1,patch avoid Integer allocations fetching client meta data info
1,2,CLASS depends on implicit ordering of test cases
1,2,CLASS depends on implicit ordering of test cases
1,2,Lacking cleanup in METHOD
1,2,Assert failure in METHOD
1,2,CLASS fails with DUMMYINT is not recognized as a function or procedure
1,2,COMPONENT CLASS FOO already exists in Schema APP
1,2,nightly test failure in COMPONENT
1,2,Incomplete quoting of SQL identifiers in CLASS
1,2,CLASS fails with PMDD is not recognized as a function or procedure
1,2,Cannot rollback after syntax error in internal statement
1,2,CLOB INOUT arg set to NULL by procedure does not preserve NULL value when reinvoked
1,1,patch fix up sql cleanup handling
0,2,CLASS should ignore GCJ installations
1,2,Setting up network server for management tests hangs intermittently
1,2,Interrupt of create table or index VARIABLE a container will throw NUMBER under NIO connection survives
1,2,Client driver silently truncates strings that exceed NUMBER
0,2,Remove usages of CLASS to obtain an Embedded Connection in COMPONENT Server
1,1,assert failure in test METHOD interrupted flag cleared
0,1,METHOD null METHOD null does not return the columns meta for a SYNONYM
0,1,Simplify bytecode generation for concatenation operator
1,1,Warnings regarding CLASS displayed when generating CLASS
1,2,A table created with VERSION NUMBER with constraints cannot be dropped with VERSION NUMBER due to EXCEPTION with insane build or ASSERT FAILED Failed to find sharable conglomerate descriptor for index conglomerate with sane build
1,1,Engine code references COMPONENT
1,2,Intermittent CLASS in CLASS
1,2,Large batch of DDL in a database procedure dies on a transaction severity error
0,1,Update toolsidenetbeans directory
1,2,Unable to boot VERSION NUMBER database fails during softhard upgrade process for a new version number while trying to drop jdbc metadata
1,2,test failure EXCEPTION with NUMBER weme VERSION NUMBER in COMPONENT
1,2,CLASS and views
0,1,Change COMPONENT to print the class as well as fixture name
0,1,Remove dead methods June NUMBER
1,2,Assert failure with CASE expression in GROUP BY clause
1,2,Incorrect use of CLASS in CLASS
1,2,Repeated database creation causes CLASS
1,2,Starting NUMBER weme VERSION NUMBER upgrade tests started failing with NUMBER failures NUMBER errors with EXCEPTION
1,2,CLASS fails on METHOD
1,2,NUMBER fails on METHOD
0,2,Restricted Table Function support should pass NOT EQUAL restrictions to METHOD
1,2,CLASS in METHOD in CLASS
1,1,EXCEPTION in CLASS in replication slave mode METHOD
1,2,By default only the DBO should be allowed to run several of the diagnostic CLASS
1,2,Intermittent failures in CLASS and CLASS
1,2,METHOD fails on METHOD ERROR Number of class names exceeds vm limit
1,2,METHOD failed EXCEPTION Unparseable date Thu Sep NUMBER NUMBER CEST NUMBER
0,2,Make COMPONENT run on Oracle Java ME Embedded Client
1,1,On METHOD COMPONENT METHOD
1,2,Unauthorized shutdown should not generate thread dump and javacore CLASS dumps over NUMBER javacores with IBM JVM for normal user errors
1,2,Empty MAPS table in toursdb
1,2,CLASS may fail to destroy the process when a timeout is specified
1,2,ERROR NUMBER deadlock in nstest on select METHOD
1,2,Problems running CLASS and replication tests on Open JDK NUMBER for Mac OS X
0,1,ant release should not modify drdamaint version
0,1,Speed up message splitting in build
0,1,Speed up creation of bin scripts
0,1,Do not run CLASS unless messages have changed
0,1,Reduce number of jar invocations in the SOURCE FILE target
1,2,Restrictive file permissions permissions removed also for owner on NTFS if Acl does not contain explicit entry for owner
1,2,Same value returned by successive calls to a sequence generator
1,2,EXCEPTION in CLASS
0,2,Subquery is only allowed to return a single column When using COMPONENT with hibernate or JPA queries are created per JPA spec For tables with multicolumn PK subqueries are created with two columns in select clause
1,2,CLASS NUMBER and replication tests not prepared for space in CLASS
1,2,CLASS CLASS COMPONENT already exists
1,2,CLASS EXCEPTION in indexstatthread
0,2,Harden password SOURCE FILE in the builtin authentication service
0,1,Call METHOD and METHOD without reflection in BaseJDBCTestCase
0,1,Remove unnecessary field METHOD in CLASS
1,2,CLASS fixture METHOD fails intermittentlyt
1,2,COMPONENT threads hanging when using ClientXADataSource and a deadlock or lock timeout occurs
1,2,EXCEPTION in generated VTI code
1,2,CLASS NUMBER or NUMBER with ibm VERSION NUMBER and VERSION NUMBER on Windows XP in VARIABLE fixture METHOD
1,2,Java deadlock between CLASS and NUMBER patch attached
1,2,Race conditions in CLASS checking for a null physical connection
0,2,Network Server should reject client connections that are not COMPONENT Network Client
1,2,METHOD fails drop view cannot be performed due to dependency
1,2,ERROR Should not hold locks after commit in CLASS
1,2,CLASS getting multiple errors trying to delete filesdirectories during teardown
1,2,Access denied SOURCE FILE METHOD in METHOD
1,2,Select statement with subqueries with group by and count distinct statements returns wrong number of results
0,1,patch access static constants with static references
0,2,Prepare old test harness for running tests on Java NUMBER
1,1,CLASS prints EXCEPTION Connection reset to console but test passes
1,2,EXCEPTION in Store when running SELECT in a readonly database accessed via the classpath subprotocol when authentication authorization and Java security are turned on
1,2,System can run out of stack space while processing CLASS requests
1,2,CLASS in CLASS on METHOD
0,2,Get upgrade tests to pass on OJEC VERSION NUMBER
1,1,NATIVE warns about password expiry for DBO
1,2,Rolling back a transaction leads to an inconsistent state
1,2,When a foreign key constraint on a table is dropped the associated statistics row for the conglomerate is not removed
1,2,Back out the concurrency improvements for identity columns introduced by COMPONENT
1,1,intermittent test failure in COMPONENT
1,2,Authorization decorators do not null out connections when done
0,1,Clean up statements in CLASS
1,2,CLASS keeps references to nondefault connections
1,2,METHOD does not call METHOD
1,2,CLASS holds on to resources after completion
1,2,CLASS holds on to resources after completion
1,2,CLASS holds on to resources after completion
1,2,CLASS keeps references to statements after completion
1,2,CLASS keeps reference to connection after completion
1,2,CLASS does not call METHOD
1,2,CLASS lacks call to METHOD
1,2,CLASS forgets to call METHOD
1,2,CLASS sometimes keeps reference to connection
1,2,Replication tests keep references to connections after completion
1,1,CLASS does not clean up its test resources
1,2,EXCEPTION in METHOD caused by CLASS
0,1,Remove unsued code in METHOD
0,2,Native user authentication improve wording of error message
1,1,Sending an empty string as table name to compress table procedure or empty string as index name to update statistics procedure makes the parser throw an exception
1,1,Missing argument in some NUMBER errors
0,1,Use CLASS where possible
1,1,Upgrade tests should print full EXCEPTION stack trace when it fails to access old versions
1,2,Table functions should only accept arguments which are constant in their query block
0,1,Remove duplicated code for starting remote processes in replication tests
0,1,Replication tests should use METHOD to run local commands
0,2,Make it possible to turn off encryption on an already encrypted database
1,1,Documentation in release does not include SOURCE FILE
0,1,Remove unused methods in VARIABLE
1,2,CLASS in METHOD
0,1,Disable SOURCE FILE on platforms that do not support VARIABLE or SJIS
0,1,Remove unused class CLASS
0,1,Add METHOD to junitcore ant target
1,2,METHOD fails with ERROR expected an error indicating the db is readonly on HP java VERSION NUMBER
1,2,Make CLASS threadsafe
1,2,By using VARIABLE you can set the database version to a garbage string which prevents you from booting the database
0,1,Clean up IDE warnings in CLASS
0,2,Remove unused methods in CLASS and CLASS
0,1,Remove JDBC NUMBER constants from VARIABLE
0,1,Prune the brokered class tree
0,2,Add message argument names as comments to SOURCE FILE message file produced by CLASS
0,1,Simplify NUMBER implementation class tree
1,2,The order of argument names in CONFIGURATION FILE is sometimes wrong when the arguments occur in the message out of sequence
1,1,Broken handling of paths with special characters in METHOD
0,1,add NUMBER class to METHOD
1,1,Incorrect list of compatible JRE versions in client trace METHOD
0,1,Add utility methods to query state of URL attributes in CLASS
1,2,Missing method exception raised when using Clobs with territory based collation
1,2,EXCEPTION in SELECT involving subselects and windows functions
1,1,Timestamp comparison failure in METHOD
1,2,Encryption reencryption and unencryption silently fail if the database is already booted
1,2,Grammar does not accept OR operator without parentheses
0,1,Stop producing byte code for nonexistent qualifiers
0,1,Use METHOD to start process from CLASS
1,1,Replication tests fail on CDC platforms without optional JSSE package
1,2,CLASS assert failure Only one of the waiters should be aborted
1,2,EXCEPTION in INSERT INTO SELECT FROM ORDER BY
1,2,IN lists with mixed types may return wrong results
0,2,Lift the arbitrary limit on the number of routine parameters
1,2,in list multiprobe by primary key not chosen on tables with NUMBER rows
1,2,Failures in METHOD related to index cardinality statistics
1,2,NUMBER of errors in nightly test run on weme after jacoco propertypriviledges checkin
1,2,Package javadoc SOURCE FILE out of date
1,2,COMPONENT fails with The handle is invalid EXCEPTION
1,2,Upgrade tests fail on NUMBER
1,2,Investigate why setting a login timeout causes CLASS to fail when run in a suite
1,2,SSL Test and network server can hang if METHOD fails for something other than an EXCEPTION
1,2,SOURCE FILE error in CLASS as part of CLASS
1,2,select from view with upper and in list throws a EXCEPTION
1,2,nightly regression test failure intermittent error COMPONENT
1,2,nightly regression test failure COMPONENT Column value mismatch column NUMBER
0,2,Add automatic cleanup of connections opened with METHOD
1,2,COMPONENT does not report warnings raised by table functions
0,1,Simplify code that handles LOB files
1,1,Interrupt restarts clock for login timeout
0,1,Clean up registered format ids
1,2,CLASS does not proprogate original jvm D flags to spawned JVM leading to LAB regression test failures
1,1,Cleanup suspect coding practices in COMPONENT package
1,2,Query against view with where name LIKE NUMBER ESCAPE failed
1,1,Cleanup suspect coding practices in COMPONENT package
1,1,Cleanup suspect coding practices in the COMPONENT package
1,1,Cleanup suspect coding practices in the COMPONENT package
1,1,Cleanup suspect coding practices in the COMPONENT package
1,1,Cleanup suspect coding practices in misc COMPONENT packages
0,2,Make Optimizer trace logic pluggable
1,1,EXCEPTION when calling a procedure with subquery as argument
1,2,Issues with latest JDK NUMBER EA build because of missing CLASS
1,1,CLASS assertion error on contents of stdout from subprocess
0,2,Use the JVMs cache of Number instances in CLASS
0,1,Remove unnecessary checks for EXCEPTION in the client
1,2,CLASS fails on latest JDK NUMBER EA
1,2,METHOD test failing in nightly regression tests
0,2,Add ability to print a COMPONENT execution CLASS as xml
0,2,Add ability to compactly specify a complete query plan in an optimizer override
1,2,EXCEPTION when using more than one parameter in COALESCE
0,1,Use SOURCE FILE in METHOD
0,1,Allow tests to show detailed error when spawning new process fails
0,1,Simplify CLASS using METHOD
1,2,Intermittent failures in METHOD
1,2,METHOD VARIABLE unexpectedly NULL
0,2,Log a page dump to COMPONENT if ERROR nospc VARIABLE is returned to the user
1,1,Fix incorrect throws and exception tags in javadoc
1,2,METHOD should return NUMBER now that we have implemented JDBC VERSION NUMBER
0,1,Simplify CLASS use as they are mutable
0,1,Remove Profile attribute from jar file manifests
1,2,failure in COMPONENT Error NUMBER should have been caused by indexconstraint
1,2,EXCEPTION in VARIABLE
1,2,CREATE TRIGGER does not detect all illegal references to SESSION schema
1,2,Errors in VERSION NUMBER if COMPONENT is first in the classpath
1,2,EXCEPTION in CLASS
1,1,EXCEPTION when launching COMPONENT from windows subst drive
1,2,CONFIGURATION FILE select privilege should be checked in subqueries
1,2,Incorrect handling when using an UPDATE to SET an identity column to DEFAULT
1,2,Incorrect privileges may be required for INSERT and DELETE statements
1,2,Connections opened by CLASS never get released
1,2,EXCEPTION when calling function from trigger
1,2,CONFIGURATION FILE loop in METHOD
1,2,CLASS API breaks when username or password contains nonascii characters
0,2,Create a regression test which will fail if classes from one COMPONENT jar file leak into another jar file
0,1,Revamp the vti demo to look and behave more like the other demos
0,1,Include CLASS in client exception messages
1,2,Optional tool registration may fail because the CLASS is not always available at execution time
1,2,intermittent error in nightly regression tests CLASS
1,2,Starting network server on a network drive fails with JDK NUMBER on Windows
1,2,ERROR CONFIGURATION FILE a function and procedure
0,1,Remove CLASS and its implementations
0,1,Remove METHOD field from subclasses of CLASS
1,2,Syntax error when reference to transition variable has whitespace around it
1,2,SOURCE FILE locale flunks CLASS
1,2,COMPONENT fails when the starting version of the upgrade trajectory is VERSION NUMBER
1,2,Sequence generator makes CREATE TRIGGER fail with internal error
1,2,NOT elimination for CASE expressions is broken
1,1,VARIABLE function throws EXCEPTION in UPDATE statement
0,1,Simplify handling of untyped nulls in CASE and NULLIF expressions
1,2,Incorrect nullability for CASE expression with parameter
0,2,add CLASS ij command to match CLASS
1,2,CLASS failed while updating sequence value on disk
1,2,Broken link in API docs to COMPONENT documentation
1,2,User procedures can call system procedures circumventing SQL authorization
0,1,Use CONFIGURATION FILE interfaces for CLASS support
0,2,Check type of usersupplied modules before creating instances
0,1,Support standard syntax for altering column nullability
1,2,Compilation error using a view as the source data set for a MERGE statement
1,2,Rollback to savepoint allows violation of deferrable constraints
0,2,Allow COMPONENT to rename tables referenced by foreign keys
1,2,Permission problems when running CLASS tests with Ant VERSION NUMBER
1,2,VARIABLE should not be allowed as argument in a procedure call
1,1,Assert EXCEPTION when using COUNT in MERGE matching clause
1,2,OOME when running CLASS with smaller heap
1,2,Add COMPONENT to the class paths of the scripts in the bin directory
1,2,Add COMPONENT to the maven artifacts we SOURCE FILE
1,2,Cannot create a Lucene index if a key columns name is casesensitive
1,2,The jacocojunit target fails to store coverage data for some subsuites
0,2,For update statement collect generated keys if VARIABLE flag is supplied to the JDBC call
0,2,Remove need for SOURCE FILE for executing ij or upload it on ibiblio
1,2,Fix hardcoded JDBC VERSION NUMBER type constants
1,2,In VARIABLE certain test orders because EXCEPTION
0,1,Utilize JQL to fetch JIRA issue list for release notes generation
0,1,Remove unused parameter in splitmessages
0,2,open Modal Window without CLASS
1,2,missing NUMBER URL encoding
1,1,Wrong source paths in CONFIGURATION FILE
1,1,COMPONENT fails when calling METHOD on a CLASS to a mounted resource
0,2,Make debug settings session dependent
0,2,Support case insensitive mount paths
1,2,CLASS does not set request parameters for unchanged form fields
1,2,EXCEPTION in SOURCE FILE
0,1,Russian CONFIGURATION FILE
0,2,extract CLASS interface from CLASS
1,1,Lazyregistration fails for mounted resources
0,1,Remove CLASS from VERSION NUMBER
1,2,EXCEPTION after deserialize COMPONENT
1,2,wrong handling of exceptions for METHOD and METHOD
1,2,mounted URLs fail if METHOD is blank
0,2,set session locale when constructing session object
0,2,Access to init parameters through METHOD not working
0,2,Extend cases where the exception can be ignored due to an aborted request
0,2,Default code for popups should always try to bring the popped up window to the top focus
1,1,While testing with CLASS METHOD is not being invoked if CLASS is enabled for notifications
0,2,table backgroundfoo url prefixing
1,2,Component METHOD and versioning
1,1,Uncaught exception guesing urls using CLASS
1,2,creating a METHOD with CLASS
1,2,Removing comments from markup can fail
1,2,EXCEPTION in CLASS
1,2,COMPONENT deprecation and COMPONENT
1,1,Allow to set field values before submitting a form with Ajax in COMPONENT
1,1,pallete is missing in HTML
1,2,Calls to enabled and METHOD should not be done in component resolving
1,2,CLASS does not correctly identify TLDs with more than NUMBER letters
0,2,Remove CLASS and the synchronize blocks using it
1,2,CLASS should interrupts the cycle and sends a NUMBER when a pageclass cannot be found
0,1,Translation for Czech language
1,1,CLASS on METHOD does not update the labels model only the editors
0,2,Download link does not set CLASS and CLASS headers
1,2,CLASS incorrectly converts its model value when a custom Boolean converter is installed
1,2,Inheritable model cannot be a wrap model
0,1,clock component does not display seconds in some Locales
1,2,CLASS only sets the target attribute when it exists in the markup
0,2,Add ability to manage disabled items from subclasses of CLASS
0,2,CLASS support of nonsingleton beans
1,2,Some components miss localization CLASS Palette
1,2,Converter misusagemangling in CLASS
0,1,Patch do not serialize choices and select in palette
1,2,COMPONENT code utterly breaks CLASS
1,1,CLASS empty Model wrong default encoding of special chars
1,2,Using Borders with Markup Inheritance causes component resolution failures
0,1,Handle servlet mapping or fail consistenly
0,2,Be able to add string arrays to configuration of CLASS
1,2,Ajax requests do not detach component models
1,2,EXCEPTION in METHOD
0,1,improved reporting on locked page maps
1,2,mvn jettyrun mavenjettyplugin not configured
1,2,Add global override to disable gzip compression SAP doublecompresses
1,2,Feedback is not cleaned up upon CLASS
0,2,Investigate whether we can use component meta data for the storage of feedback messages
1,2,CLASS comment stripping does not handle regexps
0,2,Change name of CLASS
1,2,CLASS does not function under Opera
0,1,Better error message for problematic configuration
0,2,CLASS are missing if is a Component
1,2,Use CLASS everywhere a query string is constructed
1,2,CLASS escapes ampersands twice regression
1,1,tests should be test
1,1,COMPONENT does not bind created Session to CLASS
1,1,METHOD can return time on same day rather than next day
1,2,METHOD does not work with CLASS affects CLASS etc
1,1,CLASS forces relative URL
1,2,Prototype scoped Spring beans
1,1,COMPONENT tries to call METHOD even if it is not changing the default does not work on strict CLASS
1,2,METHOD empty when resource is mounted
0,1,COMPONENT greyonwhite colour scheme is very hard to read
0,1,COMPONENT source code view is not resizable
0,1,fire onchange event of associated component after date selection
0,2,enhance ichoicerenderer with idchoice object lookup
1,2,PATCH remove XX in firefox and palette
0,1,CLASS needs Model for adding a CLASS
0,1,CLASS is too sessionheavy
1,2,COMPONENT not working with markup inheritance
1,1,METHOD should not attempt to render contents if METHOD is false
1,2,If the model is List CLASS does not try to find fields
1,2,CLASS does not work
1,1,Invoking a request listener on a page returns an Expired Error page
0,1,Unable to remove an CLASS from a Form
0,2,make METHOD final again and remove final from convert which should be renamed to METHOD
0,2,make default maximum upload size an application setting
0,2,COMPONENT because COMPONENT
1,2,COMPONENT could not handle Multipart form without upload
1,2,CLASS does not work with when using Safari
0,1,Qualified resource key should take priority over unqualified one
1,1,METHOD on Page throws EXCEPTION
1,2,METHOD generates wrong relative path if current page has CLASS in the params
0,2,add support for localization
0,2,Disable lineprecise exceptions for component use check
1,2,default pagemap name of null is not always properly encoded into the url
1,1,Select does not validate Required
0,1,Easy access to final rendered page source
1,2,METHOD does not properly redirect from ajax requests
0,1,upgrade to NUMBER to version VERSION NUMBER
1,2,METHOD does not work with binary files
1,2,Empty content inserted into Border throws ugly exceptions
1,2,Session id encoding problem in cookieless mode
1,1,No scrolling behaviour of source code viewer in IE NUMBER
1,2,Ajax SOURCE FILE fails when a fragment is included in the target
0,1,Use CLASS if it is specified
1,2,CLASS not working
1,2,More problems with ajax and transparent containers
1,1,Javadocs for METHOD and METHOD are swapped
1,2,CLASS CLASS factory methods should pass in ids
1,1,EXCEPTION with CLASS in COMPONENT
1,2,METHOD missing in COMPONENT
1,2,Markup hirarchy gets messed up when value of attribute background is a relative path
1,2,Typo in COMPONENT causes AJAX tree node addition failures
0,1,Option to align CLASS to the left of icon
0,2,Add class or id to CLASS elements CLASS etc to facilitate CSS styling
