type,priority,summary
1,1,file consumer exception if configure to consume root directory
0,2,support key password private key access in class
1,2,in class suspend route can not be start
1,1,component use beanio version number be use number beanio namespace
0,2,make spring optional bundle import cxf transport
1,2,component stepwise behavior to walk down relatively to avoid potential traversal issue
1,1,logger level be always default method error handler be class
0,1,component make easy to support list output box
1,2,component bundle specify mina version
0,1,exception construct number endpoint not leak password
1,1,class in component fail every
1,1,class skip all configuration file notifier if one if notifier ignore route event
1,2,class be break can not handle correctly
1,2,enricher async route not handle exception throw class
1,2,eip use custom aggregation strategy fail if not possible to find in registry
1,2,component endpoint ignore component property in spring configuration
1,1,recipient list eip shutdown thread pool if parallel mode enable
1,1,component nullpointer exception disconnect broker
1,2,use recipient list in method method situation do not work properly
0,2,netty use order thread pool
1,1,component also allow multiple consumer multiple route queue
0,1,component order thread pool be share
1,1,class be thread safe
1,2,rest route return response http status code number internal server error response have class headerexpire in header string
1,2,component not get start in method method but later blueprint container be fully initialize
1,2,classloader mixup consumer across bundle share component port
0,2,springws consumer producer do not propagate custome header attachement to response message
1,2,http version number host header not set correctly component
1,2,update class to extend visibility timeout correctly
1,2,configure jetty component different name do not work jetty consumer
0,2,component splitter eat exception record underlie scanner
1,2,component jms producer can block thread specific circumstance
0,1,class provide easy to use utility method to suspendresume route have already to startstop route
1,1,activemq target endpoint method do not work together source file endpoint method option set
0,2,limitaion on number component no mean to specify acl on create object object do not inherit acl bucket belong to
1,1,regression invalid class create work on version number
0,1,option to add bundle directive in generate test bundle component
0,2,add blueprint base component test use component
0,2,component add converter file inputstream
1,2,regression in validator component in version number
1,2,prexslt validator type conversion byte may easily fail
1,1,component class adhere class exchange pattern if ask mep
0,1,ftp endpoint support charset property like file endpoint do
1,1,file consumer use do file name delete file batch be complete
1,1,call configuration file route do not remove collection route configuration file
0,2,scala dsl no method method
1,2,exception jaxb fallback converter be use class
1,2,component producer avoid block wait connection
1,1,component class use constant field class method etc
0,2,class honor method instance variable set mep send back message header
1,1,sjms component configuration file miss taskmanager package in component
1,2,cache producer be not thread safe
0,1,dead letter channel store fail route on exchange
1,2,exception variable start route via karaf component command
0,2,class to lookup service filter on nameblah
1,1,use annotation dsl in bean may cause async callback to be call twice
1,2,component implementation rely on inconsistent endpoint lru cache component endpoint may not be call on quartz fire after day uptime
1,2,class component be not remove add route router list although route be remove context
0,1,add pgp signature signature verification support to class
1,1,class do not work class
0,2,component fix length record improvement
0,2,improve class performance
1,2,component email component miss attachment
0,1,component spring registry do not look parent context
1,1,component component not installable in karaf
0,1,check if body be class send directly without create class body header
1,2,component may be wrongly start may lead to deadlock
1,2,soap jms do not work component endpoint
1,2,class blueprint config have bind element may lead to exception
0,1,improvement to class class
1,2,race condition in class recovery sometimes cause duplicate
1,2,step in block run tag be close in wrong place
1,2,component class exchange can time even if response be receive
1,2,simple language bean function issue parameter value have comma
1,2,exception use imap mail component quartz timer method
1,2,component stream producer never close stream file
1,1,sql component not look parameter in header no body in message
1,1,aggregate eip completion batch consumer trigger first
1,2,component bridge endpoint may be double parameter value if client send uri parameter
0,2,component version number incapable work in endpoint uris
0,1,component support implementation amazonxxx not only amazonxxxclient
1,1,number component default to charset base on content type
1,2,class class activemq exception
0,2,json data format add support configure gson option
1,2,component multiple model in package lead to unpredictable result
0,1,number component do not support patch
1,2,component in blueprint be break
1,1,component possible concurrent modification exception
0,1,sql component add noop option to execute query but do not change message body afterwards
1,2,schedule thread pool be not remove jmx shut down
1,1,simple ognl expression possible exception use string method replace empty string
1,1,component class not be explicitly close
1,2,component blueprint configure not be instal if be subelement setting
0,1,component shutdown thread pool on consumer happen fast
1,1,class ignore whitespace quote parameter
0,1,bean improve choose method logic no parameter method
1,2,component fail
1,2,component fail
1,2,restart route use sql aggregation repository may lead to class loading issue
0,1,make class support async processor
0,1,component archetype component use bundle packaging component be ready to install in osgi
1,2,class do not work method
1,2,mina udp default codec keep datum byte
1,2,method method not call if unit test extend component
1,1,property placeholder optimization break placeholder in spring component configuration
1,2,component not able to resolve schema use method
0,1,move logic method
0,1,control bus add suspend resume action
0,1,component loading key store trust store support classpath well
1,1,class shutdown timeout number never timeout go in negative time
0,2,link to component registry in component be miss
0,1,validation exception include linecolumn
0,2,component consumer always use dedicated session
1,2,vm component stop route use method not stop mp if be route use
1,2,header be not set correctly in situation
1,2,new restlet endpoint do not work if route be create after restlet server be start
1,2,route suspend class can not be stop correctly
0,1,cxf endpoint log parse exception fail to extract root element name
1,1,file consumer race condition method read lock strategy
1,2,method jetty class do not work project deploy bundle
1,2,method have no effect in nested choice configuration file
1,2,component stateful job redeploying bundlewar having change endpoint uri issue
1,2,method property be ignore class
1,2,null value be not support in name parameter
0,1,can not access to length array source file simple language
1,1,component throw exception
1,1,sftp exception if no private key file be supply
1,1,route slip eip do not send class notification
0,1,class fill log file can not connectlogin warn level message
1,1,component unable to consume on udp multicast address
1,1,wrong class reference be use in method method class class
1,2,component shutdown bus endpoint be stop
1,1,jmx browsable endpoint seda have attribute list unavaiable
0,2,sftp endpoint fail if server disconnect socket
1,1,predicate java dsl be not dump to xml correctly
1,1,component component test package have wrong name
1,2,component exception use cxf class
0,1,add ability to connect to sqs queue different owner
0,1,support attach to sqs queue user do not have permission to list queue manually build url
0,2,add method method option jetty
0,1,class detect if predicate use instead
1,1,sjms component throw class cast error use ibm source file mq
0,2,ftp consumer add option to not use list command
0,2,add method option to converter to allow type converter to return null valid response special usecase
0,2,throttler do not honor time slot after period expire
0,2,simple language have singleton language well performance
1,2,component do not work well in osgi blueprint
1,2,use simple language ognl expression do not work bean binding field be null
1,2,memory leak method security header
1,2,seda queue size compare use equal
1,1,method in class be not class
0,2,component allow to register custom service in osgi registry before component start
1,2,component use referrring to class property placeholder can lead to exception
0,1,class check enable in method method
1,2,component endpoint yammercurrent throwns exception exception
1,2,installation component feature fail
0,1,bind component startstop child service
0,2,add cache option to method in dsl
1,1,component serializer pass uri be use only on consumer
1,2,xml signature component stream not close in method path
0,1,component no long able to configure method on number
0,2,mustache component use app class loader to load template
1,1,bean bind to covariant method throw exception
0,1,class can not manage locale different
1,1,scp task do not respect class option
1,1,null pointer exception remove class
1,2,class do not take effect be set to class
0,2,class add support use property placeholder
1,2,rabbitmq component send basic ack after channel close endpoint be set to method
1,2,network server protocol error select fail order be specify
1,1,exception try to create database directory be not allow
1,2,make lock nonreserved keyword in component since be not reserved keyword in sql standard
0,2,use encryption do not store length information external key in configuration file
0,2,support like escape
0,2,request support method in like clause
1,2,exception create trigger on table default schema do not exist
1,1,class summary round incorrectly
1,2,dblook display message key instead associate text
1,2,lock not be release properly possibly relate to occurence lock escalation
0,2,add support insert functionality use jdbc version number updatable resultset apis
0,1,patch improvement on class
1,2,suite number be skip incorrectly number version number
1,2,component incorrectly round double value down during insert numeric
1,2,aliase column not recognize after group order combination
1,1,network server give exception if exception have null argument variable error number
1,2,component throw truncation error warning class parameterconstant to char char bit datatype datum be large datatype
0,2,in place tableindex compress return space to os
1,2,bad eclipse plugin version specification
0,2,insert value in identity column
1,2,concurrency class network server not send concurrency statement
1,2,method do not work class
1,1,parameter name require in create function
1,1,list jar file in source file incorrect in class
1,2,method return true method go beyond result set
0,1,add support network server usridonl security
1,2,method class do not work batch be turn on
0,1,optimize specific method in network server to improve performance
0,1,javadoc build include timestamp andor svn revision number in visible location
1,2,column name on class method method be handle incorrectly
1,1,schema already exist create table
0,1,update require updatable result set to work
0,1,fix source file notice class reference in javademo
1,1,testharness method property be not be pick correctly encryption suite
0,2,need online backup feature do not block update operation online backup be in progress
0,1,connection method uniquely identify connection
0,1,network server demo program support component network client driver
1,1,build fail during splitmessage step if path contain space
1,1,test source file fail if run in directory have component in path
0,2,provide way to update index cardinality statistic variable reimplement update statistic
1,1,source file property description method wrongly name useprocess omit
1,2,variable problem generate default column w network server
1,2,remove method property class
1,1,aes encryption test fail on solaris number
1,1,many file do not have correct configuration file
1,2,network client xa only keep xa state transaction branch association to track whether to send commit in autocommit mode all state state relate decision be defer to server
1,1,source file file class do not describe argument accept program
1,1,method method cause hang client if mapping be invalid variable method to date
1,2,be desirable to have method function return last recent user specify value system generate value default identity column
1,2,unknown page format error do recovery after source file do in place compress
1,2,specification incomplete server property on command line cause exception class start server
1,1,servlet back to main page link point to csnet instead component
1,1,source file network server example have error cause to fail
1,2,network server database hang after time many connection execute method
1,1,disable create index on long varchar bit datum long varchar column do not allow create index already
0,1,network client message string not internationalize
1,2,client class not require user property to be set
1,1,sysinfo cp client option not print error say number jar file driver class be miss
0,2,create new sample database use in example in manual
1,1,queryplan query use session schema view be incorrectly put in statement cache cause incorrect plan getting execute later if temp table be create name
1,2,pass return return null on null input function to another function call throw linkage error
1,1,error message number have incorrect property name variable instead component
1,1,exception exception throw during load class database jar incorrectly shut engine down
1,2,method fail on method jdk version number verfier error on generate class
1,2,result set holdability define inside store procedure be ignore serverclient
0,2,expose boolean datatype to end user
1,1,select distinct return duplicate select subselect
0,2,integrate upgrade test test suite
1,2,source file replace method character number to match embed
1,2,incorrect insane build on window platform
1,2,class ignore property object in method url property method method
1,1,current configuration file component help plugin eclipse do not work create deployable plugin
1,2,load database jar in classpath be break database can not be find
1,1,readonly database fail to boot after soft upgrade raise error message number container be open in readonly mode
1,2,dynamic parameter be allow to be operand unary operator component throw exception number operator be not allow to take parameter operand
1,2,use component can mask certain exception lead to incorrect behavior in case
1,2,variable fail on very large table
1,2,make client driver connection url work space be in url
1,1,sysinfo incorrectly require permission on component jar file
1,1,component monitor access two system property without use privileged block build sanetrue
1,2,create trigger fail null pointer exception
1,2,subquery materialization can cause stack overflow
1,2,network driver method cause commit but do not complete locally
0,1,select max do not use index optimally
1,2,method return duplicate row in case
1,2,exception method on method
1,2,during source file recovery drop table on case insensitive file system component may delete wrong file
0,1,remove method method
1,1,buildtime processing configuration file file handle source file incorrectly
1,2,in ij execute prepare statement numericdecimal parameter fail exception in number
1,1,add test error code severe exception
1,1,exception exception if update delete be perform on diagnostic vti
1,2,network client method make getter method return null follow row
1,2,unable to create database whose name contae chinese character client driver
0,2,starvation in class
0,1,variable create statistic if do not exist
1,1,problem set sanity state to false use ant dsanefalse
0,2,materialize subquerie in select list possible to avoid create invariant resultset many time
0,2,enhance alter table syntax to allow user to change next value to be generate identity column
1,2,cursor close sideeffect close another cursor name on another connection
0,2,allow parallel access to data file
0,1,one delete update heap row new class object be create
1,1,incorrect documentation method
0,1,client driver prefetch datum on method
0,1,modify method to take long length perform max int check in method
1,2,ldap user authentication fail security manager
1,1,intermittent failure source file
1,1,add mechanism specify policy file individual function test
1,2,remove use method stringbyte int int constructor in testing lead to nonportable behaviour
1,2,big decimal error different in component langprocedure test run in component version number specific
0,2,introduce new test type to run junit test current harness
0,2,new number metadata api method need to be implement
1,1,exception class time simple query use union intersect
1,1,error number can include xxresolvexx be remove
1,1,class method method return wrong result on network client
1,2,create method outside global tran use clientxadatasource result in exception can not set holdability if statement be use in global transaction
1,1,test component method use mechanism be not portable encoding
1,1,variable fails intermittently run time
1,1,source file fail incorrect index
1,1,test variable variable run twice in component
1,1,optimizer can return incorrect good cost estimate nest subquerie lead to generation suboptimal plan
1,2,embed class do not return statement object create connection return embeddedxadatasource
1,1,new test source file fail number
1,2,source file method etc be fail run version number client again trunk
1,1,class be duplicate in component
1,2,test number method fail remote server security exception
1,1,exception in client class try to connect use eusridpwd security mechanism
0,1,change internal implemetation variable to share exist alter table
1,2,delete cascade cause null value insert table after delete trigger fire
1,1,misleadingwrong error message drop view
1,2,component fail insert join table generate column
1,1,test harness do not pass jvm flag properly if be more number property in jvm flag
1,1,class return incorrect value class be obtain procedure call
1,2,exist database jdbc metadata query do not get update properly maintenance version
1,2,transaction log file requrie recovery be getting delete backup checkpointa be run in parallel
1,2,client give exception test source file source file on method
1,1,source file fail because change in exception text
1,2,compatibility test fail security relate error
1,2,truncation error concat
1,2,client class do not reset holdability isolation state properly
1,2,failure in sysinfo configuration file induce classpath wiring
1,1,component fail sun jdk version number
0,2,separate class embedxaconnection
0,1,allow encrypting exist unencrypted db allow reencrypting exist encrypt db
0,1,helper method in basejdbctestcase create datum source
1,1,class throw number exception in global transaction if statement be variable
1,1,exception in network server ldap authentication
1,1,defragment inplace compress pass describe dataset be not free empty page
1,1,network server report wrong product name log connection to component
1,1,component server configuration file guide servlet interface run page
0,1,ij have help option to print command line syntax
1,1,source file version number hang intermittently client
0,1,remove huge log file class leave run variable
1,2,like do not match empty string use prepared statement
0,2,move method method class to statement
0,2,verify application can not manipulate transaction state inside distribute transaction
1,2,assert failure in class run version number
1,1,old client new server return wrong database metadata value method
1,2,class use class underlie physical connection number version number
0,2,implement new number method create empty lob in embed client
1,1,client attempt method method on insert row give wrong error message
1,2,network server do not shutdown database have boot start shutdown command line
0,1,call class on scrollable insensitive resultset cause entire class to be populate
1,1,resolve test failure version number
1,1,test variable variable variable fail on version number
0,2,sur use drdas extended diagnostic to send variable variable warning
1,2,difference client embed invoke store procedure use method
1,1,test source file fail version number jvm
1,1,miss reset method state in net client navigate away via method
1,2,need to remove old source file notice
1,2,isolation level local connection do not get reset after exit global transaction if isolation level be change use sql
1,2,identity column can be create wrong very large start value number version number ibm window number build number number jit on
0,1,configuration file file not translate network server start source file command
1,1,source file fail component in version number branch
1,2,class method always return false
1,2,class manifest entry component be miss version number source file
0,1,add source file to component
0,1,file component message variable
1,2,interface change introduce in mustang build number
1,2,wrong result query use like escape clause include
1,1,message number variable do not have match message text
1,1,typo in link to simple example source file
1,2,source file source file do not work give wrong error message
1,1,use djvmflag option cause class
0,2,add class to build script to verify be no orphaned message id
0,2,network server source file class after console output
1,1,correct instruction in demo source file file source file
0,2,provide alter table drop column functionality
1,2,class do not implement class int string
0,1,method need many master convert to junit
1,2,test run exit variable run because method use method be not available
1,1,method can enter endless loop
0,2,upgrade test need to be enhance to test grant revoke
0,1,factor type check in class class
1,2,eclipse plugin distribution ui core zip file do not contain apache license source file notice file
1,2,unexpected behavior on self privilege revocation
0,2,trigger be drop privilege require trigger be revoke
1,1,make test number run security manager
1,2,component fail security manager enable
1,1,component jdbc version number driver return number jdbc driver major version
0,1,enable more testcase in class
1,1,exception in update coalesce subquery
1,1,link getting start apache component server in source file need to be link to actual document instead manual page
1,1,network server fail exception if blob size number be stream client
1,2,script in framework direcotry need to be reviste to set classpath properly
1,1,test harness evaluate number version number jvm variable version number method do enthousiastic seding
1,1,component hang version number always use variable hang variable
1,1,new number canon requiredcanon need to be remove to catch to change to number
1,2,test harness override heap size setting start network server
1,2,lot version number regression test failure diff because sql exception instead exception
1,2,sysinfo in version number show multiple entry if component jar reside in directory space in name
1,2,trigger action statement be not recompile be change affect
1,2,class reference engine class component
0,2,revoke execute restrict fail if be dependent object on execute privilege
1,1,exception insert value to table have column declare generate default identity
1,2,create index on large table fail many open file exception
0,1,network server not send to client support eusridpwd run sun jvm
1,2,regression wrong result join predicate can be ignore leftmost child in chain nested union
1,1,class be not thread safe
1,2,source file fail component framework jcc version number
1,2,client driver do not use query timeout value set use method subsequent execution use statement object
1,2,component hang
1,1,source file fail jcc version number jcc version number
0,1,add more test method method
0,2,deprecate script in framework directory
1,1,huge single insert statement fail jvm error due to size generate method
1,2,invoke java store procedure contain grant revoke statement contain sql fail
1,2,manifest file do not contain osgi attribute
1,2,language store system treat jvm error class differently lead to raw store protocol violation error
1,2,component fail exception intermittent failure
0,2,implement bracketed sql comment comment
1,1,component fail exception in component framework
1,2,xmlserialize operator do not follow sqlxml spec in area serialize sequence
1,1,remote server testing version number source file show number failure
1,1,error number xml syntax error miss method mislead text
0,1,database owner be incorrectly refer to dba in code comment be check in component version number grant revoke work clean point
1,2,embed class on time column return class date portion can be incorrect
1,1,client class on sql timestamp column lose subsecond resolution always have millisecond value zero
1,2,access rule violation use sql state start number accord to sql standard
1,2,source file fail version number foundation cnfe class exception
1,1,sysinfo test fail access deny source file class read component be first in classpath
1,1,correct message sql state number to reflect be be revoke user update ref manual
1,2,source file fail jcc driver
