type,priority,summary
0,2,add additional transition state
0,2,preserve cluster blueprint name blueprint revision in agent local disk
1,2,agent retry heartbeat message if controller do not receive heartbeat
0,2,remove agent entity bean public schema xsd
1,2,check nn safemode during restart
1,2,dependency templeton on hcat client
1,2,remove import mysql puppet module manifest
1,2,add check to verify jdk path after install
1,1,php notice undefined variable manifest in source file
1,2,support filtering host base on discovery status
1,2,alert table on right need to be tie visuallyverbally to contextcontent be display
1,2,remove word alert all nagios alert description
1,1,make daemon name field name consistent
1,2,enable lzo show checkbox instead text
1,2,increase puppet agent timeout
1,2,refactor puppet kick loop to easily change retrie timeout
1,2,support datum cleanup if installation fail
1,2,replace source file source file
1,2,uninstall support ui
1,2,remove playground file hmc
1,2,support uninstall state in mysql module
1,1,class file appropriate
1,2,update hive config to enable authorization
1,2,manage service section have empty section no client only component instal
1,2,init wizard advance config validation error can be bypass
1,2,nagios admin contact be check to ensure be always email address
1,2,templeton data on hdfs need to be readable all user
1,2,update hdfs parameter configuration description
1,2,cleanup utility
1,2,fixup review deploy render
1,2,add link to uninstall on index page
1,2,comment in source file
1,2,html be spew in class page
1,2,change status message error location show page summary box rather more well visibility
1,2,regionserver config in hbase only have localhost in
1,2,upgrade to version number
1,2,externalize message resource welcome page update style on various page
1,1,uninstall wipe flag be correctly pass to puppet
1,2,grid mount point page do not let one pass only custom mount point
1,2,scale puppet master to large number node
1,2,during process in cluster initialization wizard if user go back to number create cluster tab user be stick
1,2,dependency be add only during install phase
1,2,provide way to resume if browser source file close during deployinprogress
1,2,redundant download even though artifact be already instal
1,2,cluster status update need to happen all stage installation wizard
1,2,make method more robust
1,2,log in case error during uninstall need to be fix
1,2,add flow control force redirect to appropriate page base on cluster configuration status well usability
1,2,redesign master service assignment page take less vertical space
1,2,create lock file part rpm install
1,2,package font subdirectory in hmc rpm
1,2,improve service management page general popup styling
1,2,mysql package not be send during install uninstall
1,2,uninstall do not handle component dependency
1,2,on single node install install all component recommend num class task be high
1,2,class myid file not existent on zk install
1,2,add node fail to find node in db
1,2,can not uninstall page hang spinning icon
1,2,manual config change nn get reset on stopstart hmc
1,2,complete successful add node take one to initialize cluster page start scratch
1,2,unify top nav monitoring cluster management
1,2,add rpm spec hmc agent
1,1,reset service back to original state after configuration file
1,2,improve style on error log popup
1,2,reinstall cluster after failure to install result in failure
1,2,fix bug jmx parse on class
1,2,use service stop instead killall uninstall
1,2,uninstall need to update status failure
1,2,duplicate configuration file class
1,2,post cluster installdeploy url configuration file be disable
0,2,class restart hmc message nagiosganglia be on hmc host
1,2,nagios show service status critical if hbase be not instal
1,2,add node page alert remove in case add duplicate node
1,2,fix hive stop to escape
1,2,class add node update progress title error message to reflect what be actually doinghas do
1,2,add miss js file make post cluster install add node work
1,2,show welcome page to user if user start configure cluster but have not start deploy yet
1,2,add node install mysql server hive
1,2,manage service need way to recover terminate browser session
1,2,service configuration file screen respect configuration file attribute set in class table
1,1,make support os check bit more robust
1,1,add variable column in host table
1,2,fix node assignment not not allow slave on master
0,2,speed page loadreload time
1,2,support resume add node
1,2,modify router to force redirection to add node progress popup
1,2,fix puppet manifest tarball download via rpms
1,2,update to fix ganglia variable anchor problem
1,2,fix oozie smoke test failure
1,1,fix advanced config hdfs reserve space be in byte many byte to count
1,2,create spec file less dependency hmc
1,2,rpm naming need to be correct
1,2,templeton config pig archive not correct in hmc
1,2,puppet fail to install number jdk properly on number
1,2,change os type check during node bootstrap to allow number number node
1,2,puppet agent install script use correct epel repo
0,2,add support to jump to specified state in wizard development purpose
1,2,update readme to point to trunk
1,2,remove yui source file svn
1,1,update documentation
1,2,nagios install fail on number
1,1,consolidate head tag organization combine css file fast load
1,1,puppet error can not reassign variable variable variable
1,2,in custom config nagio email multiple period before fail validation
1,2,custom config page do not allow form submission if be clientside validation error
1,2,special character in host file create on common window editor cause issue
1,2,rat compliance patch
1,2,externalize manager service name point help link to valid url
1,2,license header php file use php comment not html comment
1,2,add link to notice file on every page
1,2,remove source file dependency rpms
1,2,fix lzo install to work correctly on number
1,2,increase puppet timeout to handle singlenode install time
1,2,database set script have duplicate configuration file component install fail
1,2,eliminate redundant unused configuration file column in table class
1,2,hdpnagio hdpmonitoring have wrong configuration file location also ownergroup permission be wrong
1,1,fix invalid html markup on monitor source file
0,1,add node progress partial failure let user continue display orange bar rather red bar in progress popup
1,2,support hadoop security frontend change
1,2,weirdness custom config page user go back to previous stage
1,2,component install yum priority on all node to ensure main repo be pick first
1,1,make puppet generate more log on command failure
1,2,fix component agent variable script bootstrapping
1,2,component do not handle presetup usersupplied hive metastore
0,2,change text on alert xx hour ago
1,2,hdfs disk capacity on source file be see negative number
1,2,remove file component be not mean to be check in
1,2,source file summary capacity pie chart keep change color
0,2,create heatmap legend entry miss datainvalid host
1,2,switching service do not update various ui element
1,2,error handling error be encounter during preparation deploy
1,2,need to be able to reliably recover case browser be close during deploy step number post submission step number wizard
1,2,userspecified custom configs configuration file override be persist to maintain what user specify
1,2,install wizard confirm host stick prepare stage
1,2,host component live status be break
1,2,component heatmap host information show configuration file disk space use
1,2,graph degrade time
1,2,on notification popup clicking go to nagios ui do not load nagios ui
1,2,tmpfs filesystem be add to list in dir use component
1,2,installer wizard retry feature in deploy step step number be break
1,2,configuration file fail silently be not fire api call due to js error
1,2,host jam in status prepare if host name be wrong
0,2,check box to checkuncheck one member in multi artifact graph be not very readable be more apparent on one user click on
0,2,check logrun dir location to make sure abs path
1,2,disk info metric memory usage sometimes do not show hour
0,2,clean table header ui sort filter clear x host table
0,2,clean table header ui sort filter clear x job table
1,2,after add host host count show in source file be incorrect
1,2,detailed log view dialog be not centeraligne
0,2,automatically update hostlevel popup infologs
1,2,remove hdp httpd conf nagios url replace component something else
1,2,allow capacity scheduler to be attach to host role config cs configurability in apis
0,2,in start fail warn host overall install
0,2,add filter module
0,2,refactor job browser user filter
0,2,confirm host page look like host disappear if be on fail filter click on retry fail button
0,2,drop option host component filter job user filter
0,2,source file make disk usage pie chart in hdfs summary easy to understand
1,2,replace sudo su in component setup script since component server setup be already run root
1,2,directory permission on httpd varwwwcgibin not be touch component
0,2,host health indicator have tooltip show detail
0,1,install option line target host section rest page
0,2,use emberprecompilerbrunch npm plugin
1,2,fix host role live status not go back to instal if be in variable state
0,2,remove hard code jmx port mapping
1,2,service graph source file spinner
0,2,job browser filter input output duration
1,2,agent check package part host check but do not tell one be need conflict
1,2,store example hive query somewhere in component be easily accessible demot purpose
0,2,on confirm host page add link to show host check popup in success message
1,2,edit user no error message be show user do not enter correct old password
0,2,shrink top nav height
1,2,incorrect display background operation window after change state component
1,2,fail build due to url move on suse
0,2,make sure component web render all element correctly browser width be number narrow
1,2,bootstrap can hang configuration file
1,2,service status host component status can get stick in green blink state if stop fail no operation can be perform
0,2,make sure component web render all element correctly browser width be number narrow refactor
0,2,properly display app page aggregate summary data table be no datum to be show
0,2,remove all text app view controller template to source file
0,2,host health indicator have tooltip show few detail refactoring
1,2,switch job page do not launch popup anymore
1,2,cluster miss host after successful install restart
0,1,add username validation component local user
0,2,show validation error user specify target host be already part cluster
0,1,refactor job browser filter
0,2,enhance class progress display
1,2,service check fail after secure install due to wrong configuration file path
0,1,externalize string to source file
1,2,provide consistent ordering host in heatmap
1,2,no alert badge on host detail page be green not red
1,1,app browser row colour alternate dark grey to light grey back
1,2,mouse cursor hover behavior be strange on job browser
0,2,since be ability to log in to component web different user current user be indicate
1,2,wrong calculation duration filter on app page
1,2,component agent registration hang due to acceptor bug in jetty not read accepted connection
1,2,validation username use in service configs be break
1,2,failure popup show configuration file hdfs class be not instal
0,2,remove hardcoded stack version
1,2,can not proceed after bootstrappe in case due to runtime error run host check
0,2,optimize query call retrieve host information
0,2,optimize query get service host component status back server
1,2,configuration file read write lock method
0,2,optimize ganglia rrd script to be able to respond within reasonable time to query make ui
1,2,optimization query host information server
1,2,fix class to take care issue gethostname getfqdn do not match
1,2,fix alert host level if class be not select not to alert tasktracker not run
1,2,nagios script cause unwanted datanode log
1,2,add hadooplzo to be one rpms to check before installation
1,2,make all service property configuration file
1,2,fix start option component be miss space
1,2,add host be break
0,2,host page add filtering host status
1,2,component web go back forth frozen usable state peridocially on large cluster
1,2,alert take around number second to show everytime source file source file
0,2,host page layout fix
0,2,constrain width all wizard popup
1,2,job fail count always return number in jobtracker api metric
0,2,stack upgrade wizard resume upon page source file login
0,2,host progress popup generic component show progress on async operation
1,2,can not start hadoop service after hdfs configuration file amabri server restart
1,2,templeton smoke test fail secure cluster
1,2,configuration file ui not allow certain configs to have hostlevel override
0,2,security wizard integrate host progress popup
1,2,map reduce task metric be miss tasktracker in api
1,2,undo not be allow on component host
1,2,oozie property principal keytab not read ooziesite
1,2,start all service fail on secure cluster exclude class class
1,2,component need to set value variable
1,2,agent have hardcode hdp repo file can only be download
1,2,seem upgrade available fe be hardcode to version number
1,2,class zk fail to start on secure install
0,2,backend support mysql oracle oozie hive
1,2,add support stack version number to component
1,2,unable to get all task more one variable one request
1,2,hue installation fail due to manifest error
1,2,security wizard javascript error be throw method be include secure service
1,2,stop start all service do not start class
1,2,can not specify request context smoke test request
1,2,security wizard add miss secure configs to hbase service make zookeeper default primary name zookeeper principal
1,2,class master shut down immediately after start in secure cluster
1,2,few coresite property source file after seemingly benign configuration file
1,2,cluster management service class config throw js error page come blank
0,2,global property show restart appropriate service only
0,2,make single put call multiple host override
1,1,cosmetic problem on class source file
0,2,capacity scheduler add new queue populate field
1,2,can not load nagios alert due to number bad request
1,2,master break can not deploy service
1,2,component rpm claim source file usrsbin
1,2,component fe be not set proper value variable
1,2,hue pid log dir label be flip flop
0,2,capacity scheduler implement usergroup admin usergroup validation rule
0,2,reassign master wizard step number prevent proceed next without change target host
1,2,number api use type to refer to config tag no long expose filename property
1,2,api to map global property to service be partially complete
1,2,impossibility to scroll metric window after browser width change
1,2,disable editing capacity scheduler on host configs
0,2,update default stack version to version number
1,2,class master do not come after disable security
1,2,client install task be show twice in install progress popup
1,2,component configuration file miss property lzo enable variable
1,2,class history server fail to come on version number stack request service stall be stall
0,2,allow user to customize nagios user account
1,2,allow user to customize ganglia gmetad gmond user account
1,2,test failure method
1,2,security vulnerability ganglia nagio
1,2,all service smoke test fail run service start
1,2,oozie smoke test fail error on start servicesinstall page
1,2,system log be not present on tasktracker
1,2,hadoop dependency version component be hardcode make regular expression base to pick late repository
1,2,wrong install status show in add service wizard
1,2,host table whether alert filter be in effect not be not clear
1,2,client install task be show twice in progress popup during start phase install wizard update api call to include configuration file
1,2,deploy version number result in several alert be relate to hardcode port
1,2,nagios be unavailable return null instead throw exception
1,2,hostname pattern expression be break
1,2,filter host get sync filter selection
1,2,action button on host detail page not format properly on firefox
1,2,click on cancel on service config page not reload entire app
1,2,filter on job table do not work certain situation
0,2,host tab clicking on red badge not toggle alert filter
1,2,use mixed os overwrite component during install
1,2,can not delete cluster component in unknown state
1,2,can not decommission datum node ensure recommission also work
1,2,component server become unresponsive after source file on http read on jersey
0,2,add validation check add property on custom site config
1,2,error loading mainservice directly
0,2,make frontend change to account host component status unknown
1,2,add clover code coverage profile
1,2,disable add component button in host detail page if host be in unknown state method
1,2,add local user button be enable but nothing happen upon click certain condition
1,2,service link on source file connect to incorrect page
1,2,add unit test to verify client reinstall install fail client
1,2,if install local repository select in install wizard add host wizard not work
1,2,host detail page if host component be in variable state let user reinstall
0,1,class heatmap clean label unit
1,2,hadoop group customization do not take affect
1,1,prepare to install message need space
0,2,change service directory popup confirmationwarne dialog upon save
1,2,admin role can not be assign to ldap user
1,2,source file fail during installation
1,2,task be not filter parent request
1,2,post component upgrade hive oozie fail to start after configuration file
1,2,be possible to get state install retry be not possible if agent stop heartbeate
1,2,hive service check still fail file permission
0,2,support configure run component web server https
0,2,enable customization smoke test user
0,2,component modification to allow hadoop compatible filesystem hcfs
0,2,use modify dependency if stack contain hcfs service hadoop compatible file system
1,2,set default value oozie property variable to true
1,2,home path be not set correctly in configuration file
1,2,hbase fail to start on master
1,2,installation exist oracle db fail
1,2,hive oozie user have be change after upgrade hive metastore oozie can not start properly
1,2,capture user audit config change
1,2,component need to set right path gc log directory hbase process
1,2,sometimes stale host host component indicator be show
1,2,after upgrade component version number to version number server throw number error startingstoppe service
1,2,datanode start fail in secure cluster
1,2,host status filter not restore on host page navigate back
1,2,fix unit test component web
1,2,test break fail variable variable
1,2,remove version number stack configuration file since never be use be redundant
1,2,number monitor job page be hide hdp version number stack be instal
1,2,update mock json datum test mode
0,2,agent heartbeat lose during install
1,2,component have deadlock reinstall after reboot cluster node
1,1,component start script component never use variable
1,2,background operation popup do not automatically source file task log
0,2,add unit test util
1,2,reassign master wizard source file page on step number number number break wizard
0,2,change config loading mechanism to allow different stack version
1,2,increase component test coverage
1,2,use external mysql oracle database oozie do not work
1,2,fix mysql oracle ddl script accord to last db change
1,2,ensure version value be use appropriately throughout component
1,2,allow security relate configs to be modify via custom setting
1,2,class button may stay enable number second after have be click
1,2,bad host query example in api doc
1,2,on install option page select perform manual registration on host do not use ssh be set path to number jdk disable
0,2,provide way to optionally enable twoway ssl class communication
1,2,configuration mapping metadata on component be compute per stack selection
1,2,component upgrade prcoess preserve old configs add new config option to old config file
1,2,number exception create service component during install
1,2,ui allow add already exist property to custom configuration file configuration file setting create confusion
1,2,security wizard navigation not lock down cause artifact unwanted side effect
1,2,api call to get metricscpu do not work class class host component
1,2,enhance processing source file before start component server
0,2,unit test add test to install wizard step number number number
1,2,intermittent test failure class port scanner test
1,2,security wizard webhcat server start fail on enable security
0,2,show instal stack service
0,2,unit test add test to model
0,2,add host wizard show info manual step require on secure cluster
1,2,add unit test component python change
1,2,bootstrap be break component web version number
1,2,component setup borken in trunk
0,2,add support classic source file
1,2,component setup allow user to change database password
1,2,kerberos global be show in hdfs config page during install
1,2,installer wizard number class class not be cohoste default on multinode cluster
1,2,hdfs config page be break in method on trunk
0,2,set default widget to show source file
1,2,bootstrap fail on rhel version number
1,2,component server start fail configuration file user
1,2,security wizard smoke test service fail customize service user name
1,2,upgrade version number to version number fail because ddl script do not work metainfo version change be break
1,2,add unit test bootstrap method python script server
0,2,create command line script to manipulate component configuration get set add delete
1,2,class database setting accept custom jdbc url
1,2,remove unnecessary check hostname service name be wrong
1,2,component bootstrap action report success even if failure happen
1,2,source file page have lot footer padding
1,2,variable be not work in reliable way
1,2,issue setup ldap
0,2,security wizard show principal keytab need to be create on host
0,2,remove dependence on variable global nagio check
1,2,cleanup setup https flow
1,2,can not add property variable
1,2,decommission datum node not work in secure mode
0,2,add download csv action security wizard
1,2,zookeeper smoke test fail in secure cluster
1,2,add helpful message not able to download jdk setup option user to be able to specify jdk
1,2,incorrect permission on configuration file
1,2,memory configs be set to number in component
1,2,custom repo url can not be set nonroot
1,2,regression agent external hostname be not verify during bootstrap no warning
0,2,simplify local repo setup in installer ui
0,2,security wizard create separate page principalkeytab
1,2,ctrlc during component setup print python stack trace
1,2,setup ldap do not validate truefalse response
1,2,use another user component server user create local group component server user name
1,2,host check report show host without issue
1,2,js error delete widget after sort on removeedit sign
1,2,hdp installation fail due to puppet syntax error
1,2,property name can not be add to different custom configuration file
1,2,add quick link web ui oozie hue nagios ganglia
1,2,kdestroy not require zookeeper smoke test
1,2,webhcat oozie service do not start on number enabled security because critical error do configuration file nagio
1,2,rename variable property in component to variable
1,2,host check truncation on check process make difficult to know actual process in conflict
1,1,popover config name go beyond container
1,2,wrong info on service summary tab class live class live class live
1,2,host cleanup leave two component configuration file
1,2,source file widget hover to show detail experience be jar
1,2,reset late stack version version number
1,2,perf service summary view inefficiently bind to host component
1,2,source file metric legend size increase unexpectedly on mouseover line space
0,2,security csv cleanup
1,2,go back to customize service page install page reset certain directory value
0,2,update number
0,2,read timeout issue in oracle jdbc connection read have long timeout
1,2,component can not find password remote database password encryption enable
0,2,improve style class code area
1,2,add umask check host check alert if umask be not number
0,2,add retype new password field change password component user
1,2,host check say pass all host fail to register
1,2,security wizard relogin on number without quit wizard throw js error
1,2,start button not available various component within number sec after stop operation configuration file
1,2,setup ldap do not validate secondary url
1,2,error message print to log
1,2,enable security wizard stop on step number save configuration do not let user leave wizard
1,2,datanode live widget display number dead no datanode be live on cluster
0,2,disable show report number issue
1,2,disable security not work in webui method
1,2,host specific progress bar task have inconsistency
1,2,implement cleanup thread remove file in component datum directory be old configurable amount time
1,2,fix js unit test after merge version number to trunk
1,2,make component web method work installer wizard hdp number selection
0,2,disable autocomplete on form tag component ui
1,2,hbase super user can not submit job since component create hbase super user number
1,2,disallow action upon host component on host stop heartbeate
1,2,host component be be instal instal state do not show in host detail page
1,2,host host detail page ui tweak
1,2,misc log change
1,2,security wizard step number no host show click on start class service link
1,2,job page table be not stripe pagination be not disable
1,2,stack version number hive check execute fail
1,2,customize service page misc tab incorrect behavior popup window change user name
1,2,ozzie do not work local fs user
