type,priority,summary
1,2,class hostname on select host page enable class ha wizard do not work
1,2,fix subresource name in stack api
1,2,unable to assign host in ha wizard
1,2,bgo popup incorrect number task in category
1,2,installer wizard step number variable property incorrect value
1,2,nagios restart all component button do not work
1,2,default add host sequence trigger many unseen before clusterwide operation
1,2,component server reset show wrong command db manipulation
1,2,host check show report link be miss dialog
1,2,security issue private key password show in log
1,2,host page be no indication filteringsortingpaging be happen not configuration file
1,2,restart icon be present after service class all button click
1,2,add host stop all service
1,2,have spinner instead chart source file service tab on ie number
0,2,get sql metric logic be review
1,2,add service fail server error condition
1,2,step number pagination be slow
1,2,configuration file use family tag rather type tag
1,2,manage config group if ganglia be not instal config group popup do not appear
1,2,prompt to put service in maintenance mode do roll restart service stop
1,2,python client cache curl flag request cause problem
1,2,ui freeze more number second every number second on number cluster
1,2,custom command execution take long
1,2,class make call to endpoint without check support property
1,2,bulk op only target maximum page size host
1,2,choose bulk host to decommission on number node cluster on host page spin
1,2,roll restart only start stale checkbox not work functionally
1,2,bulk decommission background operation popup content look break
1,2,add service wizard remove new property add to coresite global after cluster installation
1,2,host page incorrect total number host after filter instal component
1,2,filtering select host reset pagination
1,2,after change property clicking save button in class config page no comfirmation popup
1,2,unable to restart all hostcomponent on number node cluster
1,2,host page mysterious select host keep come back
1,2,hostname wrap icon asterisk on assign slave
1,2,excessive request be send on host page
1,2,in host detailed page decommission nm be label stop
1,2,many service fail to start use custom user name group
1,2,move wizard get stuck if wizard be run second time component without page source file
1,2,move wizard assign master step next button be not disabled host input have error
1,2,postgre create script generate error configuration file
1,2,config page load slowly on number cluster service
1,1,link to extjs license in choose service page have move
1,2,filter state do not clear in background operation popup cause lot confusion
1,2,unable to move class
1,2,js error occur periodically job detail page be open
1,2,add service wizard can corrupt config file unpredictably
1,2,class wizard error exist host be not present
1,2,js error on job page if ats be stop
1,2,default config group name contain undefined instead service name in manage config group popup
1,2,unable to proceed step number installer if class service be select but yarn be not hdp version number
1,2,incorrect error count yarn on step number install wizard hdp version number
1,2,hostname case sensitivity
1,2,unable to install cluster after come back to step number select different stack version
0,2,component support on number number I
1,2,create main page table job
0,2,add zkfc component to summary page nnha enable
1,2,fe allow add host on host be in unknown state agent be stop
1,2,service pluggability new add service in stack have add property link in number env category
1,2,fast user can skip customize service step add service wizard configs be not load
1,2,none link affect already instal service on select service step
1,2,link ganglia chart host detail page do not show graph except on class host
1,2,delete host come back to life after component restart
1,2,view exception on server restart after create view instance
1,2,management console ui layout basic routing create user management page mock data
1,2,install wizard have ability to load default final configs save
1,2,component fix variable
1,2,class fail on exception message assertion
1,2,fix unit test be break after component
1,2,version number stack show hue in select service page
1,2,can not start component due to empty metainfo table
1,2,add service wizard retry installation functionality do not work
1,2,config category be not display on configure service step secrity wizard
1,2,memory leak during tab switch on customize service page
1,2,oozie service can not be start on component server external postgre
1,2,unit test failure on jenkins component version number relate to alert
1,2,oozie fail stack version number version number
1,2,source file config action do not work flume
1,2,capacity scheduler config can not be save
1,2,rm ha wizard be experimental but not be
1,2,rm ha be configd none rm summary info rm source file widget show datum
1,2,on hdfs config page edit box memory size value have incorrect behavior
1,2,select host page on resource manager ha enable wizard do not save select value after nextback step
1,2,flume service be in start state no agent configure
0,2,class slave break in two line on assign slave step
1,2,resource manager ha after enable rm ha ui do not display standby active resource manager on summary tab
1,2,add security configs on add service wizard
1,2,wizard add master component do not create install master host component
1,2,cleanup cluster admin tab
1,2,component installation webhcat configuration file set thrift host name to be localhost
1,2,need class ui quicklink active standby
1,2,class can not pass in window box
0,2,throw useful exception on no class available
0,1,most recent source file require activemq
1,2,class be not copy across activemq endpoint
0,2,enable polling via http component
0,2,class namespace configuration not possible xml
1,1,url link break in component api doc
1,2,component failure
0,1,new converter node source
1,2,exception clause do not proceed pipeline
1,2,version number release do not seem to include javadocs doc directory manual
1,2,header lose after xslt processing
1,2,fix performance counter
0,2,upgrade geronimospecs version to version number
0,2,add gett method method property in class class
0,2,cxf component transport support to register to cxf bus automatically
1,2,spring integration class be miss in component
1,2,spring integration bad url in variable
0,1,class logging improvement exchange handle dead letter
1,2,exception in cxf route be endpoint router service cxf endpoint
0,2,support to set aggregation stragey method
0,2,class recipient list use multicast processor
0,1,remove tangle impl variable
1,2,multithreaded http invocation do not work
1,2,class do not load default
1,1,version number be twice in component distro
1,2,bad content length header value in http response
0,2,mail component be miss configuration possibility
1,2,mina tcp do not support class pattern
0,1,synchronous mode handle exception be throw mina
0,2,component allow lazy creation connection
1,2,component component can not deal exception message in message method
1,1,class be not connect retrieve remote file
0,1,mina producer have configurable timeout
1,2,class do not set response status code variable be always number
0,1,component improvement
1,2,support full customize soapfault incl faultcode detail
0,2,parallel processing route
0,1,improve log component
0,2,class wait mina worker thread to timeout stop jvm standalone client
1,1,javadoc warning
1,2,exception handling class class
0,1,improve ftp component wiki documentation
0,2,method have parallel processing functionality method have
0,1,improve file component wiki
0,1,upgrade to openjpa version number
1,2,invalid jar in binary distribution
1,1,component raise exception if parse xslt file fail
1,2,file endpoint nooptrue do not detect old file move directory
1,2,component do not compile on hpux
0,2,make easy to create endpoint instance nicely via spring xml
1,2,jmx connector be not close method
0,1,document file component use file directory name
1,1,javadoc improve summary etc
1,2,class do properly record processing time
1,2,component component not propagate context datum
0,2,class synchronize on process method make performance bad on xslt
0,2,spi package not depend on processor package
1,2,exception camerun route code
1,1,file component noop do not lock file during process
1,2,component be dependent on springaop
1,2,multicast default excecutor do not create enough thread parallel processing
1,1,component clear endpoint cache stop
0,1,jmx instrumentation class total process
1,1,patch make sure stream get close
1,2,miss compile step in example readme
0,1,patch postpone create browse strategy only if need
0,2,change jmx default connetors url to avoid confilict activemq class jmx default connector
0,2,header be modifiable use velocity template
1,2,class throw exception stream config do not get initialize
0,2,file component file rename pattern to support pattern date time etc
0,2,jmx instrumentation class last process timestamp fail
1,2,class default redelivery policy eclipse expect transactional behaviour in transact route
1,2,class can not resolve converter annotation in class version number
1,2,jms aggregation do not work
1,2,component example configuration file be date
1,2,bean method lose send message one jms queue to another
0,2,component documentation need overhaul check missing option add more sample javaspre etc
0,2,create class can easily use transaction rollback on route method to fail route if can not be process
0,1,transactional client set spring policy be bit cumbersome in xml
0,2,upgrade geronimo spec to version number available
1,2,cxf feedback eduard on problem cxf jms
1,2,process method check exchnagepattern before set
1,2,class doenst honor exchange pattern extract result
1,2,method do not propogate header
1,1,jmx instrumentation nodeid can be null
0,2,cxf easy use enduser to retreive pojo datum
1,2,class consume file instead produce
0,2,change default class strategy in component
0,1,log component use class format log output
0,2,cxf wrapperunwrapper component be smart
1,2,exception on use class apache component transport
1,2,propagate cxf header value not include quote
0,1,jmx instrumentation check already register before register
1,2,method method be add in class class timer component do not work
1,2,after downloading process layout remote file system do not match local one
0,2,component transport set content type property component message header
1,2,component check class create instance
1,2,xpath expression header header do not exist on in message result in exception
1,2,amqp test be disable
1,2,component method be not effect jmx agent be disable
1,2,class catch throwable
1,2,pipeline method processor also redeliver follow default policy independently preset errorhadling
1,2,class failure
1,2,class premature message creation
1,2,delayer pattern do not work in spring dsl
0,2,support to set method before output
1,2,preserve exchange type in routing slip
0,2,file component write to temp file rename to real name startegy
1,2,trail source file miss in class
0,1,type converter if not possible to convert log warn
0,2,mina be exchange pattern agnostic
1,2,current mina component can not tansfer exchange fault message body
0,2,method support batch process large file
0,2,access class param variable
1,1,component codec option fail if not possible to find I registry
1,2,class ignore custom source file port
1,2,element not require method attribute
1,2,throw exception if be thing wrong type attribute
1,2,class option method be not configure properly
1,2,component component be not pass request context correctly
1,2,file component method do not work expect matching be apply not only to file but also to directory
1,2,remove dep on persistenceapi jar non compliant spec
0,1,tracer option to disable interceptor
0,2,manage nonsingleton endpoint in component
1,2,component do not build on hpux
1,2,inconsistency in recipient list documentation
0,2,jms class operation default to non transact even if jms component endpoint default to transact typically rpc jms be not transact
0,2,method default to error class operate builder
1,2,component documentation be mislead
1,2,method attribute component default to true
1,2,class exception be throw in late build component
0,1,component type converter to class
0,2,class to support constant expression
1,2,class consider overridden method select method operation list
0,1,bean bind annotation to get exception exchange
0,2,maven goal component use overridden specify
1,2,component spring event be not auto register component add event file in folder component component
0,2,http producer be smart to select correct get post method
0,2,quartz support allow stateful job
0,2,component http uri message header
1,2,component pipeline be draw multicast
0,2,add ability to configure log level on exception dlc retry mechanism
0,2,add support to tracer log message
0,2,passive mode
1,2,spring integration xsd change break component
1,2,class create empty message make impossible to chain more processor behind
1,1,source file fail randomly
1,2,component method be buggy
1,2,source file method return class
0,2,remove specialized exchange make class final to pave road optimization reduce exchange copy
1,2,can not get soap header component endpoint work in payload datum fromat
1,2,class incorrectly report duration number
1,2,jetty endpoint ignore host specify in uri expose endpoint on all interface
1,2,component exchange failure not be return number
1,2,delayer not work expect
0,2,spring dsl method element have ref attribute
1,2,component do not remove method uri option
1,2,class executor flag be ignore in multicast processor
1,2,component propagate exception because in class scenario
1,2,class do not source file unit work thus null thus exception be throw
1,2,component add two version number on classpath
1,2,mina vm protocol be not recognise codec option
1,1,component number be need runtime
0,2,file component exclusive read lock strategy use rename
1,1,class sleep empty test do not work
1,2,throttler appear to throttle per thread instead throttle across multiple thread
1,1,class can not lookup bean if endpoint be define directly consumer
1,2,exception stop component bundle
0,2,component to work google chat
0,1,component security extension
0,2,improve jms header name endocingdecode strategy
1,2,pipeline change mep unintended
0,1,tracer allow configuration fix size lead breadcrum let be variable sized
0,2,file consumer support expression set folderfile to consume
1,2,sftp polling can not list directory error
0,1,component uri option method do not support lookup in registry
1,1,start component use main component variable countdown latch be hang
1,2,can only interact servicemixhttp if log be debug
1,1,jetty http class be not close component be stop
1,2,apache component example reportincident dependency remove configuration file
1,2,sql component do not handle wrong number parameter
1,2,component uri set on endpoint have strip all parameter be wrong be well
0,2,seda component configure executor
1,2,two more exception context classloader be null
0,2,xpath expression evaluation rest cache stream
0,2,add method to builder support
1,2,class respect class
0,2,header have value default do not have to set name attribute
1,2,class respect class
1,2,class be not threadsafe
0,2,component improve setting cron expression to be more cron like
1,2,file component well support absolute path
1,2,component add class to be use need to load class instead class to work in osgi environment
1,2,can not load class in osgi environment
1,2,class source file attachment
1,2,class cause to many type converter not possible
0,2,bean component improve method selection logic overloaded method
1,2,source file datum always send last occurence stream
1,2,unable to resolve scripting language in osgi environment
0,1,class only add to repository after process know processing be success
1,2,request route topic node incur number second wait refer to wrong mep
1,2,jmx instrumentation add class even if have define to use class
0,1,add spring configuration in component
1,2,jms send message method fail
1,2,allow parementer append jms binding no endpoint
1,2,class receive do not work
0,2,bean component propagate header
0,2,configuration file class wrap be easy to route jms
1,1,variable variable message header not concatenate send message to http endpoint
1,2,deploy component velocity endpoint servicemix version number get class
1,1,recursively scan multipart node email attachment not top level node
0,2,allow send multipartalternative mime message plaintext source file body allow send image inline
0,2,http component allow failed response to be return on exchange instead exception
0,2,upgrade component to use httpclient version number
0,2,apply method also to underye jms message delegate
1,2,class to be wrap every node incl child
1,2,convert streamreader to string change line break n
1,2,exception use component component in class flow
1,2,sftp method produce os normalize file name do not work sftp
1,2,component producer lose contenttype
0,2,clean component
1,2,warn disable class exchange be not capable on false positive in class
1,2,race condition in class
0,2,clean component
0,1,component source file system proxy setting
0,1,enrich dsl add fluent builder use default aggregation strategy
1,2,class be ignore in producer
1,2,java dsl multicast split aggregate do not use block explicit
0,2,class add support redelivery
1,2,simple language support to concat multiple expression fail if string constant be enclose in single quotation mark
0,2,remove cycle model util
1,2,bean component throw exception bean parameter bind can not convert to method signature type
0,2,well log startup if component use component not
1,1,component bug in sample type converter
1,2,component method do not filter component releate header
0,2,class not throw poll exception on stop
0,1,validator component to use class internally
1,2,component get endless loop call start method if route service call class source file method in be initial method
1,2,failover load balancer prepare exchange before failover
1,2,unable to read post param request
1,2,component build not use platform specific encoding
1,2,license onejar class not include in component source file artifact also apache legal file miss
0,2,upgrade maven build to use apache number pom related feature
0,1,component consumer start directory validate configure properly eg not configuration file dynamic expression etc
0,2,component allow header like class to override destination to send to
1,1,component parsing channel name parameter be incorrect
1,2,class hang sometimes
1,2,component wrong default cause message listener to use new thread receive message
0,2,class wait start all processor route have be start
0,1,ftp component add option to specify retry login attempt
0,2,file component method read lock do not use nio class
0,2,cleanup unnecessary source file relate method in exchange
1,2,jaxb method do not work
1,2,component recover lose connection issue
1,1,component can not process endpoint schema like endpointsmockresult
1,2,class not clean tmp file use file base caching
1,2,route jmx attribute not be update
0,1,provide flag to avoid map jms message to be actual type
1,2,component bundle do not specify class version
1,2,exception throw debug log on
1,2,class not use consistently class not return correct value
0,1,component add option to ignore unsupported charset fallback to platform default instead
0,1,component class replace variable to avoid conflict end user use
1,2,template method service proxy can not be set right component context if be more one component context in spring application context
1,1,bean component invoke method variable even though specific method name have be provide
0,1,component consumer only listen to message on channel ignore direct message
0,1,xmpp producer consumer do not share connection chat object
0,1,component consume method another file work transparent
1,2,xmpp consumer stop consume after time
1,2,unit test failure on window in version number release
1,2,http component throw exception in number release bridge jetty http
0,1,class add nonserializeable header value to outgoing xmpp message
1,2,unit test failure in window class temp file be not delete
0,1,revamp irc component event adapter log
1,2,class incorrect state after restart
0,1,add server name to log event adapter
0,2,component consumer endpoint allow property method method to be manage via jmx
0,1,exchange method method expect type parameter
0,1,component handle method callback
1,2,graceful shutdown problem
0,2,restart class pickup configuration change
0,2,well osgi metadata to allow deploy multiple component version in osgi framework
0,1,spring dsl method only be support on component context route
1,2,component export component lead to split package
1,2,exception bundle be component bundle be inactive
0,1,class add initial delay default number sec
1,1,class do not get convert to string
1,2,improper configuration mina connector acceptor instance well producer
1,2,component bean component not remember last call method name if bean method name be not explicitly specify
0,1,class pre check method be valid report failure on startup
1,2,redundant interception use method
1,2,dynamic recipient list comma be always delimiter even if custom specify
1,1,component extract mail header use multi value insert duplicate
0,1,component class mandate body instead create new empty instance
1,1,http poll consumer do not support timeout
1,2,velocity endpoint not remember last use template uri
0,1,component support method
1,2,support issue route class to jms queue
0,1,bean add method to annotation can configure method name
1,1,component send object message fail if payload can not be convert to serializable
1,2,converter class method do not throw exception value be null
1,2,method class create stream be never close
1,2,type converter respect future exception not fail to convert but error
1,2,rss component parameter filter not work
0,2,workaround exception
1,2,ftp component issue method method
1,1,class use number parameter in jpaql do not work least hibernate jpa provider
1,1,ftp upload can fail file operation fail connection close without indication code number
1,1,logger log info level message debug level
0,2,class wrap more eip aggregator splitter class on child route
0,2,remove dependency on spring core in class
0,1,class do not use local source file exchange in method
1,2,component empty body cause http error number even get use cxfbean
1,2,class node creation throw exception use exchange node name
0,1,improvment in example archtypes
0,2,class support native async requestresponse semantic
0,2,component class check parameter more strictly to ensure have number parameter require
1,1,class set delay method also set max value
0,2,endpoint be improperly set can be very hard to work whywhere
1,2,class be serializable
0,1,component allow property to be set on statement method method etc
1,2,component class enhance cglib skip cglib method
1,1,mock component method do not work expect
1,2,exception during mail connection require folder to be reset
0,2,file producer nio method number bug in jdk
1,2,improper ordering mina filter
0,2,ridiculously long release time due to javadoc plugin
1,2,routing slip do not stop exchange be fail
1,2,component throw error run
1,1,method without exception give report problem
0,1,seda component support no timeout task to complete use timeout number negative
1,2,exception after restart component context
0,1,exception let be able to log additional information custom message current exchange
1,2,class in aggregator be not work correctly
0,2,class url option
0,1,class must be do in finally to ensure even class be throw fore reliable shutdown
1,1,component dataformat class dsl can not work
1,1,component miss class in source file
1,1,jdbc component do not preserve header
1,1,np check remote service be wrong in component
0,1,in spring xml support use method to lookup reference endpoint
0,1,package log warn use method instead keep option remove warn
0,1,class log exception in method
0,1,class make easy to ignore unwanted event category
0,1,component add option to select jdbc number number column label name semantic
0,1,keep method timestamp write file
1,2,remove sample cache component cache component
0,1,bean expression non registry bean can not reference instance
0,2,let class be reusable builder be not route base
0,2,component cglib proxie class have trouble use annotate bean binding
0,2,remove dependency
0,1,class let load upfront
1,2,file component use method option well detect constant vs dynamic name
0,2,component start route service order
0,1,mock component expect header property output name fail
1,2,class differentiate void method return null value
1,2,cxfbean propagate variable component component to use
1,2,class dosnt filter class connection pragma trailer class upgrade via warn in method component
1,1,warn log class class do not have class annotation
1,1,class filter http date header component be call
0,1,seda endpoint let be easily to configure size option to use unbounded queue
1,1,component velocity change case all field property header
1,1,component freemarker change case all field property header
0,1,class add reset method
1,1,component throw exception in method route no destination
0,1,class support boolean on begin to support skip polling
1,2,karaf configuration file use servicemix commonspool bundle
0,1,class add check to limit method to number to prevent mistype
1,2,use servicemix jaxws version number spec bundle but not geronimo one
1,2,class do not support jms uri selector
0,2,batch resequencer issue class
1,2,async route not work mina
1,2,exception occur in variable
