type,priority,summary
0,1,avoid materialization possible cloning collatorsqlclob
1,2,variable fail weme number source file class
0,2,like alternative location configuration file
1,2,exception in class
0,2,allow database user to execute store procedure permission database owner andor routine definer
0,1,remove version number
1,2,complation prepared statement result in syntax error
1,2,failure in number test cdcfoundation ibms weme version number
1,2,can not use dblook on softupgraded database class variable do not exist
0,2,corrupt database prevent startup be automatically repair perhaps
1,2,number failure number error ibm version number after revision number component
1,2,test source file fail method ibms number
1,1,class fail due to empty jrelib directory
1,2,invalid conversion timestamp to string call method calendar
1,1,broken logic avoid testing across midnight in class
0,1,expose name toplevel test suite easy scripting
1,1,method do not work weme version number
1,1,hide assumption in method
0,1,reduce size encode buffer short character value
0,2,write regression test to verify behavior class
1,2,unidiomatic error handle in class
0,1,deadunreachable code in class
1,1,few argument generate variable error
1,2,union boolean method datatype be reject
1,1,column rename loose identity attribute
0,1,internal assignment tablenumer columnnumber look wrong in query tree although no ill effect be see
0,1,add method to obtain bogus port in class
1,1,complex nest join problem
0,2,enable boolean type column
0,1,add more information to variable return store
1,2,exception on syntax error invalid commit
1,1,class return incorrect invalid date string
1,2,component add new message to component during engine shutdown change database shutdown message need to update doc information
1,2,test failure in component ibm jvms
1,2,file miss asf license header
1,2,exception insert table have generate column insert trigger
1,2,miss escape apostrophe in many message
1,2,sequence do not work in insertselect
1,1,method method do not agree on trail zero
1,2,class run do not unwrap exception can lead to failure method
1,2,override mechanism configuration file work backwards
1,1,error be display if use wrong classpath to make documentation target release
1,1,recompilation may cause duplicate entry in xplain table
1,1,miss method in class
0,1,simplify variable class
1,2,exception in method ibm jvm version number
0,1,unchecked warning in class vti demos
1,2,exception call boolean metadata function version number client version number server
1,1,thread local method be not remove app thread component be shut down
0,1,refactor access to primary structure in class
1,1,embeddedxadatasource createtrue attribute set in method fail exception database not available
1,2,four replication test fail on method error method do not succeed
1,2,method may throw exception cause confuse console stack trace server shutdown
1,2,instability in component
1,2,test failure in class in method
1,2,variable stick in version number
1,1,embed component do not start component be dynamically upload add to classpath
1,2,backward confusing error message use wrong class method in client driver
1,2,exception run class ant
1,2,race condition in method reopen class after interrupt
1,2,replication test lose component slave
1,2,retry after interrupt in store pop bug in component in case
1,2,failure in variable number number
1,2,alter table drop column may leave trigger invalid even if be not use column getting drop
1,2,class can fail error number require property component have not be set slow configuration
0,2,release note specify java version be need to run component
1,1,intermittent bug in class
1,1,patch fix npe in error condition
1,1,patch client driver lexer to determine statement type fix bad attempt incremente variable
0,1,patch remove erroneous throw clause on non derivable method do not throw
1,1,patch override equal correctly
1,1,can not find ant library build class
1,2,class fail after enable automatic calculation index statistic
1,1,patch derive class attempt fail to override method base
0,1,patch source file be native be more performant
1,1,patch bad field masking make non functional method evaluation
1,2,class on new boolean type throw exception
1,2,assert failure in class
1,1,intermittent assert failure in method
1,1,patch bad name collision cause non functional method
0,1,patch reduce superfluous boxing histrionic
1,2,embed driver allow method on boolean column
0,1,patch remove unused fetching datum dictionary
0,1,patch use string buffer build string in loop
1,1,test method ibm version number in method exception exception error interrupt flag lose be throw evaluate expression
0,1,patch move instanceof check cast occur
0,1,patch remove non productive instanceof check
1,1,incorrect list compatible jre version in client trace
1,2,component cause regression not allow user to drop table if table be involve in trigger action rebind during alter table drop column
1,2,exception in class during shutdown
1,2,after specify deregisterfalse on engine shutdown url component forget default behavior be deregistertrue
0,2,disable istat log default
1,1,exception in istat daemon encounter critical exception during shutdown
0,1,patch avoid boolean allocation rowset datum in client cursor
0,1,patch avoid integer allocation fetch client meta datum info
1,2,class depend on implicit ordering test case
1,2,class depend on implicit ordering test case
1,2,lack cleanup in method
1,2,assert failure in method
1,2,class fail dummyint be not recognize function procedure
1,2,component class foo already exist in schema app
1,2,nightly test failure in component
1,2,incomplete quoting sql identifier in class
1,2,class fail pmdd be not recognize function procedure
1,2,can not rollback after syntax error in internal statement
1,2,clob inout arg set to null procedure do not preserve null value reinvoked
1,1,patch fix sql cleanup handling
0,2,class ignore gcj installation
1,2,set network server management test hang intermittently
1,2,interrupt create table index variable container throw number nio connection survive
1,2,client driver silently truncate string exceed number
0,2,remove usage class to obtain embed connection in component server
1,1,assert failure in test method interrupt flag clear
0,1,method null method null do not return column meta synonym
0,1,simplify bytecode generation concatenation operator
1,1,warning regard class display generate class
1,2,table create version number constraint can not be drop version number due to exception insane build assert failed fail to find sharable conglomerate descriptor index conglomerate sane build
1,1,engine code reference component
1,2,intermittent class in class
1,2,large batch ddl in database procedure die on transaction severity error
0,1,update toolsidenetbeans directory
1,2,unable to boot version number database fail during softhard upgrade process new version number try to drop jdbc metadata
1,2,test failure exception number weme version number in component
1,2,class view
0,1,change component to print class well fixture name
0,1,remove dead method june number
1,2,assert failure case expression in group clause
1,2,incorrect use class in class
1,2,repeat database creation cause class
1,2,start number weme version number upgrade test start fail number failure number error exception
1,2,class fail on method
1,2,number fail on method
0,2,restrict table function support pass not equal restriction to method
1,2,class in method in class
1,1,exception in class in replication slave mode method
1,2,default only dbo be allow to run several diagnostic class
1,2,intermittent failure in class class
1,2,method fail on method error number class name exceed vm limit
1,2,method fail exception unparseable date thu sep number number c number
0,2,make component run on oracle java I embed client
1,1,on method component method
1,2,unauthorized shutdown not generate thread dump javacore class dump number javacore ibm jvm normal user error
1,2,empty map table in toursdb
1,2,class may fail to destroy process timeout be specify
1,2,error number deadlock in nst on select method
1,2,problem run class replication test on open jdk number mac os x
0,1,ant release not modify drdamaint version
0,1,speed message splitting in build
0,1,speed creation bin script
0,1,do not run class unless message have change
0,1,reduce number jar invocation in source file target
1,2,restrictive file permission permission remove also owner on ntfs if acl do not contain explicit entry owner
1,2,value return successive call to sequence generator
1,2,exception in class
0,2,subquery be only allow to return single column use component hibernate jpa query be create per jpa spec table multicolumn pk subquerie be create two column in select clause
1,2,class number replication test not prepare space in class
1,2,class class component already exist
1,2,class exception in indexstatthread
0,2,harden password source file in builtin authentication service
0,1,call method method without reflection in basejdbctestcase
0,1,remove unnecessary field method in class
1,2,class fixture method fail intermittentlyt
1,2,component thread hang use clientxadatasource deadlock lock timeout occur
1,2,exception in generate vti code
1,2,class number number ibm version number version number on window xp in variable fixture method
1,2,java deadlock class number patch attach
1,2,race condition in class check null physical connection
0,2,network server reject client connection be not component network client
1,2,method fail drop view can not be perform due to dependency
1,2,error not hold lock after commit in class
1,2,class get multiple error try to delete filesdirectorie during teardown
1,2,access deny source file method in method
1,2,select statement subquerie group count distinct statement return wrong number result
0,1,patch access static constant static reference
0,2,prepare old test harness run test on java number
1,1,class print exception connection reset to console but test pass
1,2,exception in store run select in readonly database access via classpath subprotocol authentication authorization java security be turn on
1,2,system can run stack space process class request
1,2,class in class on method
0,2,get upgrade test to pass on ojec version number
1,1,native warn password expiry dbo
1,2,roll back transaction lead to inconsistent state
1,2,foreign key constraint on table be drop associate statistic row conglomerate be not remove
1,2,back concurrency improvement identity column introduce component
1,1,intermittent test failure in component
1,2,authorization decorator do not null connection do
0,1,clean statement in class
1,2,class keep reference to nondefault connection
1,2,method do not call method
1,2,class hold on to resource after completion
1,2,class hold on to resource after completion
1,2,class hold on to resource after completion
1,2,class keep reference to statement after completion
1,2,class keep reference to connection after completion
1,2,class do not call method
1,2,class lack call to method
1,2,class forget to call method
1,2,class sometimes keep reference to connection
1,2,replication test keep reference to connection after completion
1,1,class do not clean test resource
1,2,exception in method cause class
0,1,remove unsued code in method
0,2,native user authentication improve wording error message
1,1,send empty string table name to compress table procedure empty string index name to update statistic procedure make parser throw exception
1,1,missing argument in number error
0,1,use class possible
1,1,upgrade test print full exception stack trace fail to access old version
1,2,table function only accept argument be constant in query block
0,1,remove duplicated code start remote process in replication test
0,1,replication test use method to run local command
0,2,make possible to turn encryption on already encrypt database
1,1,documentation in release do not include source file
0,1,remove unused method in variable
1,2,class in method
0,1,disable source file on platform do not support variable sji
0,1,remove unused class class
0,1,add method to junitcore ant target
1,2,method fail error expect error indicate db be readonly on hp java version number
1,2,make class threadsafe
1,2,use variable can set database version to garbage string prevent boot database
0,1,clean ide warning in class
0,2,remove unused method in class class
0,1,remove jdbc number constant variable
0,1,prune broker class tree
0,2,add message argument name comment to source file message file produce class
0,1,simplify number implementation class tree
1,2,order argument name in configuration file be sometimes wrong argument occur in message sequence
1,1,break handling path special character in method
0,1,add number class to method
1,1,incorrect list compatible jre version in client trace method
0,1,add utility method to query state url attribute in class
1,2,miss method exception raise use clobs territory base collation
1,2,exception in select involve subselect window function
1,1,timestamp comparison failure in method
1,2,encryption reencryption unencryption silently fail if database be already boot
1,2,grammar do not accept operator without parenthesis
0,1,stop produce byte code nonexistent qualifier
0,1,use method to start process class
1,1,replication test fail on cdc platform without optional jsse package
1,2,class assert failure only one waiter be abort
1,2,exception in insert select order
1,2,in list mixed type may return wrong result
0,2,lift arbitrary limit on number routine parameter
1,2,in list multiprobe primary key not choose on table number row
1,2,failure in method relate to index cardinality statistic
1,2,number error in nightly test run on weme after jacoco propertypriviledge checkin
1,2,package javadoc source file date
1,2,component fail handle be invalid exception
1,2,upgrade test fail on number
1,2,investigate set login timeout cause class to fail run in suite
1,2,ssl test network server can hang if method fail something exception
1,2,source file error in class part class
1,2,select view upper in list throw exception
1,2,nightly regression test failure intermittent error component
1,2,nightly regression test failure component column value mismatch column number
0,2,add automatic cleanup connection open method
1,2,component do not report warning raise table function
0,1,simplify code handle lob file
1,1,interrupt restart clock login timeout
0,1,clean register format ids
1,2,class do not proprogate original jvm flag to spawn jvm lead to lab regression test failure
1,1,cleanup suspect code practice in component package
1,2,query view name like number escape fail
1,1,cleanup suspect code practice in component package
1,1,cleanup suspect code practice in component package
1,1,cleanup suspect code practice in component package
1,1,cleanup suspect code practice in component package
1,1,cleanup suspect code practice in misc component package
0,2,make optimizer trace logic pluggable
1,1,exception call procedure subquery argument
1,2,issue late jdk number ea build because missing class
1,1,class assertion error on content stdout subprocess
0,2,use jvms cache number instance in class
0,1,remove unnecessary check exception in client
1,2,class fail on late jdk number ea
1,2,method test fail in nightly regression test
0,2,add ability to print component execution class xml
0,2,add ability to compactly specify complete query plan in optimizer override
1,2,exception use more one parameter in coalesce
0,1,use source file in method
0,1,allow test to show detailed error spawn new process fail
0,1,simplify class use method
1,2,intermittent failure in method
1,2,method variable unexpectedly null
0,2,log page dump to component if error nospc variable be return to user
1,1,fix incorrect throw exception tag in javadoc
1,2,method return number have implement jdbc version number
0,1,simplify class use be mutable
0,1,remove profile attribute jar file manifest
1,2,failure in component error number have be cause indexconstraint
1,2,exception in variable
1,2,create trigger do not detect all illegal reference to session schema
1,2,error in version number if component be first in classpath
1,2,exception in class
1,1,exception launch component window subst drive
1,2,configuration file select privilege be check in subquerie
1,2,incorrect handling use update to set identity column to default
1,2,incorrect privilege may be require insert delete statement
1,2,connection open class never get release
1,2,exception call function trigger
1,2,configuration file loop in method
1,2,class api break username password contain nonascii character
0,2,create regression test fail if class one component jar file leak another jar file
0,1,revamp vti demo to look behave more like demo
0,1,include class in client exception message
1,2,optional tool registration may fail because class be not always available execution time
1,2,intermittent error in nightly regression test class
1,2,start network server on network drive fail jdk number on window
1,2,error configuration file function procedure
0,1,remove class implementation
0,1,remove method field subclass class
1,2,syntax error reference to transition variable have whitespace around
1,2,source file locale flunk class
1,2,component fail start version upgrade trajectory be version number
1,2,sequence generator make create trigger fail internal error
1,2,not elimination case expression be break
1,1,variable function throw exception in update statement
0,1,simplify handling untype null in case nullif expression
1,2,incorrect nullability case expression parameter
0,2,add class ij command to match class
1,2,class fail update sequence value on disk
1,2,broken link in api doc to component documentation
1,2,user procedure can call system procedure circumvent sql authorization
0,1,use configuration file interface class support
0,2,check type usersupplied module before create instance
0,1,support standard syntax alter column nullability
1,2,compilation error use view source datum set merge statement
1,2,rollback to savepoint allow violation deferrable constraint
0,2,allow component to rename table reference foreign key
1,2,permission problem run class test ant version number
1,2,variable not be allow argument in procedure call
1,1,assert exception use count in merge matching clause
1,2,oome run class small heap
1,2,add component to class path script in bin directory
1,2,add component to maven artifact source file
1,2,can not create lucene index if key column name be casesensitive
1,2,jacocojunit target fail to store coverage datum subsuite
0,2,update statement collect generate key if variable flag be supply to jdbc call
0,2,remove need source file execute ij upload on ibiblio
1,2,fix hardcoded jdbc version number type constant
1,2,in variable certain test order because exception
0,1,utilize jql to fetch jira issue list release note generation
0,1,remove unused parameter in splitmessage
0,2,open modal window without class
1,2,miss number url encoding
1,1,wrong source path in configuration file
1,1,component fail call method on class to mount resource
0,2,make debug setting session dependent
0,2,support case insensitive mount path
1,2,class do not set request parameter unchanged form field
1,2,exception in source file
0,1,russian configuration file
0,2,extract class interface class
1,1,lazyregistration fail mount resource
0,1,remove class version number
1,2,exception after deserialize component
1,2,wrong handling exception method method
1,2,mount url fail if method be blank
0,2,set session locale construct session object
0,2,access to init parameter method not work
0,2,extend case exception can be ignore due to aborted request
0,2,default code popup always try to bring pop window to top focus
1,1,test class method be not be invoke if class be enable notification
0,2,table backgroundfoo url prefix
1,2,component method versione
1,1,uncaught exception guese url use class
1,2,create method class
1,2,remove comment markup can fail
1,2,exception in class
1,2,component deprecation component
1,1,allow to set field value before submit form ajax in component
1,1,pallete be miss in html
1,2,call to enable method not be do in component resolving
1,2,class do not correctly identify tld more number letter
0,2,remove class synchronize block use
1,2,class interrupt cycle send number pageclass can not be find
0,1,translation czech language
1,1,class on method do not update label model only editor
0,2,download link do not set class class header
1,2,class incorrectly convert model value custom boolean converter be instal
1,2,inheritable model can not be wrap model
0,1,clock component do not display second in locale
1,2,class only set target attribute exist in markup
0,2,add ability to manage disabled item subclass class
0,2,class support nonsingleton bean
1,2,component miss localization class palette
1,2,converter misusagemangling in class
0,1,patch do not serialize choice select in palette
1,2,component code utterly break class
1,1,class empty model wrong default encoding special char
1,2,use border markup inheritance cause component resolution failure
0,1,handle servlet mapping fail consistenly
0,2,be able to add string array to configuration class
1,2,ajax request do not detach component model
1,2,exception in method
0,1,improve reporting on locked page map
1,2,mvn jettyrun mavenjettyplugin not configure
1,2,add global override to disable gzip compression sap doublecompresse
1,2,feedback be not clean upon class
0,2,investigate whether can use component meta datum storage feedback message
1,2,class comment strip do not handle regexps
0,2,change name class
1,2,class do not function opera
0,1,well error message problematic configuration
0,2,class be miss if be component
1,2,use class everywhere query string be construct
1,2,class escape ampersand twice regression
1,1,test be test
1,1,component do not bind create session to class
1,1,method can return time on day rather next day
1,2,method do not work class affect class etc
1,1,class force relative url
1,2,prototype scope spring bean
1,1,component try to call method even if be not change default do not work on strict class
1,2,method empty resource be mount
0,1,component greyonwhite colour scheme be very hard to read
0,1,component source code view be not resizable
0,1,fire onchange event associated component after date selection
0,2,enhance ichoicerenderer idchoice object lookup
1,2,patch remove xx in firefox palette
0,1,class need model add class
0,1,class be sessionheavy
1,2,component not work markup inheritance
1,1,method not attempt to render content if method be false
1,2,if model be list class do not try to find field
1,2,class do not work
1,1,invoke request listener on page return expired error page
0,1,unable to remove class form
0,2,make method final again remove final convert be rename to method
0,2,make default maximum upload size application setting
0,2,component because component
1,2,component not handle multipart form without upload
1,2,class do not work use safari
0,1,qualified resource key take priority unqualified one
1,1,method on page throw exception
1,2,method generate wrong relative path if current page have class in param
0,2,add support localization
0,2,disable lineprecise exception component use check
1,2,default pagemap name null be not always properly encode url
1,1,select do not validate require
0,1,easy access to final render page source
1,2,method do not properly redirect ajax request
0,1,upgrade to number to version version number
1,2,method do not work binary file
1,2,empty content insert border throw ugly exception
1,2,session encoding problem in cookieless mode
1,1,no scroll behaviour source code viewer in ie number
1,2,ajax source file fail fragment be include in target
0,1,use class if be specify
1,2,class not work
1,2,more problem ajax transparent container
1,1,javadocs method method be swap
1,2,class class factory method pass in id
1,1,exception class in component
1,2,method miss in component
1,2,markup hirarchy get mess value attribute background be relative path
1,2,typo in component cause ajax tree node addition failure
0,1,option to align class to left icon
0,2,add class to class element class etc to facilitate css styling
1,2,class null class raise exception
1,2,unable to find class inside class
1,2,if form include class class form be source file exception occur user switch change label to another
1,2,component no long set application on current thread
1,2,be no way to specify what exception to log in class
1,1,method not call on class content
1,2,tree not redrawn reset root node
1,1,inconsistent state after set class to true in class
0,1,minor patch in source file translation
1,2,embed jetty configuration stop work on number
1,1,component support class
1,2,class be not synchronize
1,2,default button do not provide button name
1,1,class unary constructor expect model instead class
1,2,static page pass uri to component page number error
0,1,component javadoc standardization component
1,2,exception in component
1,2,patch javascript error in number select date
1,1,text not visible in component ajax debug window
1,1,method do not work on yui class
0,1,fix todo version number method
0,1,javadoc typo
1,2,class do not get clean in ajax request renderstrategy be variable
1,2,class do not take stylelocale account
0,1,component javadoc standardization component
0,1,component javadoc standardization component
0,2,remove final class method
0,1,correct javadoc fragment
0,1,miss img alt attribute in component
0,2,extend class stateless page
1,2,method be not propagate to attach class
1,2,problem close class use class
1,2,class method really be method
1,1,xhtml validation failure class
0,1,change log in method error to warn
1,2,class utilize variable node child container cause error add child
0,1,add sanity check on form submit request method
0,1,tolerate malformed class header
